questionExternalId,sourceLanguage,targetLanguage,questionTextSource,explanationSource,answerASource,answerBSource,answerCSource,answerDSource,questionTextTarget,explanationTarget,answerATarget,answerBTarget,answerCTarget,answerDTarget
2.2.21-008,en,ru,To what should you pay attention if you want to take a passenger on the motorbike?,"When increasing the load on your motorcycle, make sure to increase the tire pressure, adjust the chassis/suspension. Your passenger should also wear a helmet and protective gear",The passenger should also be wearing protective motorcycling clothing,The chassis should be adjusted accordingly,The tyre inflation pressure should be adjusted,,"На что следует обратить внимание, если Вы хотите взять пассажира на мотоцикл?",При увеличении нагрузки на мотоцикл необходимо повысить давление в шинах и соответственно отрегулировать ходовую часть/подвеску. Пассажир также должен быть в шлеме и защитной мотоэкипировке.,Пассажир также должен быть в защитной мотоциклетной одежде,Ходовую часть следует соответственно отрегулировать,Давление в шинах следует отрегулировать,
2.2.21-009,en,ru,What must you be aware of if you want to take a pillion rider with you?,"The passenger(s) must be physically and mentally able to ride, and the motorbike must be adequately equipped.",The motorbike must be licensed to carry 2 people,The pillion rider must be capable of riding with you,"A child pillion rider over 7 years of age, must be able to use the existing footrests and hand grips",,"Что Вы должны учитывать, если хотите взять с собой пассажира на заднем сиденье мотоцикла?","Пассажир должен быть физически и психически способен ехать с Вами, а мотоцикл должен быть соответствующим образом оборудован.",Мотоцикл должен быть допущен к перевозке 2 человек,Пассажир должен быть способен ехать с Вами,Ребёнок-пассажир старше 7 лет должен иметь возможность пользоваться имеющимися подножками и ручками,
2.2.21-010,en,ru,How does riding with a pillion rider affect the handling of a motorbike?,The pillion rider's own movement destabilises the motorbike. Riding with a passenger should be practised.,It is more difficult to keep the motorbike stable,Its behaviour changes when braking,There is a reduction in its sensitivity to side winds,,Как поездка с пассажиром влияет на управляемость мотоцикла?,Собственные движения пассажира дестабилизируют мотоцикл. Езду с пассажиром следует заранее потренировать.,Становится труднее удерживать мотоцикл устойчивым,Поведение при торможении изменяется,Чувствительность к боковому ветру уменьшается,
2.2.21-011,en,ru,You want to transport a pillion passenger and luggage on your motorbike. What must you be aware of?,"You must not exceed the permissible total weight for the motorbike. This is made up of the unladen weight and the maximum permitted load. To prevent luggage from flying around, it must be securely fastened. The lighting equipment must be visible at all times and must not be obscured by the loaded luggage.",The maximum authorised mass may not be exceeded,Pieces of luggage must be securely fastened,Lighting systems may not be obscured,,Вы хотите перевозить пассажира и багаж на мотоцикле. Что необходимо учитывать?,"Нельзя превышать разрешённую максимальную массу мотоцикла. Она складывается из собственной массы и максимально допустимой нагрузки. Багаж должен быть надёжно закреплён, чтобы он не мог сместиться или упасть. Световые приборы всегда должны оставаться видимыми и не должны закрываться багажом.",Разрешённая максимальная масса не должна быть превышена,Предметы багажа должны быть надёжно закреплены,Световые приборы не должны быть закрыты,
2.2.21-012,en,ru,You want to transport a pillion passenger. What must you ensure before commencing your journey?,"In principle, when a pillion passenger is carried, the passenger seat, footrests and a holding device must be available on the motorbike. Both rider and pillion passenger must wear a suitable safety helmet while riding. To ensure a safe ride, you must instruct the pillion passenger on the correct behaviour before the ride.",- that my pillion passenger is wearing a suitable helmet,- I have instructed my pillion passenger on how to behave while we are driving on the road,- the bike's technical adjustment settings for carrying a pillion passenger are used,,Вы хотите перевозить пассажира на заднем сиденье. В чём Вы должны убедиться перед началом поездки?,"В принципе, при перевозке пассажира на мотоцикле должны быть предусмотрены пассажирское сиденье, подножки и устройство для удержания. Водитель и пассажир должны ехать в подходящих защитных шлемах. Для безопасной поездки пассажиру перед началом движения нужно объяснить правильное поведение.",- что мой пассажир носит подходящий шлем,- что я проинструктировал пассажира о поведении во время движения по дороге,- что используются технические настройки мотоцикла для перевозки пассажира,
2.2.21-013,en,ru,What should you anticipate if you want to take a pillion passenger with you?,"Be aware that the additional weight of the passenger will make your motorbike more slow and shift the centre of gravity backwards. You will therefore no longer be able to corner quite as dynamically as without a passenger.
You should also be aware that the additional weight can make your overtaking distance noticeably longer.",The vehicle's handling will be different when cornering,The overtaking distance may be longer,The braking distance will be reduced,,"Чего следует ожидать, если Вы хотите взять с собой пассажира?","Дополнительный вес пассажира делает мотоцикл менее динамичным и смещает центр тяжести назад. Поэтому прохождение поворотов будет уже не таким динамичным, как без пассажира. Также следует учитывать, что дополнительный вес может заметно увеличить дистанцию обгона.",Управляемость транспортного средства в поворотах изменится,Дистанция обгона может стать больше,Тормозной путь сократится,
2.2.21-014,en,ru,What conditions must you fulfil to be allowed to carry a five-year-old child on your moped?,"It is required by law that you must be at least 16 years old if you want to take a child under 7 years old with you on the moped. 
Since the child is under 7 years old, you must be able to attach a special child seat to the moped. The child's height and body control are not yet sufficient to hold on to the moped safely and independently. You also need to make sure that the child's feet cannot get caught in the wheels. There are special protective devices for this, such as: B. Footrests.",- be at least 16 years old,- fit the moped with a special child seat,- make sure that the child’s feet cannot get caught in the wheels,,"Какие условия необходимо выполнить, чтобы перевозить пятилетнего ребёнка на мопеде?","По закону, если Вы хотите взять на мопед ребёнка младше 7 лет, Вам должно быть не менее 16 лет. Поскольку ребёнку ещё нет 7 лет, на мопеде должно быть установлено специальное детское сиденье. Рост и способность ребёнка удерживаться ещё недостаточны для безопасной самостоятельной посадки. Кроме того, необходимо исключить попадание ног ребёнка в колёса; для этого существуют специальные защитные устройства, например подножки.",- быть не моложе 16 лет,- оборудовать мопед специальным детским сиденьем,"- убедиться, что ноги ребёнка не могут попасть в колёса",
2.2.21-102,en,ru,You are driving a truck with a trailer and wish to give someone a lift as a favour. Where are you allowed to carry such a passenger?,"For safety reasons, you may only carry people inside the cab of a truck. Taking somebody with you on the load platform is not permitted. Only certain persons may exceptionally ride on the loading platform, if, for example, they are responsible for escorting the load.",In the driver's cab,On the floor of the truck,On the floor of the trailer,,Вы управляете грузовым автомобилем с прицепом и хотите из любезности подвезти человека. Где разрешено перевозить такого пассажира?,"По соображениям безопасности людей в грузовом автомобиле разрешается перевозить только в кабине. Перевозка человека на грузовой платформе запрещена. Исключение возможно только для определённых лиц, например если они сопровождают груз.",В кабине водителя,На полу грузового автомобиля,На полу прицепа,
2.2.21-103,en,ru,What must you ensure before setting off on a journey in your car?,The car driver is responsible for the safety of the passengers and the cargo. He/she must take all necessary measures to prevent or minimize damage. The loading must be carried out in accordance with regulations and must be carefully secured.,That the passengers can put on the existing safety belts,That you have an adequate view to the rear,"That no objects (e.g. first-aid kit, road atlas, camera) are lying loose on the rear parcel shelf",,В чём Вы должны убедиться перед началом поездки на легковом автомобиле?,"Водитель автомобиля отвечает за безопасность пассажиров и груза. Он должен принять все необходимые меры, чтобы предотвратить или уменьшить возможный ущерб. Загрузка должна выполняться по правилам и быть тщательно закреплена.",Что пассажиры могут пристегнуться имеющимися ремнями безопасности,Что у Вас есть достаточный обзор назад,"Что на задней полке не лежат незакреплённые предметы, например аптечка, дорожный атлас, камера",
2.2.21-104,en,ru,How are you allowed to transport a small child in your car?,Toddlers must be specially secured. This is only possible with an age-appropriate restraining device. This is to be mounted on the back seat. Infants are at risk to be suffocated by the airbag in the event of an impact. A baby seat is not secure enough.,In an approved child restraint with test mark,On the lap of an adult,In a baby carrycot on one of the back seats,,Как разрешается перевозить маленького ребёнка в автомобиле?,Маленькие дети должны быть специально закреплены. Это возможно только с помощью подходящего по возрасту удерживающего устройства. Его следует устанавливать на заднем сиденье. При срабатывании подушки безопасности младенцам грозит опасность удушья. Переносная люлька недостаточно безопасна.,В разрешённом детском удерживающем устройстве с контрольным знаком,На коленях у взрослого,В детской люльке на одном из задних сидений,
2.2.21-105,en,ru,How are you allowed to transport a five-year-old child in your car?,"If you want to bring a five-year-old child with you in your car, you must use a child seat that has been tested and adapted to the size of the child. This is mandatory for all children under 12 years.",In a suitable and approved child seat with test mark,In a back seat with standard three-point safety belt,On a back seat with waist belt fastened,,Как разрешается перевозить пятилетнего ребёнка в автомобиле?,"Если Вы хотите взять с собой в автомобиль пятилетнего ребёнка, необходимо использовать проверенное детское сиденье, соответствующее размеру ребёнка. Это обязательно для всех детей младше 12 лет.",В подходящем и разрешённом детском сиденье с контрольным знаком,На заднем сиденье со стандартным трёхточечным ремнём безопасности,На заднем сиденье с пристёгнутым поясным ремнём,
2.2.21-106,en,ru,"How are you allowed to transport an eleven-year-old child of 140 cm (4'11"") in your car?","An eleven-year-old child that is 140 cm tall needs a children's seat or a booster seat. The child is to be fastened with the belt. Children under the age of twelve or under 150 cm tall must be carried. If the strap rests on the neck, there is a risk of strangulation.",On an approved raised seat with test mark and with three-point safety belt fastened,With three-point safety belt fastened,On a back seat with waist belt fastened,,Как разрешается перевозить одиннадцатилетнего ребёнка ростом 140 см в автомобиле?,"Одиннадцатилетнему ребёнку ростом 140 см необходимо детское сиденье или бустер. Ребёнок должен быть пристёгнут ремнём. Детей младше 12 лет или ниже 150 см необходимо перевозить с использованием соответствующего удерживающего устройства. Если ремень проходит по шее, возникает опасность удушения.",На разрешённом бустере с контрольным знаком и с пристёгнутым трёхточечным ремнём безопасности,С пристёгнутым трёхточечным ремнём безопасности,На заднем сиденье с пристёгнутым поясным ремнём,
2.2.21-107,en,ru,What should be borne in mind when using an approved child seat with test mark?,Child seats are made for different age groups. They are safety-tested for the specified weight and size groups. You should pay attention to this when using it. The child seat may only be used on those car seats for which it is suitable and approved.,The child seat must be appropriate for the height and weight of the child,The child seat must be capable of attachment to the seat of the vehicle for which it is intended,Nothing apart from the test mark,,Что следует учитывать при использовании разрешённого детского сиденья с контрольным знаком?,"Детские сиденья предназначены для разных возрастных групп. Они проверены на безопасность для определённых групп веса и роста. При использовании на это необходимо обращать внимание. Детское сиденье можно использовать только на тех сиденьях автомобиля, для которых оно подходит и разрешено.",Детское сиденье должно соответствовать росту и весу ребёнка,"Детское сиденье должно иметь возможность крепления к тому сиденью автомобиля, для которого оно предназначено","Ничего, кроме наличия контрольного знака",
2.2.21-108,en,ru,Why is it dangerous not to wear safety belts?,"In an accident, a person may be easily thrown out of the vehicle by the impact energy, or injured in the vehicle by a collision. Already at 20 km/h the impact energy is so high that injuries can occur.",Because you cannot adequately protect yourself in case of an impact at a speed of about 20 km/h,Because in case of an accident you can be projected out of the vehicle,Because of the low speed there is no danger in urban traffic,,Почему опасно не пристёгиваться ремнём безопасности?,"При аварии человека может легко выбросить из автомобиля силой удара или он может получить травмы внутри автомобиля при столкновении. Уже при скорости 20 км/ч энергия удара настолько велика, что возможны травмы.",Потому что при столкновении на скорости около 20 км/ч Вы уже не сможете достаточно защитить себя,Потому что при аварии Вас может выбросить из автомобиля,Потому что из-за низкой скорости в городе опасности нет,
2.2.21-111,en,ru,At which impact speed must you reckon with serious or deadly injuries when no safety belt is worn?,"Without a seat belt, serious injuries can occur in a collision just over 20 km/h. This also applies to rear-end collisions which are often wrongly considered harmless. That's why you should always fasten your seat belt, even on short distances.",From 30 km/h onward,From 50 km/h onward,From 80 km/h onward,,"Начиная с какой скорости столкновения следует ожидать серьёзных или смертельных травм, если ремень безопасности не пристёгнут?","Без ремня безопасности серьёзные травмы могут возникнуть уже при столкновении на скорости чуть выше 20 км/ч. Это относится и к ударам сзади, которые часто ошибочно считают безобидными. Поэтому ремень безопасности нужно пристёгивать всегда, даже на коротких расстояниях.",Начиная с 30 км/ч,Начиная с 50 км/ч,Начиная с 80 км/ч,
2.2.21-112,en,ru,A car is equipped with two front air bags. On which seats must safety belts be worn?,"The front airbags protect the car driver and the co-driver in the front seat in the event of a strong impact, for example a rear-end collision. However, they are not sufficient for comprehensive protection. All passengers must fasten their seat belts each time they drive.",On all seats,Not on the front seats,On the front seats only,,Автомобиль оборудован двумя передними подушками безопасности. На каких сиденьях необходимо пристёгиваться ремнями безопасности?,"Передние подушки безопасности защищают водителя и переднего пассажира при сильном ударе, например при столкновении. Однако они не обеспечивают полной защиты. Все пассажиры должны пристёгиваться ремнями безопасности при каждой поездке.",На всех сиденьях,Не на передних сиденьях,Только на передних сиденьях,
2.2.21-113,en,ru,What does this warning sign mean?,"The note warns against the wrong installation of the children's seat. If the children's seat is mounted so that the child sits in the opposite direction of travel, the child may be seriously injured in the event of a collision and the impact of the airbag. The children's seat must be installed in the direction of travel.",- you are not allowed to install a child seat opposite to the direction in which the vehicle is travelling,- you may only install a child seat facing the direction in which the vehicle is travelling,- you must install the child seat as illustrated,,Что означает этот предупреждающий знак?,"Предупреждение указывает на неправильную установку детского сиденья. Если детское сиденье установлено так, что ребёнок сидит против направления движения, при столкновении и срабатывании подушки безопасности ребёнок может получить тяжёлые травмы. Детское сиденье должно устанавливаться по направлению движения.",- нельзя устанавливать детское сиденье против направления движения автомобиля,- детское сиденье можно устанавливать только по направлению движения,"- необходимо установить детское сиденье так, как показано на рисунке",
2.2.21-114,en,ru,You wish to take several small children home after a children's birthday party. What must you observe when using your car?,"If you want to bring several small children home with your car, you must ensure that your passengers are secured in all places with the legally required restraining devices.",The children must be secured with the prescribed child restraints,Child restraints need not be used within built-up areas,It is sufficient to secure the children with the existing safety belts,,Вы хотите отвезти домой нескольких маленьких детей после детского дня рождения. Что необходимо учитывать при использовании Вашего автомобиля?,"Если Вы хотите отвезти домой нескольких маленьких детей на своём автомобиле, Вы должны обеспечить, чтобы все пассажиры были закреплены на всех местах с помощью предусмотренных законом удерживающих устройств.",Дети должны быть закреплены предписанными детскими удерживающими устройствами,В пределах населённого пункта детские удерживающие устройства использовать не обязательно,Достаточно пристегнуть детей имеющимися ремнями безопасности,
