questionExternalId,sourceLanguage,targetLanguage,questionTextSource,explanationSource,answerASource,answerBSource,answerCSource,answerDSource,questionTextTarget,explanationTarget,answerATarget,answerBTarget,answerCTarget,answerDTarget
2.7.01-153,en,ru,Your motor vehicle is equipped with a lane keep assist system. In what situation can this system help you?,Lane Keeping Assist helps you stay in lane. It warns you if you unintentionally leave the lane.,- I depart from my lane unintentionally,- the maximum permissible speed is exceeded,- the vehicle is driving too quickly over ruts in the road,,Ваше транспортное средство оснащено системой удержания полосы. В какой ситуации эта система может помочь вам?,"Система удержания полосы помогает оставаться в своей полосе. Она предупреждает, если вы непреднамеренно покидаете полосу движения.",— я непреднамеренно покидаю свою полосу движения,— превышена максимально допустимая скорость,— автомобиль слишком быстро движется по колеям на дороге,
2.7.01-154,en,ru,You have the lane keep assist system activated in your motor vehicle. It emits a warning signal while you are driving. What could be the cause of this?,"Lane Keeping Assist warns you if you unintentionally leave your lane. If you forget to indicate when changing lanes, Lane Keeping Assist recognizes this as unintentionally leaving your lane and warns you.",I forgot to switch on my indicator when changing lane,I have unintentionally departed from my lane,I undercut the minimum distance between me and the vehicle ahead,,В вашем транспортном средстве активирована система удержания полосы. Во время движения она подаёт предупреждающий сигнал. Что может быть причиной?,"Система удержания полосы предупреждает, если вы непреднамеренно покидаете полосу. Если при перестроении вы забыли включить указатель поворота, система распознаёт это как непреднамеренный выезд из полосы и предупреждает вас.",Я забыл включить указатель поворота при смене полосы,Я непреднамеренно покинул свою полосу движения,Я не соблюдаю минимальную дистанцию до впереди идущего автомобиля,
2.7.01-155,en,ru,You are using your motor vehicle’s lane keep assist system while driving. The system does not respond when you depart from the lane. What could be the cause of this?,"Due to missing lane markings, insufficient road illumination and heavy precipitation, the sensors of the lane departure warning system are impaired, which means that the lane is not reliably detected.",Inadequate road illumination,Heavy precipitation,A lack of lane markings,,"Вы используете систему удержания полосы своего транспортного средства во время движения. Система не реагирует, когда вы покидаете полосу. Что может быть причиной?","Из-за отсутствия дорожной разметки, недостаточного освещения дороги и сильных осадков датчики системы предупреждения о сходе с полосы могут работать хуже, поэтому полоса не распознаётся надёжно.",Недостаточное освещение дороги,Сильные осадки,Отсутствие дорожной разметки,
2.7.01-156,en,ru,"Your motor vehicle is equipped with a lane change assist system without steering intervention. While driving, the warning light flashes on the left-hand exterior rear-view mirror. What is this warning light indicating?","If there is a vehicle in the monitoring area, this is signaled by the warning lamp lighting up on the exterior mirror.",Another vehicle is located within the monitored area,You may not now perform a lane change to the left,You can now perform a lane change to the left without any risk,,Ваше транспортное средство оснащено системой помощи при перестроении без вмешательства в рулевое управление. Во время движения на левом наружном зеркале мигает предупреждающая лампа. Что она означает?,"Если в контролируемой зоне находится транспортное средство, это отображается включением или миганием предупреждающей лампы на наружном зеркале.",Другое транспортное средство находится в контролируемой зоне,Сейчас нельзя выполнять перестроение влево,Сейчас можно безопасно перестроиться влево,
2.7.01-157,en,ru,"While driving, you are using your motor vehicle’s active lane keep assist system. How can you manually override this driver assist system in the event that it intervenes?",Countersteering and activating the indicator overrides the intervention of Lane Keeping Assist.,By counter-steering,By activating the indicator,By accelerating,,Во время движения вы используете активную систему удержания полосы. Как можно вручную преодолеть вмешательство этой системы помощи водителю?,Встречное руление и включение указателя поворота отменяют вмешательство системы удержания полосы.,Повернув руль в противоположную сторону,Включив указатель поворота,Ускорившись,
2.7.01-158,en,ru,In which situation is it purposeful to use an active lane change assist system?,"On motorways or motorway-like roads, the lane markings are clearly visible and the lanes are usually straight. This is where Active Lane Change Assist comes in handy.",- motorways,- motorway-like roads,- roads without markings,,В какой ситуации целесообразно использовать активную систему помощи при перестроении?,"На автомагистралях или дорогах, похожих на автомагистрали, дорожная разметка обычно хорошо видна, а полосы чаще всего прямые. Там активная система помощи при перестроении особенно полезна.",— на автомагистралях,"— на дорогах, похожих на автомагистрали",— на дорогах без разметки,
2.7.01-159,en,ru,You want to overtake and you have initiated a lane change using the active lane change assist system. What is correct?,"The Active Lane Change Assistant can change lanes automatically after initiation. However, you must always monitor this, as e.g. safety distances are not always maintained automatically.",The systems independently performs the lane change,I have to monitor the lane change,The system always maintains all safety distances independently,,Вы хотите совершить обгон и инициировали смену полосы с помощью активной системы помощи при перестроении. Что верно?,"Активная система помощи при перестроении после запуска может автоматически выполнить смену полосы. Однако вы всегда должны контролировать процесс, так как, например, безопасные дистанции не всегда поддерживаются автоматически.",Система самостоятельно выполняет смену полосы,Я должен контролировать смену полосы,Система всегда самостоятельно соблюдает все безопасные дистанции,
2.7.01-160,en,ru,Which driver assistance systems do you have to manually activate to assist you in specific situations?,"The active parking assistant and the adaptive cruise control system do not count as safety-relevant assistants. Therefore, you can activate them manually.",The active park assist,The adaptive cruise control (ACC),The emergency brake assist,,"Какие системы помощи водителю необходимо активировать вручную, чтобы они помогали вам в определённых ситуациях?",Активный парковочный ассистент и адаптивный круиз-контроль не относятся к постоянно активным системам безопасности. Поэтому их можно активировать вручную.,Активный парковочный ассистент,Адаптивный круиз-контроль (ACC),Ассистент экстренного торможения,
2.7.01-161,en,ru,"You want to transport furniture in the van shown here (up to 3.5 t). Compared to driving a car, what do you have to be aware of?","A van is much higher, longer and wider than a normal car. Therefore, you should always pay attention to the signage of the passage height. You should also make sure that you adjust your speed in curves, as vans could overturn more easily. In addition, the side wind attacks an even larger area, which significantly increases the risk of being pressed out of the lane.",- can roll over more easily when cornering,- requires special attention regarding vertical clearances,- is vulnerable to sidewinds,,"Вы хотите перевозить мебель в показанном здесь фургоне (до 3,5 т). По сравнению с легковым автомобилем, что необходимо учитывать?","Фургон значительно выше, длиннее и шире обычного легкового автомобиля. Поэтому всегда обращайте внимание на знаки ограничения высоты проезда. Также необходимо выбирать скорость в поворотах, так как фургоны легче могут опрокинуться. Кроме того, они чувствительны к боковому ветру.",— может легче опрокинуться при прохождении поворотов,— требует особого внимания к вертикальным габаритам,— уязвим к боковому ветру,
2.7.01-162,en,ru,How does the active park assist help you when parking?,"The active park assistant must be activated manually by you. After activating the assistant, the system supports you in finding a suitable parking space.",- detects sufficiently large parking spaces,- detects all obstacles during the parking manoeuvre,- checks if parking is permissible at a particular place,,Как активный парковочный ассистент помогает вам при парковке?,Активный парковочный ассистент должен быть включён вами вручную. После активации система помогает найти подходящее парковочное место.,— распознаёт достаточно большие парковочные места,— распознаёт все препятствия во время парковочного манёвра,"— проверяет, разрешена ли парковка в данном месте",
2.7.01-163,en,ru,Why might a turn assist system not always detect that a cyclist is present?,"A turning assistant can work incorrectly due to various circumstances. So it is possible that a cyclist or a pedestrian is not recognized by the system if there are obstacles between you and the cyclist. For example, such can be parked vehicles or trees on the side of the road. Likewise, the pollution or damage to the sensor can easily be the reason for an incorrect function.",There is dirt on the sensor,Parking cars conceal the cyclist,The sensor is damaged,,Почему система помощи при повороте может не всегда распознавать наличие велосипедиста?,"Система помощи при повороте может работать некорректно по разным причинам. Например, велосипедист или пешеход может быть не распознан, если между вами и ним есть препятствия. Такими препятствиями могут быть припаркованные автомобили или загрязнённые/повреждённые датчики.",Датчик загрязнён,Припаркованные автомобили закрывают велосипедиста,Датчик повреждён,
2.7.01-164,en,ru,What must you note when using the active park assist?,"After activating the active park assistant, the system supports you in finding and parking a suitable parking space. Nevertheless, you still have to observe the traffic and intervene manually when the dangers arise.",- must be overridden if hazards exist,- means I no longer have to pay attention to other road traffic,- reliably detects all obstacles during the parking manoeuvre,,Что необходимо учитывать при использовании активного парковочного ассистента?,После активации активного парковочного ассистента система помогает найти подходящее парковочное место и выполнить парковку. Тем не менее вы обязаны наблюдать за дорожной обстановкой и вручную вмешиваться при возникновении опасности.,"— систему необходимо преодолеть вручную, если возникает опасность","— это означает, что мне больше не нужно обращать внимание на другое дорожное движение",— система надёжно распознаёт все препятствия во время парковочного манёвра,
2.7.01-165,en,ru,You are driving an electric vehicle. When can recuperation inhibit the braking action?,"By recuperation, the engine of the electric vehicle works like a generator when braking. The braking therefore generates electricity and automatically loads the car battery. So if the battery of the electric vehicle is already fully charged, the vehicle cannot regain the energy and the braking effect through recuperation may not be available. Instead, the vehicle has to fall back on conventional brakes. The recuperation can also be reduced or deactivated if the battery is too cold. This can reduce the braking effect through recuperation.",- with a fully charged battery,- at less than the battery’s operating temperature,- in eco mode,,Вы управляете электромобилем. Когда рекуперация может ограничивать тормозное действие?,"При рекуперации двигатель электромобиля при торможении работает как генератор. При этом торможение вырабатывает электроэнергию и заряжает аккумулятор. Если аккумулятор уже полностью заряжен, автомобиль может не принимать дополнительную энергию, поэтому тормозной эффект рекуперации уменьшается. При низкой температуре аккумулятора рекуперация также может быть ограничена.",— при полностью заряженном аккумуляторе,— при температуре ниже рабочей температуры аккумулятора,— в экономичном режиме,
2.7.01-166,en,ru,Your vehicle is equipped with a hill-start assist. What benefit does this assist system provide?,"The hill assist can make it easier for you to start off on a hill by releasing the brakes, thus preventing unintentional rolling back.",- prevent my vehicle from rolling backwards unintentionally,- assume control of releasing the brakes,- drive all wheels simultaneously,,Ваш автомобиль оснащён системой помощи при трогании на подъёме. В чём польза этой системы?,"Ассистент трогания на подъёме облегчает начало движения на уклоне, удерживая автомобиль и затем отпуская тормоза, тем самым предотвращая непреднамеренное откатывание назад.",— предотвращает непреднамеренное откатывание моего автомобиля назад,— берёт на себя управление отпусканием тормозов,— приводит в движение все колёса одновременно,
2.7.01-167,en,ru,What applies when using driver assistance systems for longitudinal and lateral control of your vehicle?,"Before using the driver assistance system, you should understand the system's limitations. This way you know exactly which dangerous situations and malfunctions you need to pay more attention to. 
If you notice a driver assistance system malfunction, you should oversteer as quickly as possible. Through targeted oversteering, any errors in the driver assistance system during longitudinal and lateral guidance can be responded to manually. Oversteering can usually be triggered by gently pressing the accelerator and brake or by carefully counter-steering.",I need to know the system limits of the driver assistance system,I must override the driver assistance system immediately in the event of a malfunction,"When I am tired, I can let the driver assistance system take care of longitudinal and lateral control",,Что важно при использовании систем помощи водителю для продольного и поперечного управления автомобилем?,"Перед использованием системы помощи водителю необходимо знать её ограничения. Так вы будете понимать, в каких опасных ситуациях и при каких неисправностях нужно быть особенно внимательным. Если вы заметили неисправность системы, необходимо немедленно взять управление на себя.",Мне необходимо знать пределы возможностей системы помощи водителю,При неисправности я должен немедленно взять управление у системы помощи водителю на себя,"Когда я устал, я могу поручить системе помощи водителю продольное и поперечное управление",
2.7.01-202,en,ru,What must you be prepared for when driving a partly loaded tank truck?,"When a tank vehicle that you drive with partially loaded chambers, you need to adjust to increased risk of skidding and increased danger of tilting in curves.",A great danger of tipping over when taking bends,A great danger of skidding,Heavy steering when driving down slopes,,К чему нужно быть готовым при управлении частично загруженной автоцистерной?,При движении на автоцистерне с частично заполненными отсеками необходимо учитывать повышенную опасность заноса и повышенный риск опрокидывания в поворотах.,К большой опасности опрокидывания при прохождении поворотов,К большой опасности заноса,К тяжёлому рулевому управлению при движении под уклон,
2.7.01-204,en,ru,How can you avoid excessive wear of the service brakes on a long downhill slope?,"By timely switch back, you can conserve avoid heating the service brake. The use of the retarder is also helpful. The parking brake, however, is not right.",Change gears down in time,Apply the retarders,Apply the parking brake,,Как можно избежать чрезмерного износа рабочих тормозов на длинном спуске?,Своевременное переключение на пониженную передачу помогает избежать перегрева и чрезмерного износа рабочих тормозов. Использование ретардера также полезно. Стояночный тормоз для этого не подходит.,Заранее переключиться на пониженную передачу,Использовать ретардеры,Использовать стояночный тормоз,
2.7.01-205,en,ru,"You are driving downhill in a fully loaded bus and have underestimated the slope. Despite retarders being engaged, the speed increases appreciably. What must you do?",Coming soon...,Engage the service brakes to be able to change down gear,Release the retarders and regulate speed with the service brakes only,,,"Вы едете под уклон на полностью загруженном автобусе и недооценили крутизну спуска. Несмотря на включённые ретардеры, скорость заметно увеличивается. Что необходимо сделать?",Скоро будет доступно...,"Задействовать рабочие тормоза, чтобы можно было переключиться на пониженную передачу",Отключить ретардеры и регулировать скорость только рабочими тормозами,,
2.7.01-206,en,ru,What must you remember when passengers are boarding and alighting?,Coming soon...,You may only activate the enabling device of automatic doors after the bus has stopped,You must watch all directly operated doors,"In the case of automatic doors, you may set off already when the indicator lamp for an open door is still lit",,Что необходимо учитывать при посадке и высадке пассажиров?,Скоро будет доступно...,Устройство разрешения открытия автоматических дверей можно активировать только после остановки автобуса,Вы должны наблюдать за всеми дверями с непосредственным управлением,"При автоматических дверях можно начинать движение, даже если контрольная лампа открытой двери ещё горит",
2.7.01-207,en,ru,What must you remember when the doors of your bus are operated independently?,Coming soon...,You must regularly make sure that the squeeze protection is functioning,"For doors without squeeze protection, you must make sure that no passenger is squeezed in the doors","In the case of doors with squeeze protection, you may set off already when the indicator lamp for an open door is still lit",,"Что необходимо учитывать, если двери вашего автобуса управляются самостоятельно пассажирами?",Скоро будет доступно...,"Необходимо регулярно убеждаться, что защита от защемления работает","У дверей без защиты от защемления необходимо следить, чтобы пассажиров не зажало дверями","При дверях с защитой от защемления можно начинать движение, даже если контрольная лампа открытой двери ещё горит",
