questionExternalId,sourceLanguage,targetLanguage,questionTextSource,explanationSource,answerASource,answerBSource,answerCSource,answerDSource,questionTextTarget,explanationTarget,answerATarget,answerBTarget,answerCTarget,answerDTarget
2.7.01-135,en,ru,You are planning a longer journey with a purely electric vehicle. What should you be aware of?,"If you are planning a longer journey with a purely electric vehicle, you should consider that your car has a much lower range compared to conventional vehicles. In addition, the capacity of the batteries is influenced by the outside temperature.",The availability of electric charging stations,The battery charging time,The influence of external ambient temperatures on the range,,Вы планируете длительную поездку на полностью электрическом автомобиле. Что необходимо учитывать?,"Если вы планируете длительную поездку на полностью электрическом автомобиле, следует учитывать, что запас хода у него значительно ниже по сравнению с обычными автомобилями. Кроме того, на ёмкость аккумуляторов влияет наружная температура.",Наличие зарядных станций для электромобилей,Время зарядки аккумулятора,Влияние внешней температуры окружающей среды на запас хода,
2.7.01-136,en,ru,What should you be aware of when charging purely electric vehicles?,"When charging pure electric vehicles, you must be aware that they cannot be recharged at every gas station. Only use the charging cables approved by the manufacturer. Depending on the power connection, the charging time varies.",The charge time depends on the power supply,Charging should only be performed with a charging cable approved by the manufacturer,Charging is available at every filling station,,Что необходимо учитывать при зарядке полностью электрических транспортных средств?,"При зарядке полностью электрических транспортных средств необходимо учитывать, что их нельзя зарядить на каждой автозаправочной станции. Используйте только зарядные кабели, одобренные производителем. Время зарядки зависит от мощности подключения.",Время зарядки зависит от источника питания,"Зарядку следует выполнять только зарядным кабелем, одобренным производителем",Зарядка возможна на каждой автозаправочной станции,
2.7.01-137,en,ru,How is a purely electric vehicle different from a vehicle with a combustion engine?,Pure electric vehicles are almost noiseless. These vehicles also have no direct exhaust emissions. The aerodynamic drag depends on the volume of the body and not on the type of drive.,- have a lower engine noise,- do not have any direct exhaust emissions,- have a lower aerodynamic drag,,Чем полностью электрический автомобиль отличается от автомобиля с двигателем внутреннего сгорания?,"Полностью электрические автомобили почти бесшумны. Кроме того, у таких автомобилей нет прямых выбросов отработавших газов. Аэродинамическое сопротивление зависит от формы и объёма кузова, а не от типа привода.",— имеют более низкий шум двигателя,— не имеют прямых выбросов отработавших газов,— имеют меньшее аэродинамическое сопротивление,
2.7.01-138,en,ru,You are driving a purely electric vehicle in a residential area. What should you be aware of due to your lower engine noise?,"With a pure electric vehicle, you are almost noiseless on the road and you can acoustically be hardly perceived by other road users. Especially cyclists are at risk if they hear no engine noise. Without looking back, they often turn.",Pedestrians will not notice me or will do so later than usual,"Cyclist travelling ahead will turn left, without looking behind them",Vehicles following behind will tailgate me,,Вы едете на полностью электрическом автомобиле в жилой зоне. Что необходимо учитывать из-за низкого шума двигателя?,"На полностью электрическом автомобиле вы движетесь почти бесшумно, поэтому другие участники дорожного движения могут плохо воспринимать вас на слух. Особенно подвержены риску велосипедисты, если они не слышат шума двигателя. Не оглянувшись назад, они могут повернуть.",Пешеходы не заметят меня или заметят позднее обычного,"Велосипедист, едущий впереди, может повернуть налево, не оглянувшись назад",Транспортные средства сзади будут ехать слишком близко ко мне,
2.7.01-139,en,ru,You are driving a motor vehicle fitted with anti-lock braking system (ABS). How do you achieve the shortest possible braking distance?,"If you drive a car with an automatic anti-lock braking system, you achieve the shortest braking distance by braking abruptly and with maximum pedal force. The ABS prevents the wheels from locking during braking.",- suddenly and with maximum force,- carefully and then increasingly harder,- multiple times at quick intervals and with maximum force,,"Вы управляете транспортным средством, оснащённым антиблокировочной системой тормозов (ABS). Как добиться максимально короткого тормозного пути?","Если автомобиль оснащён антиблокировочной системой тормозов, самый короткий тормозной путь достигается резким торможением с максимальным усилием на педаль. ABS предотвращает блокировку колёс при торможении.",— резко и с максимальным усилием,"— осторожно, затем всё сильнее",— несколько раз подряд с короткими интервалами и с максимальным усилием,
2.7.01-140,en,ru,A lane assist system with corrective steer control can help you when driving. What should you be aware of?,"A prerequisite for a perfect function of the lane departure warning system are good road markings. Keep in mind that technical driving assistants cannot compensate for inability to drive. As a car driver, you must be able to intervene into the driving experience at all times.",- keep the vehicle in lane if the road markings are clear,- not function if the road markings are poor,- compensate for a lack of fitness to drive (e.g. tiredness),,Система удержания полосы с корректирующим вмешательством в рулевое управление может помочь вам при движении. Что необходимо учитывать?,"Для безупречной работы системы предупреждения о сходе с полосы необходима хорошая дорожная разметка. Помните, что технические ассистенты водителя не могут компенсировать неспособность к управлению автомобилем. Водитель должен быть готов вмешаться в управление.",— удерживать автомобиль в полосе при чёткой дорожной разметке,— не работать при плохой дорожной разметке,"— компенсировать недостаточную готовность к вождению, например усталость",
2.7.01-141,en,ru,You are driving at high speed into a bend. What could happen if you had to brake suddenly?,"If you drive fast into a tight curve, you lose road grip when you brake hard and slide out of the curve. (Centrifugal force)",- could lose its grip on the road,- could skid out of the bend,- will constantly maintain its driving stability with the stability control,,"Вы на высокой скорости входите в поворот. Что может произойти, если вам придётся резко затормозить?","Если вы быстро входите в крутой поворот и резко тормозите, автомобиль может потерять сцепление с дорогой и выйти из поворота заносом. Причина — центробежная сила.",— может потерять сцепление с дорогой,— может вылететь из поворота в заносе,— будет постоянно сохранять устойчивость благодаря системе стабилизации,
2.7.01-142,en,ru,What can result in your motor vehicle skidding while driving round a bend?,"If you turn sharply, your vehicle may start to skid on bends. This can also happen if you drive too fast. Adjust your speed when cornering.",Heavy oversteer,Driving too fast,Gently accelerating at the exit of the bend,,Что может привести к заносу вашего транспортного средства при движении по повороту?,"При резком повороте автомобиль может начать заносить. Это также может произойти, если вы едете слишком быстро. При прохождении поворотов необходимо выбирать соответствующую скорость.",Сильная избыточная поворачиваемость,Слишком высокая скорость,Плавное ускорение на выходе из поворота,
2.7.01-143,en,ru,"The lane keeping assist system warns you with acoustic, haptic or optical signals. What might be the cause of this?","If you drift out of your lane, the lane departure warning system detects this by recognising that you are approaching the lane marking. The permissible total mass must not be exceeded.",My vehicle is getting close to the road markings at the side of the road,My vehicle is undercutting the safety distance to the vehicle ahead,Another vehicle is overtaking me with not enough side clearance,,"Система удержания полосы предупреждает вас звуковыми, тактильными или визуальными сигналами. Что может быть причиной?","Если вы покидаете свою полосу, система предупреждения о сходе с полосы распознаёт это по приближению к линии разметки. Допустимая полная масса не должна быть превышена.",Мой автомобиль приближается к дорожной разметке у края проезжей части,Мой автомобиль не соблюдает безопасную дистанцию до впереди идущего транспортного средства,Другое транспортное средство обгоняет меня с недостаточным боковым интервалом,
2.7.01-144,en,ru,In what situation can the lane keep assist system with steering override help you?,"On motorways and country roads, steering intervention by the lane departure warning system can be helpful, as the markings are clearly visible there.
Due to poor markings and narrow lanes in roadworks, steering intervention by the lane departure warning system is not possible as it will most likely not be detected correctly.",- on motorways,- on rural roads,- in constricted roadworks sites with poor road markings,,В какой ситуации система удержания полосы с вмешательством в рулевое управление может помочь вам?,"На автомагистралях и загородных дорогах вмешательство системы удержания полосы в рулевое управление может быть полезным, так как разметка там обычно хорошо видна. В суженных зонах дорожных работ с плохой разметкой система может работать ненадёжно.",— на автомагистралях,— на загородных дорогах,— на суженных участках дорожных работ с плохой разметкой,
2.7.01-145,en,ru,With which driving task can the lane keep assist system with steering override help the driver?,"If the lane markings are good, Lane Keeping Assist with steering intervention can help you to keep the vehicle on the lane when driving straight ahead.
When turning, you cross lanes and markings; the lane departure warning system cannot intervene to support you here. When overtaking, you signal to the lane departure warning system by flashing that you are crossing the lane markings intentionally. Thus, it does not intervene during the overtaking process.",When driving in a straight line,When turning,When overtaking,,При выполнении какой задачи система удержания полосы с вмешательством в рулевое управление может помочь водителю?,"При хорошей дорожной разметке система удержания полосы с вмешательством в рулевое управление помогает удерживать автомобиль в полосе при движении прямо. При повороте вы пересекаете полосы и разметку, поэтому система не может вмешиваться в управление таким же образом.",При движении прямо,При повороте,При обгоне,
2.7.01-146,en,ru,What can negatively affect the functioning of the lane keep assist system?,"If the lane markings are in a poor condition, the lane keeping assistant cannot recognise where the lane to be maintained is. Due to additional lane markings in construction areas, it is not obvious which is the lane to be kept to.
Weather conditions can affect the sensors of the lane departure warning system. In addition, water or snow can distort the markings.",The weather conditions,The condition of the road markings,Additional road markings within a roadworks site,,Что может отрицательно повлиять на работу системы удержания полосы?,"Если дорожная разметка находится в плохом состоянии, система удержания полосы не может надёжно распознать полосу движения. Дополнительная разметка в зонах дорожных работ также затрудняет определение правильной полосы. Погодные условия также могут ухудшить работу системы.",Погодные условия,Состояние дорожной разметки,Дополнительная дорожная разметка в зоне дорожных работ,
2.7.01-147,en,ru,Under what conditions will the lane keep assist system with steering override function optimally?,"The lane keeping assistant works best with clear lane markings. 
Poor or additional markings in roadworks will not allow the lane departure warning system to intervene, as it will most likely not be detected correctly.
Weather conditions can affect the sensors of the lane departure warning system. In addition, snow can distort the markings.",Where there are clear road markings,Where there are patches of snow on the road surface,Where there are additional roadworks markings,,При каких условиях система удержания полосы с вмешательством в рулевое управление работает оптимально?,"Система удержания полосы лучше всего работает при чёткой дорожной разметке. Плохая или дополнительная разметка в местах дорожных работ может не позволить системе корректно вмешаться, так как разметка может быть распознана неправильно. Погодные условия также могут влиять на работу системы.",При наличии чёткой дорожной разметки,При наличии участков снега на проезжей части,При наличии дополнительной разметки в зоне дорожных работ,
2.7.01-148,en,ru,What driver assistance system offers a high degree of road safety potential?,"The Autonomous Emergency Brake Assist constantly detects the traffic in front of the vehicle. If a hazard is imminent, the Emergency Brake Assist can carry out an emergency braking manoeuvre. 
Braking too late or too timidly are often causes of traffic accidents. Brake assistants usually react faster than humans and thus offer more safety.",The brake assist,The autonomous emergency brake,The cruise control system,,Какая система помощи водителю имеет высокий потенциал повышения безопасности дорожного движения?,Автономная система экстренного торможения постоянно контролирует движение перед автомобилем. При непосредственной опасности она может выполнить экстренное торможение. Слишком позднее или слишком слабое торможение часто является причиной ДТП.,Тормозной ассистент,Автономная система экстренного торможения,Система круиз-контроля,
2.7.01-149,en,ru,How can driver assistance systems help you?,"In critical traffic situations, driver assistance systems can react quickly and intervene automatically by steering or braking etc..
If danger is imminent, they can warn you with light, sound and haptic signals. Driver assistance systems can also help you with driving tasks, such as keeping in lane.",- warn me of danger,- help me perform driving tasks,- intervene automatically in critical road traffic situations,,Как системы помощи водителю могут помогать вам?,"В критических дорожных ситуациях системы помощи водителю могут быстро реагировать и автоматически вмешиваться, например рулением или торможением. При опасности они могут предупреждать световыми, звуковыми и тактильными сигналами. Они также могут помогать выполнять отдельные задачи управления.",— предупреждать меня об опасности,— помогать мне выполнять задачи управления,— автоматически вмешиваться в критических дорожных ситуациях,
2.7.01-150,en,ru,What can result if you accelerate too hard when driving a front-wheel drive car through a road bend?,"If you give a front-wheel drive car too much gas in a bend, it can swerve over the front axle. The front tyres lose their grip on the road and your vehicle can no longer be steered, but continues straight ahead and breaks away.",- The front of the car can swerve,- Steerability can be reduced,- The rear of the car can swerve,,"Что может произойти, если вы слишком сильно ускоряетесь на автомобиле с передним приводом при прохождении поворота?","Если на переднеприводном автомобиле в повороте слишком сильно нажать на газ, автомобиль может сорваться передней осью. Передние шины теряют сцепление с дорогой, автомобиль становится хуже управляемым, продолжает движение прямо и срывается с траектории.",— передняя часть автомобиля может сорваться в сторону,— управляемость может снизиться,— задняя часть автомобиля может сорваться в сторону,
2.7.01-151,en,ru,Under what conditions can an active lane change assist system perform a lane change?,"The Active Lane Change Assistant only performs a lane change when it cannot detect any vehicle in the relevant safety zone. For an active lane change, the assistant must first detect a marked lane with several lanes.",- has detected an adequately marked carriageway with multiple lanes,- has not detected any vehicles in the relevant safety zone,- has detected a sufficiently large gap in the oncoming traffic,,При каких условиях активная система помощи при перестроении может выполнить смену полосы?,"Активный ассистент перестроения выполняет смену полосы только тогда, когда не обнаруживает транспортных средств в соответствующей зоне безопасности. Для активного перестроения система должна сначала распознать размеченную многополосную проезжую часть.",— если система распознала достаточно хорошо размеченную многополосную проезжую часть,— если система не обнаружила транспортных средств в соответствующей зоне безопасности,— если система обнаружила достаточно большой разрыв во встречном потоке,
2.7.01-152,en,ru,Your motor vehicle is equipped with an active lane keep assist system. What information can be indicated by the status display of this system?,"The system must be able to display when it is switched on, switched off or has a malfunction, as this is important for the driver.",- is activated,- is deactivated,- has a fault,,Ваше транспортное средство оснащено активной системой удержания полосы. Какую информацию может показывать индикатор состояния этой системы?,"Система должна показывать, включена она, выключена или неисправна, так как эта информация важна для водителя.",— система активирована,— система деактивирована,— в системе есть неисправность,
