questionExternalId,sourceLanguage,targetLanguage,questionTextSource,explanationSource,answerASource,answerBSource,answerCSource,answerDSource,questionTextTarget,explanationTarget,answerATarget,answerBTarget,answerCTarget,answerDTarget
1.1.03-002,en,ru,Why must the safe distance maintained be much greater on a wet roadway than on a dry roadway?,"On wet roads, the adhesion between the tyre and the road is poorer due to the water film. As a result, the braking distance is considerably longer. In addition, the spray from the car in front worsens visibility. The same applies to rainy weather.",The contact between the tyres and the roadway deteriorates,Wheel-spray can impair visibility,Braking distances are greater,,"Почему безопасная дистанция на мокрой дороге должна быть значительно больше, чем на сухой?","На мокрой дороге сцепление между шинами и покрытием ухудшается из-за водяной плёнки. Поэтому тормозной путь значительно увеличивается. Кроме того, брызги от впереди идущего автомобиля ухудшают видимость.",Контакт между шинами и дорогой ухудшается,Брызги от колёс могут ухудшить видимость,Тормозной путь становится длиннее,
1.1.03-003,en,ru,Where must you especially reckon with ice on the roadway?,"You must expect increased icing on the road in the following areas: in damp, shady and windy locations that favour the formation of ice on the road. These include, above all, forest locations and bridges. In forests, the cold lasts longer than in open fields. Because of the shade, moisture takes longer to evaporate here. On bridges, roadways store less heat than on the ground. Bridge roadways are therefore colder and ice up faster. The moisture of the surrounding water and the increased wind due to the unprotected location also promote icing.",On bridges,On stretches of road running through forest,On frequently used stretches of road,,Где особенно нужно ожидать гололёд на проезжей части?,"Повышенное образование льда на дороге возможно во влажных, тенистых и ветреных местах, которые способствуют обледенению. К ним прежде всего относятся лесные участки и мосты.",На мостах,"На участках дороги, проходящих через лес",На часто используемых участках дороги,
1.1.03-004,en,ru,What are the special conditions when driving along tree-lined avenues in the cold season?,"The particularities of driving along avenues in the cold season result from the basic characteristics of an avenue: it is characterised by uniform rows of trees running parallel to the roadway on the right and left. The foliage of the trees creates shade on the roadway. This keeps moisture longer, which favours icing in cold weather. If the leaves fall on the roadway, it also significantly increases the risk of the vehicle slipping.","Wet leaves as well as white frost, black ice and snowy surfaces are particularly dangerous above all on cambered roadways",White frost and black ice occur more frequently and more unexpectedly on cobbled roadways than on other roadways,Tree-lined avenues are particularly safe in winter because the treetops protect the road from snow,,Какие особые условия возникают при движении по аллеям с деревьями в холодное время года?,"Особенности движения по аллеям в холодное время связаны с тем, что деревья стоят равномерными рядами вдоль дороги. На таких участках особенно опасны мокрые листья, иней, гололёд и снежное покрытие, особенно на дорогах с поперечным уклоном. Вымощенные камнем участки также могут чаще и неожиданнее становиться скользкими.","Мокрые листья, иней, гололёд и снежное покрытие особенно опасны, прежде всего на дорогах с поперечным уклоном","Иней и гололёд на мощёных дорогах возникают чаще и неожиданнее, чем на других дорогах","Аллеи особенно безопасны зимой, потому что кроны деревьев защищают дорогу от снега",
1.1.03-005,en,ru,There is oil on the road. What should you do now?,"If there is oil on the road, avoid jerky steering and heavy braking; there is a risk of slipping. Provided other road users are not endangered, you can move to the left lane. Notify the fire brigade so that the oil can be bound.",I notify the fire brigade,I avoid heavy braking and abrupt steering movements,I swerve onto the left-hand side of the road,,На дороге есть масло. Что Вы должны сделать сейчас?,"Если на дороге есть масло, избегайте резких движений рулём и сильного торможения, так как существует опасность скольжения. Если это не создаёт опасности для других участников движения, можно сместиться левее. Необходимо как можно скорее уведомить пожарную службу.",Я уведомляю пожарную службу,Я избегаю сильного торможения и резких движений рулём,Я выезжаю на левую сторону дороги,
1.1.03-006-M,en,ru,What must you be prepared for here?,"Due to the weather and the corresponding conditions on the road, you have to be prepared for an extended braking distance, for a vehicle coming from the right (right before left) and for a narrowed lane.",A vehicle coming from the right,An extended braking distance,A narrowed carriageway,,К чему нужно быть готовым здесь?,"Из-за погодных условий и состояния дороги нужно быть готовым к увеличенному тормозному пути, к транспортному средству справа (правило «помеха справа») и к сужению проезжей части.","К транспортному средству, приближающемуся справа",К увеличенному тормозному пути,К суженной проезжей части,
1.1.03-007-M,en,ru,You are driving following a heavy rain shower. What should you be aware of in this situation?,"When it rains, your view worsens. Therefore, you should enlarge your safety distance to the vehicle in front, as your braking distance is extended. Spray water can be whirled up from the vehicle in front by a wet road. This means that bumps are difficult to recognize.",I should maintain a large safety distance between me and the vehicle ahead,It is difficult for me to detect uneven areas on the road surface,Splash water might impair my vision,,Вы едете после сильного ливня. Что нужно учитывать в этой ситуации?,"Во время дождя видимость ухудшается. Поэтому следует увеличить безопасную дистанцию до впереди идущего автомобиля, так как тормозной путь увеличивается. Брызги от впереди идущего автомобиля могут ухудшить обзор. Неровности на дороге также труднее заметить.",Мне следует соблюдать большую безопасную дистанцию до впереди идущего транспортного средства,Мне трудно распознать неровности на дорожном покрытии,Брызги воды могут ухудшить мой обзор,
1.1.03-102-B,en,ru,Why does driving on this stretch of road require greater alertness on the part of the motorist?,"A tram may come towards you on the tracks, in which case the lane becomes much narrower for you. Tram tracks are also dangerous, especially when wet, because they become slippery. In addition, as there are also cobblestones, the road surface is uneven and has varying degrees of grip. This can increase the braking distance.",The road surface is uneven and road grip varies,A tram might come from the opposite direction,Driving on the tracks is dangerous,,Почему движение по этому участку дороги требует от водителя повышенного внимания?,"По рельсам Вам навстречу может двигаться трамвай, и тогда полоса для Вас станет значительно уже. Трамвайные рельсы также опасны, особенно во влажную погоду, потому что становятся скользкими. Кроме того, дорожное покрытие может быть неровным, а сцепление с дорогой — различным.","Дорожное покрытие неровное, и сцепление с дорогой меняется",Навстречу может ехать трамвай,Движение по рельсам опасно,
1.1.03-104,en,ru,"The road is icy for a short distance. What should you avoid here, if possible?","On icy roads, your tyres do not grip as well as usual. Therefore, you should avoid dangerous situations, i.e. neither brake nor accelerate abruptly. You should also refrain from sudden steering movements. This could cause your vehicle to skid. Only brake and steer away from the icy surface.",Accelerating,Braking,Steering wheel movements,,На коротком участке дорога покрыта льдом. Чего здесь по возможности следует избегать?,На обледенелой дороге шины не имеют обычного сцепления. Поэтому нужно избегать опасных действий: не следует резко тормозить или ускоряться. Также нужно избегать резких движений рулём.,Ускорения,Торможения,Движений рулём,
1.1.03-105,en,ru,"While driving, how can you safely check whether the road is icy?",Test the condition of the road by braking carefully at low speed. Be sure to pay attention to the traffic behind you. Avoid jerking the steering or accelerating sharply. This could cause your vehicle to swerve and become uncontrollable.,By carefully applying the brakes at very low speed,By jerking the steering wheel to the left and right,By rapid acceleration,,"Как во время движения можно безопасно проверить, не обледенела ли дорога?","Проверьте состояние дороги осторожным торможением на очень низкой скорости. Обязательно следите за движением позади Вас. Избегайте резких движений рулём и резкого ускорения, так как это может привести к потере контроля над автомобилем.",Осторожно затормозить на очень низкой скорости,Резко повернуть руль влево и вправо,Резко ускориться,
1.1.03-108-B,en,ru,Why must you drive with particular caution here?,"Snow makes the road slippery. There is a curve in front of you that is difficult to see and a car is parked there. You will have to pull out into the oncoming lane to drive around it. Therefore, drive extra carefully to be able to react at any time. In addition, your vehicle needs suitable tyres for good grip.",Because the roadway is slippery,Because the view is obscured by the bend,Because the roadway is made narrower by the wrongly parked car,,Почему здесь нужно ехать особенно осторожно?,"Снег делает дорогу скользкой. Перед Вами плохо просматриваемый поворот, и там припаркован автомобиль. Чтобы объехать его, Вам придётся выехать на встречную полосу. Поэтому двигайтесь очень осторожно.",Потому что проезжая часть скользкая,Потому что обзор закрыт поворотом,Потому что проезжая часть сужена неправильно припаркованным автомобилем,
1.1.03-109,en,ru,Where must you be prepared to encounter sudden fog?,"Humidity at low temperatures favours the formation of fog. Therefore, fog is more likely to occur around lakes, watercourses and rivers as well as moorland areas.",Near rivers,In marshy areas,Near lakes,,Где нужно быть готовым к внезапному появлению тумана?,"Влажность при низких температурах способствует образованию тумана. Поэтому туман чаще возникает возле озёр, водотоков и рек, а также в болотистых местностях.",Возле рек,В болотистых районах,Возле озёр,
1.1.03-110,en,ru,What do you do if visibility is drastically reduced by fog?,"Adjust your speed and driving style to the visibility conditions. Make sure that you can stop within sight. If necessary, increase the safety distance to the vehicle in front. Fog with a visibility of 50 metres, for example, means that you may drive at a maximum of 50 km/h.",Adapt your speed in time to visibility conditions,Increase the distance from the vehicle in front,Drive up close to the vehicle in front so you can use its rear lights as an orientation point,,"Что нужно делать, если видимость резко ухудшилась из-за тумана?","Своевременно адаптируйте скорость и стиль вождения к условиям видимости. Убедитесь, что можете остановиться в пределах видимой зоны. При необходимости увеличьте безопасную дистанцию до впереди идущего автомобиля. При тумане с видимостью менее 50 метров необходимо двигаться не быстрее 50 км/ч.",Своевременно адаптировать скорость к условиям видимости,Увеличить дистанцию до впереди идущего транспортного средства,"Подъехать близко к впереди идущему транспортному средству, чтобы ориентироваться по его задним фонарям",
1.1.03-112-M,en,ru,What is the right course of action here?,"Even if the lane marking is not visible, the traffic signs show the presence of the pedestrian crossing. Brake carefully to prevent your vehicle from skidding.",I brake carefully,I allow [the pedestrian] on the right to cross the road,"I carefully continue driving, because there are no markings visible on the road",,Как правильно поступить здесь?,"Даже если разметка полосы не видна, дорожные знаки указывают на наличие пешеходного перехода. Осторожно затормозите, чтобы автомобиль не занесло.",Я осторожно торможу,Я позволяю [пешеходу] справа перейти дорогу,"Я осторожно продолжаю движение, потому что на дороге не видно разметки",
1.1.03-114-M,en,ru,Why do you have to pay particular attention here?,"There is a long curve in front of you, the end of which you cannot see. A fast-moving vehicle could come towards you from there and cut your lane. The road surface is also uneven and does not have an even surface. So anticipate insufficient grip and drive at an adapted speed.",Because it is not clear which direction the road will take,Because the road surface is uneven,Because oncoming traffic could cut the corner,,Почему здесь нужно быть особенно внимательным?,"Перед Вами длинный поворот, конца которого Вы не видите. Оттуда может быстро появиться встречный автомобиль и срезать поворот, выехав на Вашу полосу. Кроме того, дорожное покрытие неровное, а направление дороги не совсем ясно.","Потому что не ясно, в каком направлении дальше пойдёт дорога",Потому что дорожное покрытие неровное,Потому что встречный транспорт может срезать поворот,
1.1.03-115,en,ru,You want to exit the motorway; to which must you pay particularly close attention?,"In the video you see a red motorcycle on the deceleration lane. Later it is no longer visible, because it is located in the blind spot on the right side of you. Now if you also swing out on the deceleration lane, you'll cut the motorcyclist - a dangerous situation for him. Make sure that the rider passes right by you before changing lanes.",The red motorbike,The yellow truck,The white van,,Вы хотите съехать с автомагистрали; на что нужно обратить особое внимание?,"В видео видно красный мотоцикл на полосе замедления. Позже он больше не виден, потому что находится в слепой зоне справа от Вас. Если Вы тоже перестроитесь на полосу замедления, Вы можете создать опасность для мотоциклиста.",На красный мотоцикл,На жёлтый грузовик,На белый фургон,
1.1.03-116,en,ru,Why might taking the right turn be dangerous here?,"The winter weather makes the road slippery and increases the braking distance at the intersection. Your car or oncoming vehicles could skid or slide away uncontrollably. Therefore, reduce your speed in good time and do not brake abruptly. The road on the right is still full of snow and therefore even slicker. Watch out for pedestrians when turning. They always have priority when you turn.","Because I might possibly not be able to stop in time, if pedestrians are crossing the side street",Because vehicles emerging from the side street could start to skid,Because my vehicle might start to skid if I take the turn too fast,,Почему поворот направо здесь может быть опасен?,Зимняя погода делает дорогу скользкой и увеличивает тормозной путь на перекрёстке. Ваш автомобиль или встречные транспортные средства могут начать скользить и стать неконтролируемыми. Поэтому заранее снизьте скорость.,"Потому что я, возможно, не смогу вовремя остановиться, если пешеходы будут переходить боковую улицу","Потому что транспортные средства, выезжающие из боковой улицы, могут начать скользить","Потому что мой автомобиль может начать скользить, если я поверну слишком быстро",
1.1.03-117,en,ru,You are driving on this road which is not inside a built-up area. What should you prepare yourself for?,"On the right you will see the sign for a car park. Expect pedestrians walking away from or towards their parked cars. As the pavements are impassable due to the masses of snow, evasive pedestrians could use the roadway. The weather causes slippery conditions and increases your braking distance. Drive slowly.",Pedestrians using the road,The road is narrow,Pedestrians walking only off the road,,Вы едете по этой дороге вне населённого пункта. К чему нужно быть готовым?,"Справа Вы видите знак парковки. Нужно ожидать пешеходов, которые идут от своих припаркованных автомобилей или к ним. Поскольку тротуары из-за массы снега непроходимы, пешеходы могут идти по дороге.","К пешеходам, использующим дорогу",Дорога узкая,Пешеходы идут только вне дороги,
1.1.03-118,en,ru,What must you be aware of?,"The fog is so dense here that you cannot see farther than 50 meters. With such a limited view, obstacles and dangerous situations cannot be detected in time when you're driving at high speed. Therefore, you must reduce your speed to a maximum of 50 km/h and drive very carefully. Turn on the rear fog-lamp of your vehicle.",- turn on the rear fog lights,- drive at 50 km/h maximum,- drive at 80 km/h maximum,,Что нужно учитывать?,"Туман здесь настолько плотный, что видимость составляет менее 50 метров. При такой ограниченной видимости препятствия и опасные ситуации невозможно своевременно распознать на высокой скорости. Поэтому нужно включить задние противотуманные фонари и двигаться максимум 50 км/ч.",Включить задние противотуманные фонари,Двигаться максимум 50 км/ч,Двигаться максимум 80 км/ч,
1.1.03-119-M,en,ru,Why is it necessary to maintain a larger safety distance to the vehicle ahead?,"There is a risk of aquaplaning on wet roads. The braking distance is longer than on dry surfaces. The vehicle in front creates a spray of dirty water that reduces your visibility. Also, you cannot see larger puddles of water in advance. To be able to react well to dangerous situations, keep a greater distance from the vehicle in front and adjust your speed.",Because spray water could otherwise impede visibility,Because the braking distance is longer than on a dry road,Because uneven areas of the road will otherwise be detected later,,Почему необходимо соблюдать большую безопасную дистанцию до впереди идущего транспортного средства?,"На мокрой дороге существует риск аквапланирования. Тормозной путь длиннее, чем на сухой дороге. Впереди идущее транспортное средство создаёт брызги грязной воды, которые ухудшают видимость. Кроме того, неровности дороги становятся заметны позже.",Потому что иначе брызги воды могут ухудшить видимость,"Потому что тормозной путь длиннее, чем на сухой дороге",Потому что иначе неровности дороги будут замечены позже,
1.1.03-120,en,ru,What is the correct course of action in this situation?,"Drive carefully, slowly and avoid abrupt steering or braking, because slippery snow or ice can occur at any time.",I reduce my speed,I avoid jerky steering movements,I brake hard while in the bend,,Как правильно поступить в этой ситуации?,"Едьте осторожно, медленно и избегайте резких движений рулём или торможения, потому что в любой момент может быть скользкий снег или лёд.",Я снижаю скорость,Я избегаю резких движений рулём,Я резко торможу в повороте,
