questionExternalId,sourceLanguage,targetLanguage,questionTextSource,explanationSource,answerASource,answerBSource,answerCSource,answerDSource,questionTextTarget,explanationTarget,answerATarget,answerBTarget,answerCTarget,answerDTarget
2.2.22-003,en,ru,Where should you stow heavy luggage?,You should place heavy luggage as close as possible to the center of gravity of your motorcycle to least impact its behavior. Make sure to place it either in the tank-top bag or equally distributed and deep in the panniers.,In the tank-top bag,"Stow equally on the left and right, and as deep as possible in the panniers",In the handlebar bag,,Где следует размещать тяжёлый багаж?,"Тяжёлый багаж следует размещать как можно ближе к центру тяжести мотоцикла, чтобы он как можно меньше влиял на поведение транспортного средства. Его следует размещать либо в сумке на баке, либо равномерно слева и справа, как можно ниже в боковых кофрах.",В сумке на баке,Равномерно слева и справа и как можно ниже в боковых кофрах,В сумке на руле,
2.2.22-004,en,ru,How does incorrect loading affect driving stability?,Incorrectly loading your motorcycle will make your motorcycle less stable. It will make it less stable when braking and could make it vibrate or swing,To heavy tail-loading causes the motorcycle to shimmy and swing,Unequally distributed loading can have a negative effect on driving stability when braking,Has no effect,,Как неправильная загрузка влияет на устойчивость движения?,"Неправильная загрузка делает мотоцикл менее устойчивым. Он может стать менее устойчивым при торможении, а также начать вибрировать или раскачиваться.",Слишком большая нагрузка сзади вызывает рыскание и раскачивание мотоцикла,Неравномерно распределённая нагрузка может отрицательно влиять на устойчивость при торможении,Не оказывает влияния,
2.2.22-005,en,ru,What must you be aware of when loading a truck with trailer (truck-trailer)?,The total length of the train (lorry with trailer) and its load must not 20.75 m passing and the charge is to be distributed so that the operational reliability of the train is not affected and you thus endangering any other participants of road traffic.,The total length of the truck-trailer including load may not exceed 20.75 m,The load must be distributed in such a way so as not to interfere with the operational safety of the truck-trailer,Heavy goods should be positioned as high up as possible,,Что необходимо учитывать при загрузке грузового автомобиля с прицепом?,"Общая длина автопоезда — грузового автомобиля с прицепом — вместе с грузом не должна превышать 20,75 м. Груз следует распределить так, чтобы не нарушалась эксплуатационная безопасность автопоезда и не создавалась опасность для других участников дорожного движения.","Общая длина грузового автомобиля с прицепом, включая груз, не должна превышать 20,75 м","Груз должен быть распределён так, чтобы не нарушать эксплуатационную безопасность автопоезда",Тяжёлые грузы следует располагать как можно выше,
2.2.22-006,en,ru,"What is the maximum permissible length of a truck with trailer, including load?","The charge of the truck, including trailer must be 20.75 meters long at most.",20.75 m,18.00 m,24.25 m,,"Какова максимально допустимая длина грузового автомобиля с прицепом, включая груз?","Длина грузового автомобиля с прицепом, включая груз, не должна превышать 20,75 м.","20,75 м","18,00 м","24,25 м",
2.2.22-007,en,ru,You are carrying an additionally attached piece of luggage on your motorbike. What should you take into account?,"Because of the luggage, your motorbike has a larger surface area to attack, so it is more susceptible to crosswinds. The extra weight also shifts the centre of gravity of your motorbike. You should therefore make sure that the luggage is evenly distributed and adjust your riding behaviour accordingly.
There may be recommendations from the vehicle manufacturer as to how you should adjust your speed to the load. You should follow these. You will find them in the owner's manual.",Any possible maximum speed recommendations made by the vehicle manufacturer,Any change in the centre of gravity of the motorbike,Any change in the motorbike’s susceptibility to side winds,,Вы перевозите на мотоцикле дополнительно закреплённый багаж. Что следует учитывать?,Из-за багажа мотоцикл имеет большую площадь воздействия бокового ветра и становится более чувствительным к нему. Дополнительный вес также смещает центр тяжести мотоцикла. Поэтому нужно следить за равномерным распределением багажа и соответственно адаптировать стиль езды. Производитель может давать рекомендации по скорости при движении с грузом; их следует соблюдать.,Возможные рекомендации производителя по максимальной скорости,Изменение центра тяжести мотоцикла,Изменение чувствительности мотоцикла к боковому ветру,
2.2.22-008,en,ru,How does an improperly stowed load affect the driving stability of a motorbike?,"Too heavy a load at the rear of the motorbike puts too little weight on the front tyres and steering. This makes it easier for the bike to wobble and oscillate. Differently loaded sides have a negative effect on stability and handling. The motorbike will lean more towards the heavier side when braking or cornering.
Light luggage in the tank bag does not affect the riding stability of the motorbike.",A heavy load placed on the rear causes the motorbike to wobble and sway at high speeds,A load placed on one side only negatively affects the handling,Light-weight luggage in the tank bag makes skidding more probable,,Как неправильно размещённый груз влияет на устойчивость движения мотоцикла?,Слишком тяжёлый груз сзади уменьшает нагрузку на переднее колесо и рулевое управление. Из-за этого мотоцикл легче начинает рыскать и раскачиваться. Нагрузка только с одной стороны отрицательно влияет на устойчивость и управляемость; при торможении или в поворотах мотоцикл сильнее наклоняется в более тяжёлую сторону. Лёгкий багаж в сумке на баке не влияет на устойчивость мотоцикла.,Тяжёлый груз сзади вызывает рыскание и раскачивание мотоцикла на высокой скорости,Груз только с одной стороны отрицательно влияет на управляемость,Лёгкий багаж в сумке на баке повышает вероятность заноса,
2.2.22-009,en,ru,What might be needed when a motorcycle is fully loaded?,"If the motorbike is fully loaded, the load exerts more pressure on the tyres. You should therefore check the tyre inflation pressure. The weight of the load could push the chassis down further and must therefore be readjusted. If the load extends beyond the motorbike, you should also readjust the rear view mirrors.",An adjustment of the tyre inflation pressure,An adjustment of the chassis,An adjustment of the rear-view mirrors,,Что может потребоваться при полной загрузке мотоцикла?,"При полной загрузке мотоцикла нагрузка сильнее давит на шины. Поэтому следует проверить давление в шинах. Вес груза может сильнее сжать ходовую часть, поэтому её нужно отрегулировать. Если груз выступает за габариты мотоцикла, следует также перенастроить зеркала заднего вида.",Регулировка давления в шинах,Регулировка ходовой части,Регулировка зеркал заднего вида,
2.2.22-010,en,ru,Carrying a rucksack while cycling can affect the handling of your two-wheeler. What can the consequences be?,"By carrying a backpack, you offer a larger surface for crosswinds to attack. Carrying a backpack also shifts your center of gravity upwards. This means you can't steer as quickly.",A greater susceptibility to side wind,A displacement of the centre of gravity,An improvement in the manoeuvrability,,Перевозка рюкзака во время езды на велосипеде может влиять на управляемость двухколёсного транспортного средства. Какие последствия возможны?,"При ношении рюкзака Вы создаёте большую поверхность для воздействия бокового ветра. Кроме того, рюкзак смещает центр тяжести вверх. Поэтому управлять быстро и точно становится сложнее.",Повышенная чувствительность к боковому ветру,Смещение центра тяжести,Улучшение манёвренности,
2.2.22-101,en,ru,"What do white plates with a black ""A"" on a truck mean?","A truck with white plates marked with a black ""A"" transports litter. The white plates with a black ""A"" must be clearly visible both at the front and at the back of the truck.",- is transporting waste materials,- is transporting dangerous goods,- is driven by a beginner,,Что означают белые таблички с чёрной буквой «A» на грузовом автомобиле?,Грузовой автомобиль с белыми табличками с чёрной буквой «A» перевозит отходы. Такие таблички должны быть хорошо видны спереди и сзади грузового автомобиля.,- перевозит отходы,- перевозит опасные грузы,- управляется начинающим водителем,
2.2.22-102,en,ru,What must you bear in mind if you want to carry luggage on the roof of your car?,"Luggage on the roof changes the center of gravity of your vehicle upwards. This has a significant influence on the driving characteristics of the car. The driving characteristics are worse, especially in curves. The vehicle is wind-prone. It must be ensured that the permissible roof load and total mass are not exceeded.",The roadhandling characteristics are adversely affected,The permissible total mass must not be exceeded,The maximum roof load stipulated by the car manufacturer (owner's manual) must not be exceeded,,"Что необходимо учитывать, если Вы хотите перевозить багаж на крыше автомобиля?","Багаж на крыше смещает центр тяжести автомобиля вверх. Это существенно влияет на ходовые качества, особенно в поворотах. Автомобиль становится более чувствительным к ветру. Нужно следить, чтобы не были превышены допустимая нагрузка на крышу и разрешённая максимальная масса.",Управляемость автомобиля ухудшается,Разрешённая максимальная масса не должна быть превышена,"Максимальная нагрузка на крышу, указанная производителем автомобиля в руководстве по эксплуатации, не должна быть превышена",
2.2.22-103,en,ru,What must you reckon with when transporting luggage on the roof of your car?,"The luggage on the roof changes the center of gravity of the vehicle - it is raised. This increases the danger of tipping over and the aerodynamic drag increases. As a result, your vehicle is more sensitive to crosswind and air pressure when a wheel or truck overtakes you. In curves the driving stability also deteriorates due to the higher center of gravity. Your vehicle will tilt more.",The vehicle inclines more on bends,The vehicle's susceptibility to side wind is greater,The vehicle's roadhandling is improved on account of the higher centre of gravity,,С чем нужно считаться при перевозке багажа на крыше автомобиля?,"Багаж на крыше смещает центр тяжести автомобиля вверх. Это повышает риск опрокидывания и увеличивает аэродинамическое сопротивление. Поэтому автомобиль становится более чувствительным к боковому ветру и к воздушной волне при обгоне. В поворотах устойчивость также ухудшается, и автомобиль сильнее наклоняется.",Автомобиль сильнее наклоняется в поворотах,Чувствительность автомобиля к боковому ветру увеличивается,Управляемость улучшается из-за более высокого центра тяжести,
2.2.22-104,en,ru,What must you do when transporting bicycles on the roof of your car?,"Bicycles on the roof require special attention: think of safety regulations and careful attachment. Check the fastenings regularly during driving breaks. Loads on the roof change the center of gravity of the vehicle, they lift it. The driving quality deteriorates especially in curves. Avoid high speeds.",Safely attach holding device and bicycles,Avoid driving at high speed,Regularly check the fixing devices,,Что необходимо делать при перевозке велосипедов на крыше автомобиля?,"Велосипеды на крыше требуют особого внимания: соблюдайте правила безопасности и тщательно закрепляйте их. Во время остановок регулярно проверяйте крепления. Груз на крыше смещает центр тяжести автомобиля вверх, из-за чего ухудшается управляемость, особенно в поворотах. Следует избегать высокой скорости.",Надёжно закрепить держатель и велосипеды,Избегать движения на высокой скорости,Регулярно проверять крепёжные устройства,
2.2.22-105,en,ru,What must you check when transporting bicycles on a rear-mounted support system?,"Check if the rear carry system is securely fastened. Likewise, the attachment of bicycles is to be checked. If illuminating devices or the license plate is obscured, technical equipment must be installed at the end of the vehicle system for adequate lighting and/or to attach the license plate number. Back-heavy loading changes the center of gravity of the vehicle. Check the distribution of the load.","Whether, according to the manufacturer's instructions, the system is adequate for the vehicle",Whether system and bicycles are fixed safely,Whether lighting equipment or number plate are covered,,Что необходимо проверить при перевозке велосипедов на задней системе крепления?,"Проверьте, надёжно ли закреплена задняя система крепления. Также нужно проверить крепление велосипедов. Если световые приборы или номерной знак закрыты, в задней части системы необходимо установить соответствующее освещение и/или место для номера. Загрузка сзади смещает центр тяжести автомобиля. Проверьте распределение нагрузки.",Подходит ли система для автомобиля согласно указаниям производителя,Надёжно ли закреплены система и велосипеды,Не закрыты ли световые приборы или номерной знак,
2.2.22-108,en,ru,How must a load be marked in darkness or bad visibility when it extends laterally more than 40 cm beyond the side lights of the vehicle?,"In the dark or in poor visibility conditions, a cargo that laterally protrudes more than 40 cm beyond the marker lights of the vehicle must be marked with additional lights. These are to be attached laterally no more than 40 cm from the edge and no more than 1.5 m above the roadway. For the front, a white lamp is required, for the back you need to install a red light. The hazard lights must not be switched on by you as a car driver while driving.",By a white light to the front,By a red light to the back,By switching on the hazard warning lights,,"Как должен быть обозначен груз в темноте или при плохой видимости, если он выступает сбоку более чем на 40 см за боковые огни автомобиля?","В темноте или при плохой видимости груз, выступающий сбоку более чем на 40 см за габаритные огни автомобиля, должен быть обозначен дополнительными огнями. Они должны быть установлены сбоку не дальше 40 см от края и не выше 1,5 м над проезжей частью. Спереди требуется белый фонарь, сзади — красный. Во время движения нельзя включать аварийную сигнализацию для такой цели.",Белым светом спереди,Красным светом сзади,Включением аварийной сигнализации,
2.2.22-109,en,ru,What is the maximum height allowed above the roadway for a red light marking a load extending to the back?,"The maximum height for attaching the lamp is 1.5 meters. This is to ensure that the marking is in the field of vision of other road users. If the red light is higher above the road, it could be overlooked.",1.50 m,2.00 m,2.50 m,,"На какой максимальной высоте над проезжей частью может быть установлен красный свет, обозначающий груз, выступающий назад?","Максимальная высота установки фонаря составляет 1,5 м. Это нужно для того, чтобы обозначение находилось в поле зрения других участников дорожного движения. Если красный свет расположен выше, его могут не заметить.","1,50 м","2,00 м","2,50 м",
2.2.22-112,en,ru,Under what conditions is a load allowed to project over the front of a vehicle?,"If the cargo is fastened above a height of 2.50 m, it may protrude up to 50 cm from the front of the vehicle. This regulation is intended to reduce the danger and risk of injury from rear-end collisions with cargo. In general, cargo should always be carefully secured so that it can neither slip nor fall.",If the load does not project over more than 50 cm and is above a height of 2.50 m,If the load is marked with a red light,,,При каких условиях груз может выступать за переднюю часть транспортного средства?,"Если груз закреплён на высоте более 2,50 м, он может выступать вперёд не более чем на 50 см. Это правило предназначено для уменьшения опасности и риска травм при наездах сзади на груз. В целом груз всегда должен быть тщательно закреплён, чтобы он не мог сместиться или упасть.","Если груз выступает не более чем на 50 см и находится на высоте более 2,50 м",Если груз обозначен красным светом,,
2.2.22-113,en,ru,During a break you find out that one of the lashing straps has torn. What do you do?,"As a car driver, you must ensure that your cargo is properly secured throughout the journey. With a defective strap, you may only continue your journey if proper securing of the cargo is ensured by other securing devices. If this is not the case, you must not continue your journey.",Continue your trip after the lashing strap has been replaced,Continue your trip when the load is secured by other sufficient securing means,Continue your trip because a slipping load will be caught by the side panels,,"Во время перерыва Вы обнаружили, что один из стяжных ремней порвался. Что Вы сделаете?","Как водитель, Вы должны обеспечивать надлежащее крепление груза на протяжении всей поездки. С повреждённым ремнём можно продолжить движение только в том случае, если надёжное крепление груза обеспечено другими средствами. Если это не так, продолжать поездку нельзя.",Продолжить поездку после замены стяжного ремня,"Продолжить поездку, если груз закреплён другими достаточными средствами крепления","Продолжить поездку, потому что сместившийся груз будет удержан боковыми бортами",
