questionExternalId,sourceLanguage,targetLanguage,questionTextSource,explanationSource,answerASource,answerBSource,answerCSource,answerDSource,questionTextTarget,explanationTarget,answerATarget,answerBTarget,answerCTarget,answerDTarget
2.7.01-258,en,ru,Why might your turn assist system emit a warning?,A turn assistant checks the area to the right of the truck for bikers and walkers when turning right and warns the driver.,A cyclist is located next to the right-side of my vehicle,I have crossed over a traffic lane boundary line,I am driving too fast while performing a turn,,Почему система помощи при повороте может подать предупреждение?,Система помощи при повороте при повороте направо контролирует зону справа от грузового автомобиля на наличие велосипедистов и пешеходов и предупреждает водителя.,Велосипедист находится рядом с правой стороной моего транспортного средства,Я пересёк линию разметки полосы движения,Я еду слишком быстро во время выполнения поворота,
2.7.01-259,en,ru,Your motor vehicle is equipped with a turn assist system. What function does this perform during a turning manoeuvre?,A turn assistant checks the area to the right of the truck for bikers and walkers when turning right and warns the driver.,- warns the driver of weaker road users on the passenger side,- warns the driver of obstructions on the passenger side,- can perform the complete turning manoeuvre,,Ваше транспортное средство оснащено системой помощи при повороте. Какую функцию она выполняет во время поворота?,Система помощи при повороте при повороте направо контролирует зону справа от грузового автомобиля на наличие велосипедистов и пешеходов и предупреждает водителя.,— предупреждает водителя о слабозащищённых участниках дорожного движения со стороны пассажира,— предупреждает водителя о препятствиях со стороны пассажира,— может полностью выполнить манёвр поворота,
2.7.01-260,en,ru,What can you expect if you take a truck with a heavy load and drive it around a tight bend?,"A heavily loaded truck can tip over when negotiating a tight curve, or inadequately secured cargo can slip because of centrifugal forces that are proportional to the mass of the vehicle and the cargo. These forces can destabilize the vehicle and cause it to tip over, especially if the center of gravity is high. Inadequately secured loads can slip due to these forces, further affecting the vehicle's balance and increasing the risk of accidents. Correct load securing is therefore essential to ensure the stability of the vehicle and increase road safety.",The lorry can tip over if driven too fast,Insufficiently secured cargo can slip,The lorry handles better on bends,,"Чего можно ожидать, если вы едете на грузовом автомобиле с тяжёлым грузом по крутому повороту?","Тяжело загруженный грузовой автомобиль при слишком высокой скорости на крутом повороте может опрокинуться, а недостаточно закреплённый груз может сместиться из-за центробежных сил, которые зависят от массы транспортного средства.","Грузовик может опрокинуться, если ехать слишком быстро",Недостаточно закреплённый груз может сместиться,Грузовик лучше проходит повороты,
2.7.01-301,en,ru,Which facilities on a trailer are not operational when the electrical connections to the towing vehicle are interrupted or the cables are not connected?,"If the cables from the trailer are not operational because the electronic connection has been lost to the towing vehicle, the ABS is not working and lighting equipment will not work.",The automatic anti-locking device (ABS),All lighting facilities,The anti-slip device (ASR),,"Какие устройства на прицепе не работают, если электрические соединения с тягачом прерваны или кабели не подключены?","Если кабели прицепа не работают из-за отсутствия электрического соединения с тягачом, ABS не работает, а световые устройства не будут функционировать.",Автоматическая антиблокировочная система (ABS),Все световые устройства,Противобуксовочная система (ASR),
2.7.01-305,en,ru,What should you regularly check with a spare tyre carried in the vehicle?,When carried spare you should pay attention to the secure attachment and check the air pressure. Profile name is incorrect.,That it is securely in place,The tyre pressure,The profile designation,,"Что следует регулярно проверять у запасного колеса, перевозимого в транспортном средстве?",У перевозимого запасного колеса необходимо обращать внимание на надёжность крепления и проверять давление воздуха. Обозначение рисунка протектора не является правильным ответом.,Надёжность его крепления,Давление в шине,Обозначение рисунка протектора,
2.7.01-306,en,ru,"You are driving a loaded truck on a road with gradients. Despite engaging the permanent brake, the speed increases markedly. What is the right course of action?",You should try to increase the engine braking effect of your truck for a downgrade by looking brakes on with the service brake to be able to switch back.,Continue braking using the service brake to allow you to change down gears,Disengage the permanent brake and maintain speed using the service brake only,Continue braking using the service brake to allow you to change up gears,,"Вы едете на загруженном грузовике по дороге с уклонами. Несмотря на включение постоянного тормоза, скорость заметно увеличивается. Как правильно поступить?","На спуске следует попытаться усилить тормозное действие двигателя, дополнительно притормозив рабочим тормозом, чтобы можно было переключиться на пониженную передачу.","Продолжать тормозить рабочим тормозом, чтобы можно было переключиться на пониженную передачу",Отключить постоянный тормоз и поддерживать скорость только рабочим тормозом,"Продолжать тормозить рабочим тормозом, чтобы можно было переключиться на повышенную передачу",
2.7.01-307,en,ru,What should be noted with a motorbike with a conventional anti-lock braking system (ABS) when braking in a bend?,"Even if your motorcycle has ABS, you should still use controlled braking as ABS is mostly made for strong braking in straight lines. In a bend, the stronger you break, the more torque you will feel which will tend to put your motorcycle from a tilted to a straight position.",You should nevertheless perform controlled braking when in a declined position,The self-righting torque is dependent on the braking force,The transmissible braking forces increase in the declined position,,Что следует учитывать на мотоцикле с обычной антиблокировочной системой (ABS) при торможении в повороте?,"Даже если мотоцикл оснащён ABS, при торможении в повороте необходимо тормозить контролируемо, поскольку ABS в основном рассчитана на сильное торможение при движении прямо. В повороте чем сильнее торможение, тем больше выпрямляющий момент.",Тем не менее следует выполнять контролируемое торможение в наклонном положении,Выпрямляющий момент зависит от тормозного усилия,Передаваемые тормозные силы увеличиваются в наклонном положении,
2.7.01-308,en,ru,What can help the wobbling of a motorbike?,Wobbling increases at higher speed and if the weight is not well distributed such as more weight on the right or left side,Driving at a higher speed,One-sided weight loading,Driving at a slower speed,,Что может помочь при воблинге мотоцикла?,"Воблинг усиливается на высокой скорости и при неправильном распределении массы, например если больше веса приходится на правую или левую сторону.",Движение с более высокой скоростью,Односторонняя загрузка весом,Движение с меньшей скоростью,
2.7.01-309,en,ru,What can cause a motorbike to start wobbling?,Wobbling can be due to unbalanced weights (more weight to the right or left side) or wrongly fitted fairings that cause more drag to one or the other side,Wrongly fitted fairings,Unbalanced loading of side panniers,Poor fuel quality,,Что может вызвать воблинг мотоцикла?,"Воблинг может быть вызван неравномерной загрузкой, когда больше веса приходится на правую или левую сторону, а также неправильно установленными обтекателями, которые создают разное аэродинамическое сопротивление.",Неправильно установленные обтекатели,Неравномерная загрузка боковых кофров,Плохое качество топлива,
2.7.01-310,en,ru,What is the effect of the cornering characteristics of a combination vehicle (motor vehicle towing a trailer) when taking a turn?,The cornering characteristics of a vehicle combination can swing when turning and you can cut the corner.,- can jut out,- can cut the corner,- generally follows the track of the towing vehicle,,Как проявляются особенности движения автопоезда (автомобиль с прицепом) на повороте?,"При повороте автопоезд может выноситься наружу, а прицеп может срезать угол.",— может выноситься наружу,— может срезать угол,— обычно следует точно по траектории тягача,
2.7.02-001,en,ru,You notice there is play on the handlebar bearing. What must you do?,"Having a loose handlebar with some play is dangerous and make your motorcycle more difficult to control, make sure to not have any play to guarantee your safety",Have the play eliminated,Leave the play because it is easier to move the handlebar,,,Вы заметили люфт в подшипнике руля. Что необходимо сделать?,"Люфт в руле опасен и затрудняет управление мотоциклом. Необходимо устранить люфт, чтобы обеспечить безопасность.",Устранить люфт,"Оставить люфт, потому что руль легче поворачивать",,
2.7.02-002,en,ru,"When you move the handlebar, you notice that the handlebar bearing is catching in one place. What must you do?","Having catching in your handelbar bearing makes your motorcycle more difficult to control, make sure to not have any to garantee your safety",Have the catching eliminated,Increase the play of the handlebar bearing to improve track-holding,,,"При повороте руля вы замечаете, что подшипник руля заедает в одном месте. Что необходимо сделать?",Заедание подшипника руля затрудняет управление мотоциклом. Его необходимо устранить для обеспечения безопасности.,Устранить заедание,"Увеличить люфт подшипника руля, чтобы улучшить устойчивость движения",,
2.7.02-003,en,ru,What can play in the handlebar bearing cause?,"Having a loose handlebar with some play is dangerous and make your motorcycle more difficult to control, make sure to not have any play to garantee your safety",It can have a negative influence on road behaviour,Road behaviour is improved,Track-holding is improved,,К чему может привести люфт в подшипнике руля?,Люфт в руле опасен и затрудняет управление мотоциклом. Для безопасности люфта быть не должно.,Он может отрицательно повлиять на поведение транспортного средства на дороге,Поведение на дороге улучшается,Устойчивость движения улучшается,
2.7.02-004,en,ru,What effect can a defective steering shock absorber have on road behaviour?,A defective steering shock absorber can cause the steering wheel to vibrate/shimmy and decrease the stability and roadworthiness of your motorcycle,A defective steering shock absorber can cause the steering wheel to shimmy,Roadworthiness can deteriorate,Roadworthiness only deteriorates at low speed,,Какое влияние может оказать неисправный рулевой демпфер на поведение транспортного средства на дороге?,Неисправный рулевой демпфер может вызвать вибрацию или биение руля и ухудшить устойчивость и пригодность мотоцикла к движению.,Неисправный рулевой демпфер может вызвать биение руля,Пригодность к движению может ухудшиться,Пригодность к движению ухудшается только на малой скорости,
2.7.02-005,en,ru,What can decisively impair road behaviour?,All three will worsen the steering of your motorcycle making it more difficult to control and drive safely,Deflected handlebar bearing,Defective steering shock absorber,Play in the handlebar bearing,,Что может существенно ухудшить поведение транспортного средства на дороге?,"Все три неисправности ухудшают рулевое управление мотоцикла, делая его более трудным для контроля и менее безопасным.",Перекошенный подшипник руля,Неисправный рулевой демпфер,Люфт в подшипнике руля,
2.7.02-006,en,ru,You notice your motorcycle has poor track-holding. What can be the cause?,Both play in the wheel bearings and deflected back fork can cause your motorcycle to not keep its course and make handling more difficult and less safe,Too much play in the wheel bearings,Deflected backfork,,,"Вы заметили, что ваш мотоцикл плохо держит траекторию. Что может быть причиной?","И люфт в подшипниках колёс, и перекошенная задняя вилка могут привести к тому, что мотоцикл плохо держит курс, а управление становится труднее и менее безопасным.",Слишком большой люфт в подшипниках колёс,Перекошенная задняя вилка,,
2.7.02-007,en,ru,Your motorcycle no longer keeps the track. What can be defective?,A bent fork or frame can make your motorcycle not aligned which will result in difficulty to keep your course,Bent fork,Bent frame,Defective rear wheel brake,,Ваш мотоцикл больше не держит траекторию. Что может быть неисправно?,"Погнутая вилка или рама могут нарушить геометрию мотоцикла, из-за чего становится трудно удерживать траекторию.",Погнутая вилка,Погнутая рама,Неисправный тормоз заднего колеса,
2.7.02-008,en,ru,"When you throttle down without disengaging the clutch, your motorcycle no longer keeps to the track. What can be the cause of this?",Both play in the rear wheel bearing and fork bearing can cause your motorcycle to not keep its course and make handling more difficult and less safe,Too much play of the fork bearing,Too much play of the rear-wheel bearing,Idle speed too high,,При сбросе газа без выключения сцепления мотоцикл больше не держит траекторию. Что может быть причиной?,"Люфт в подшипнике заднего колеса или в подшипнике вилки может привести к тому, что мотоцикл плохо держит курс, а управление становится труднее и менее безопасным.",Слишком большой люфт в подшипнике вилки,Слишком большой люфт в подшипнике заднего колеса,Слишком высокая частота холостого хода,
2.7.02-010,en,ru,You notice that the lever travel of the hydraulic front wheel brake on your motorcycle has become considerably longer. What must you do?,It is a sign of a defective front wheel brake which needs to be repaired or replaced,Have the front wheel brake repaired,Only use the rear wheel brake until the next service,Fill up the brake fluid immediately,,"Вы заметили, что ход рычага гидравлического тормоза переднего колеса на мотоцикле стал значительно длиннее. Что необходимо сделать?","Это признак неисправности тормоза переднего колеса, который необходимо отремонтировать или заменить.",Отремонтировать тормоз переднего колеса,До следующего техобслуживания пользоваться только тормозом заднего колеса,Немедленно долить тормозную жидкость,
2.7.02-012,en,ru,The mirror holder on your motorcycle is loose. What do you do?,You should never remove your mirror and need to fix them as they are required at all time to see the traffic behind you,Fix the mirror holder,Remove the mirror,,,Крепление зеркала на вашем мотоцикле ослабло. Что вы сделаете?,"Никогда не следует снимать зеркало. Его нужно закрепить, поскольку зеркало всегда необходимо для наблюдения за движением позади.",Закрепить держатель зеркала,Снять зеркало,,
2.7.02-015,en,ru,What can you check on your tyre?,"The driver can check on the tire whether the prescribed tread depth is present and whether the tread has a consistent wear. In addition, the age of the tire can be read off the so-called DOT number.",Uniform wear of the profile,Profile,The age of the tyre,,Что можно проверить на шине?,"Водитель может проверить наличие предписанной глубины протектора и равномерность его износа. Кроме того, возраст шины можно определить по соответствующей маркировке на боковине.",Равномерный износ протектора,Протектор,Возраст шины,
2.7.02-016,en,ru,When do you need to renew the brake pads?,The car driver must replace the brake pads on the vehicle if they are heavily contaminated by oil. Replacement is also necessary and mandatory when reaching the wear limit.,If they have become oiled,If they have reached the wear limit,If they have got wet,,Когда необходимо заменить тормозные колодки?,"Водитель должен заменить тормозные колодки, если они сильно загрязнены маслом. Замена также необходима и обязательна при достижении предела износа.",Если они замаслены,Если они достигли предела износа,Если они намокли,
2.7.02-017,en,ru,"Just after driving off, you test the brakes. Why?","Immediately after the start of the journey you should check the effectiveness of the service brake with a brake test for your own safety. Unlike bleeding the brake system, you can do this yourself by pressing the brake comfortably.",To check the effectiveness of the brakes,To bleed the brake system quickly,,,Сразу после начала движения вы проверяете тормоза. Зачем?,"Сразу после начала поездки для собственной безопасности следует проверить эффективность рабочего тормоза пробным торможением. В отличие от прокачки тормозной системы, это можно сделать короткой проверкой тормозов.",Чтобы проверить эффективность тормозов,Чтобы быстро прокачать тормозную систему,,
2.7.02-019,en,ru,Why does the brake fluid have to be exchanged according to the instructions of the vehicle manufacturer?,"The brake fluid also draws water from the air, so the proportion of water in the brake fluid increases over time. Too much water will cause bubbles in the brake fluid. If air bubbles get into the brake line, the braking action can completely fail.",To ensure the brake system continues to function even under higher stress,To ensure the percentage of water in the brake fluid does not reach a level which is unacceptable,To ensure the brake system does not leak,,Почему тормозную жидкость необходимо заменять согласно указаниям производителя транспортного средства?,"Тормозная жидкость поглощает воду из воздуха, поэтому со временем доля воды в тормозной жидкости увеличивается. Слишком большое содержание воды может привести к образованию пузырьков. Если в системе появляются пузырьки воздуха или пара, тормозная система может отказать при высокой нагрузке.",Чтобы тормозная система продолжала работать даже при повышенной нагрузке,Чтобы доля воды в тормозной жидкости не достигла недопустимого уровня,Чтобы тормозная система не протекала,
