questionExternalId,sourceLanguage,targetLanguage,questionTextSource,explanationSource,answerASource,answerBSource,answerCSource,answerDSource,questionTextTarget,explanationTarget,answerATarget,answerBTarget,answerCTarget,answerDTarget
2.7.01-208,en,ru,What must you remember in regular traffic?,Coming soon...,The destination and route signs must show the correct information,The number of the bus line must be visible on the rear of the bus,"In darkness, destination and route signs are only allowed to be lit when stopping",,Что необходимо учитывать при регулярных пассажирских перевозках?,Скоро будет доступно...,Указатели пункта назначения и маршрута должны показывать правильную информацию,Номер автобусной линии должен быть виден сзади автобуса,В тёмное время суток указатели пункта назначения и маршрута разрешается освещать только во время остановки,
2.7.01-209,en,ru,On which journeys are you not allowed to transport persons who are standing up?,Coming soon...,- in non-regular traffic,- in tourist traffic to holiday destinations,- in regular traffic,,На каких рейсах запрещено перевозить стоящих пассажиров?,Скоро будет доступно...,— в нерегулярных перевозках,— в туристических перевозках к местам отдыха,— в регулярных перевозках,
2.7.01-211,en,ru,What must you provide for in winter?,Coming soon...,The steps must be free of snow and ice,The floor must remain slip-proof,The side windows in the passenger area must not mist over,,О чём необходимо позаботиться зимой?,Скоро будет доступно...,Ступеньки должны быть очищены от снега и льда,Пол должен оставаться нескользким,Боковые окна в пассажирском салоне не должны запотевать,
2.7.01-212,en,ru,What must you remember in the case of bus doors?,Coming soon...,The door areas must remain free while driving,You may only set off when all doors are completely closed,You may open the doors in the summer while driving if the passengers so wish,,Что необходимо учитывать в отношении дверей автобуса?,Скоро будет доступно...,Зоны дверей должны оставаться свободными во время движения,Начинать движение можно только после полного закрытия всех дверей,Летом можно открывать двери во время движения по желанию пассажиров,
2.7.01-216,en,ru,For what are you allowed to use the loudspeaker system when driving in regular traffic?,Coming soon...,To transmit traffic information from the radio,To give operational information,To entertain the passengers,,Для чего разрешено использовать громкоговорящую систему при движении в регулярном сообщении?,Скоро будет доступно...,Для передачи дорожной информации из радиопередачи,Для сообщения эксплуатационной информации,Для развлечения пассажиров,
2.7.01-217,en,ru,What must you show passengers if requested in regular traffic?,Coming soon...,Transport rates and transport conditions,Timetable,City map with road register,,Что вы должны показать пассажирам по их требованию в регулярном сообщении?,Скоро будет доступно...,Тарифы и условия перевозки,Расписание,План города с указателем улиц,
2.7.01-218,en,ru,When must you intervene as bus driver?,Coming soon...,- improperly use safety devices (e.g. emergency door openers),- throw objects out of the bus,- smoke in a regular bus,,Когда водитель автобуса обязан вмешаться?,Скоро будет доступно...,"— пассажиры неправильно используют устройства безопасности, например аварийные открыватели дверей",— пассажиры выбрасывают предметы из автобуса,— пассажиры курят в рейсовом автобусе,
2.7.01-219,en,ru,When must you intervene as bus driver?,Coming soon...,- annoy others by making noise,- open doors without permission,- drink refreshing beverages,,Когда водитель автобуса обязан вмешаться?,Скоро будет доступно...,— пассажиры мешают другим шумом,— пассажиры самовольно открывают двери,— пассажиры пьют прохладительные напитки,
2.7.01-220,en,ru,Which persons may you refuse to transport?,Coming soon...,Persons who would endanger safety and order of operation,Persons who would endanger the safety of other passengers,Persons accompanied by a dog,,Каким лицам вы можете отказать в перевозке?,Скоро будет доступно...,"Лицам, которые могут угрожать безопасности и порядку эксплуатации","Лицам, которые могут угрожать безопасности других пассажиров","Лицам, которых сопровождает собака",
2.7.01-221,en,ru,What are you not allowed to carry on a bus?,Coming soon...,Dangerous and malodorous materials,Objects which can cause injuries to passengers,Small animals in cages,,Что запрещено перевозить в автобусе?,Скоро будет доступно...,Опасные и зловонные вещества,"Предметы, которые могут травмировать пассажиров",Мелких животных в клетках,
2.7.01-222,en,ru,What must you remember when transporting luggage in buses?,Coming soon...,The luggage must be safely loaded,Passages and doors must remain free,Luggage may only be transported in specially marked luggage compartments,,Что необходимо учитывать при перевозке багажа в автобусах?,Скоро будет доступно...,Багаж должен быть надёжно размещён,Проходы и двери должны оставаться свободными,Багаж можно перевозить только в специально обозначенных багажных отделениях,
2.7.01-223,en,ru,What must you remember when transporting animals in buses?,Coming soon...,They may not be transported on seats,The animals may not inconvenience passengers,Dogs may only be transported when wearing a muzzle,,Что необходимо учитывать при перевозке животных в автобусах?,Скоро будет доступно...,Их нельзя перевозить на сиденьях,Животные не должны причинять неудобства пассажирам,Собак можно перевозить только в наморднике,
2.7.01-225,en,ru,What must you reckon with at a bus stop when driving a school bus?,Coming soon...,- may try to board the bus while the doors are closing,- may still push into a fully loaded bus,,,На что нужно рассчитывать на автобусной остановке при управлении школьным автобусом?,Скоро будет доступно...,"— дети могут попытаться войти в автобус, пока двери закрываются",— дети могут продолжать протискиваться в уже полностью заполненный автобус,,
2.7.01-226,en,ru,When must a school bus be marked with orange school bus signs?,Coming soon...,When school children are transported,Before and after transporting school children,,,Когда школьный автобус должен быть обозначен оранжевыми знаками «Школьный автобус»?,Скоро будет доступно...,Когда перевозятся школьники,До и после перевозки школьников,,
2.7.01-227,en,ru,What must you do as driver of a school bus before leaving a bus stop?,Coming soon...,Make sure that all doors are properly closed,Make sure there is no child in front of the bus,Switch off the hazard warning lights,,Что должен сделать водитель школьного автобуса перед отъездом от остановки?,Скоро будет доступно...,"Убедиться, что все двери правильно закрыты","Убедиться, что перед автобусом нет ребёнка",Выключить аварийную световую сигнализацию,
2.7.01-228,en,ru,When must you intervene as driver of a school bus while you are driving?,Coming soon...,- enter the marked off area,- are standing on the seats,- change places,,Когда водитель школьного автобуса обязан вмешаться во время движения?,Скоро будет доступно...,— дети входят в обозначенную запретную зону,— дети стоят на сиденьях,— дети меняются местами,
2.7.01-229,en,ru,What must you remember as driver of a regular bus or school bus when approaching bus stops?,Coming soon...,- switch on the hazard warning lights when approaching certain bus stops,- slow down in good time when approaching and avoid sudden braking,- switch on the hazard warning lights when leaving all bus stops,,Что необходимо учитывать водителю рейсового или школьного автобуса при подъезде к остановкам?,Скоро будет доступно...,— при подъезде к определённым остановкам включать аварийную световую сигнализацию,— заранее снижать скорость при подъезде и избегать резкого торможения,— при выезде со всех остановок включать аварийную световую сигнализацию,
2.7.01-231,en,ru,"As driver of a regular bus, you want to leave a bus stop. What is correct?",Coming soon...,Only switch on the indicator just before setting off,Do not force your way into the flow of traffic,Switch on the hazard warning lights when joining the flow of traffic,,Вы как водитель рейсового автобуса хотите отъехать от остановки. Что верно?,Скоро будет доступно...,Включать указатель поворота только непосредственно перед началом движения,Не вклиниваться силой в транспортный поток,Включать аварийную световую сигнализацию при выезде в транспортный поток,
2.7.01-232,en,ru,What must you remember when you want to use the ramp or lift of a bus?,Coming soon...,The ramp may only be moved in or out when the bus is standing,The lift may only be operated when the bus is standing,Ramps and lifts may also be moved in while the bus is setting off,,"Что необходимо учитывать, если вы хотите использовать пандус или подъёмник автобуса?",Скоро будет доступно...,Пандус можно выдвигать или задвигать только когда автобус стоит,Подъёмником можно пользоваться только когда автобус стоит,Пандусы и подъёмники можно также задвигать во время начала движения автобуса,
2.7.01-236,en,ru,You are driving a bus in non-regular traffic. Passengers ask you to take a break. What must you remember?,Coming soon...,Choose a location to stop where passengers are not endangered when alighting,Breaks may only be taken at locations which have public toilets,,,Вы управляете автобусом в нерегулярном сообщении. Пассажиры просят сделать перерыв. Что необходимо учитывать?,Скоро будет доступно...,"Выберите место остановки, где пассажиры не будут подвергаться опасности при выходе","Перерывы можно делать только в местах, где есть общественные туалеты",,
2.7.01-238,en,ru,A motor vehicle with air brakes has not been used for several days. When may you set off at the earliest (vehicle fully loaded)?,"If your vehicle was several days, you should make sure that the pressure warning device is no more signals. The compressed air system has most likely lost air pressure while standing.",When the signals for the pressure warning device have stopped,When the spring-loaded brake releases automatically,When 3 bar reserve pressure is shown,,Транспортное средство с пневматическими тормозами не использовалось несколько дней. Когда можно тронуться самое раннее (автомобиль полностью загружен)?,"Если транспортное средство несколько дней не использовалось, необходимо убедиться, что сигналы устройства предупреждения о давлении прекратились. Пневматическая система, скорее всего, потеряла давление воздуха во время стоянки.",Когда сигналы устройства предупреждения о давлении прекратились,Когда пружинный тормоз автоматически отпустился,Когда показывается резервное давление 3 бар,
2.7.01-242,en,ru,What must you do after changing a wheel?,Wheel nuts always ask the manufacturer instructions to put on. Not too tight. tighten wheel nuts after a short drive is also correct. The workshop does not have to be informed.,Tighten the wheel nuts according to the manufacturer's instructions,Tighten the wheel nuts again after driving a short distance,Inform the garage workshop that the wheel has been changed,,Что необходимо сделать после замены колеса?,Гайки колеса всегда следует затягивать в соответствии с инструкциями производителя. Их нельзя затягивать чрезмерно. После короткой поездки гайки колеса также необходимо подтянуть. Сообщать в мастерскую о замене колеса не требуется.,Затянуть гайки колеса согласно указаниям производителя,Снова подтянуть гайки колеса после короткой поездки,"Сообщить в автомастерскую, что колесо было заменено",
2.7.01-247,en,ru,A vehicle with a full load has a damaged tyre on the lift axle. What can you do?,In a puncture on the lifting axle you need to perform this vehicle and the truck breakdown service call to change a wheel according to the manual. to lift the axle and continue the journey is not right.,Change the tyre according to the instruction manual for this vehicle,Call the truck breakdown service,Raise the lift axle and continue your journey,,У полностью загруженного транспортного средства повреждена шина на подъёмной оси. Что можно сделать?,При повреждении шины на подъёмной оси необходимо заменить колесо согласно руководству по эксплуатации данного транспортного средства или вызвать службу помощи грузовым автомобилям. Поднимать ось и продолжать движение нельзя.,Заменить шину согласно руководству по эксплуатации этого транспортного средства,Вызвать службу помощи грузовым автомобилям,Поднять подъёмную ось и продолжить движение,
2.7.01-250,en,ru,What transport of goods is excluded from the Motor Carrier Act?,In the road haulage law stipulates that industrial goods transport vehicles that do not exceed including trailers a permissible overall weight of 3.5 tonnes.,The commercial transport of goods in trucks whose permissible total mass including their trailers does not exceed 3.5 t,The commercial transport of goods in trucks with a permissible total mass of up to 7.5 t,The commercial transport of bulk goods,,Какие перевозки грузов исключены из действия Закона о грузовых автомобильных перевозках?,"В Законе о грузовых автомобильных перевозках указано, что коммерческие перевозки грузов транспортными средствами, допустимая полная масса которых вместе с прицепами не превышает 3,5 т, исключены.","Коммерческая перевозка грузов на грузовых автомобилях, допустимая полная масса которых вместе с прицепами не превышает 3,5 т","Коммерческая перевозка грузов на грузовых автомобилях с допустимой полной массой до 7,5 т",Коммерческая перевозка сыпучих грузов,
2.7.01-251,en,ru,For which vehicles in commercial goods traffic do you need a permit?,"Permission urkunden in commercial freight must then present if for vehicles with 8 t maximum permissible weight, including trailers drive want and also for vehicles with 4 t maximum permissible weight without a trailer.",For vehicles with a permissible total mass of 8 t including trailers,For vehicles with a permissible total mass of 4 t excluding trailers,For vehicles with a permissible total mass of 3 t including trailers,,Для каких транспортных средств в коммерческих грузовых перевозках требуется разрешение?,"Разрешительные документы в коммерческих грузовых перевозках требуются, если вы хотите использовать транспортные средства с допустимой полной массой 8 т вместе с прицепами, а также транспортные средства с допустимой полной массой 4 т без прицепов.",Для транспортных средств с допустимой полной массой 8 т вместе с прицепами,Для транспортных средств с допустимой полной массой 4 т без прицепов,Для транспортных средств с допустимой полной массой 3 т вместе с прицепами,
2.7.01-253,en,ru,Your bus is equipped with a ramp operated by external power or lift operated by external power. What must you check regularly?,Coming soon...,The safety devices (e.g. reversing device),The indicators and acoustic signal for the ramp,Whether the ramp or lift function whilst the bus is moving,,Ваш автобус оснащён пандусом с внешним приводом или подъёмником с внешним приводом. Что необходимо регулярно проверять?,Скоро будет доступно...,"Устройства безопасности, например устройство обратного хода",Индикаторы и звуковой сигнал пандуса,Работает ли пандус или подъёмник во время движения автобуса,
2.7.01-254,en,ru,Where are you not allowed to use retread tyres on 100 km/h buses?,Coming soon...,On the front axle,On all axles,On the rear axle,,"Где запрещено использовать восстановленные шины на автобусах, рассчитанных на скорость 100 км/ч?",Скоро будет доступно...,На передней оси,На всех осях,На задней оси,
2.7.01-255,en,ru,"What must you be careful about, when putting on a wheel?",Please pay attention to tightening the wheel nuts to the specified torque and mutual tightening the wheel nuts. The length of the ride is not decisive.,Tightening the wheel nuts with the prescribed torque,The alternative tightening of the wheel nuts,Checking the wheel nuts only after having driven 500 km,,На что необходимо обращать внимание при установке колеса?,Обращайте внимание на затяжку гаек колеса с предписанным моментом и на их попеременную затяжку. Пройденное расстояние само по себе не является решающим.,Затяжка гаек колеса с предписанным моментом,Попеременная затяжка гаек колеса,Проверка гаек колеса только после пробега 500 км,
2.7.01-256,en,ru,What must you be aware of when operating your motor vehicle in wintry conditions?,"To ensure safety, you must drive with winter tyres, have sufficient antifreeze and clear the steps of ice and snow.",My vehicle must be fitted with winter tyres,All entry/exit steps must be clear of snow and ice prior to use,The vehicle must be filled with a sufficient amount of windscreen antifreeze,,Что необходимо учитывать при эксплуатации транспортного средства в зимних условиях?,"Для обеспечения безопасности необходимо ездить на зимних шинах, иметь достаточное количество антифриза в омывателе и очищать ступеньки от льда и снега.",Моё транспортное средство должно быть оснащено зимними шинами,Все ступеньки входа/выхода перед использованием должны быть очищены от снега и льда,В транспортном средстве должно быть достаточное количество незамерзающей жидкости для стеклоомывателя,
2.7.01-257,en,ru,You are driving a motor vehicle with a manual gearbox. How do you conserve the service brake when driving down a long downward slope?,Shift down to increase the engine braking effect.,I drop down the gears in plenty of time,I use the permanent brake,I use the parking brake,,Вы управляете транспортным средством с механической коробкой передач. Как сберечь рабочий тормоз при движении по длинному спуску?,"Переключитесь на пониженную передачу, чтобы усилить тормозное действие двигателя.",Я заранее переключаюсь на пониженные передачи,Я использую постоянный тормоз,Я использую стояночный тормоз,
