questionExternalId,sourceLanguage,targetLanguage,questionTextSource,explanationSource,answerASource,answerBSource,answerCSource,answerDSource,questionTextTarget,explanationTarget,answerATarget,answerBTarget,answerCTarget,answerDTarget
1.1.02-043-M,en,ru,How must you behave?,"Most likely, a child will come running into the road after the ball without paying attention to the traffic. Immediately slow your vehicle down to walking speed. Be especially alert and ready to brake!",slow to walking pace immediately,remain ready to brake,drive past at the same speed,,Как Вы должны вести себя?,"С большой вероятностью ребёнок побежит за мячом на дорогу, не обращая внимания на движение. Немедленно снизьте скорость автомобиля до скорости пешехода. Будьте особенно внимательны и готовы к торможению!",Немедленно снизить скорость до скорости пешехода,Оставаться готовым к торможению,Проехать мимо с той же скоростью,
1.1.02-046-M,en,ru,"In this situation, which vehicles may drive past, at walking speed only, while ensuring there is no danger to any passengers?","When the hazard warning lights of a bus are switched on at a bus stop, all vehicles in both directions must pass the bus at walking speed. There shall be no danger to or obstruction of passengers boarding or alighting the bus.",- are travelling in the same direction,- are oncoming,,,"Какие транспортные средства в этой ситуации могут проехать мимо только со скоростью пешехода, убедившись, что пассажирам не угрожает опасность?","Если у автобуса на остановке включена аварийная сигнализация, все транспортные средства в обоих направлениях должны проезжать мимо автобуса со скоростью пешехода. Пассажирам, входящим в автобус или выходящим из него, нельзя создавать опасность или помехи.","Те, которые движутся в том же направлении",Встречные транспортные средства,,
1.1.02-048-M,en,ru,What should you do now?,"Since there are children both on the left and right on the street, you should brake to walking pace and remain ready to brake.",I slow down to walking pace,I remain ready to brake,I overtake [the cyclist],,Что Вы должны сделать сейчас?,"Поскольку дети находятся на улице и слева, и справа, Вам следует снизить скорость до скорости пешехода и оставаться готовым к торможению.",Я снижаю скорость до скорости пешехода,Я остаюсь готовым к торможению,Я обгоняю [велосипедиста],
1.1.02-049,en,ru,What should you do in this situation?,"Immediately perform emergency braking to prevent a collision with the cyclist coming from the left. Continuing to ride would be dangerous in the situation, even though the traffic lights are green in your direction.",I perform an emergency braking manoeuvre,I sound my horn and continue driving,I accelerate,,Что Вы должны сделать в этой ситуации?,"Немедленно выполните экстренное торможение, чтобы избежать столкновения с велосипедистом, приближающимся слева. Продолжать движение в этой ситуации было бы опасно, даже если светофор в Вашем направлении показывает зелёный.",Я выполняю экстренное торможение,Я подаю звуковой сигнал и продолжаю движение,Я ускоряюсь,
1.1.02-050-M,en,ru,Why must you drive slowly here and be ready to brake?,"The child behind the van on the left runs towards the roadway. You cannot see whether it will stop. Therefore, be especially attentive and careful in this unclear traffic situation. Drive slowly and be ready to brake.",Because the traffic situation is confusing,Because there is a child on the carriageway,Because [the white van] is moving off,,Почему здесь нужно ехать медленно и быть готовым к торможению?,"Ребёнок за белым фургоном слева бежит к проезжей части. Вы не можете видеть, остановится ли он. Поэтому в этой неясной дорожной ситуации нужно быть особенно внимательным и осторожным. Едьте медленно и будьте готовы к торможению.",Потому что дорожная ситуация неясна,Потому что на проезжей части находится ребёнок,Потому что [белый фургон] начинает движение,
1.1.02-051-M,en,ru,What is the correct course of action in this situation?,"The man is wearing a yellow armband and has a guide dog with him. He is blind or visually impaired and cannot see the traffic situation. Special care must be taken for blind people. Therefore, you must let him cross the road in front of you.",I stop and allow the person to cross the road,"I drive to the left past the person, leaving sufficient clearance space",I flash my headlights to signal to the person that I am giving way,,Как правильно поступить в этой ситуации?,Мужчина носит жёлтую повязку и идёт с собакой-проводником. Он слепой или имеет нарушение зрения и не может видеть дорожную ситуацию. К слепым людям необходимо проявлять особую осторожность. Поэтому Вы должны дать ему перейти дорогу перед Вами.,Я останавливаюсь и даю человеку перейти дорогу,"Я объезжаю человека слева, оставляя достаточный боковой интервал","Я мигаю фарами, чтобы показать человеку, что уступаю дорогу",
1.1.02-052,en,ru,Why must you anticipate that children might behave unpredictably in road traffic situations?,"Children often behave unpredictably, which is why other road users always have to count on the unexpected. Due to external stimuli in the environment, small children are constantly distracted from the road and traffic. They continuously let their eyes hike in the area and get stuck with interesting events or objects. The noise perception also only develops in the course of life and is only available to a limited extent in children. That is why children can usually not assign the many noises in road traffic to a certain direction and it is more difficult for them to assess them purely acoustically from which direction a vehicle approaches.
In addition to the perception of the direction, the perception of distances, speeds and braking distance in childhood is not yet fully pronounced. Therefore, children can often only overlook the traffic situation incompletely.",- are easily distracted,- are frequently unable to fully grasp the road traffic situation,- are frequently unable to correctly detect the direction from which a sound is coming,,"Почему нужно ожидать, что дети могут вести себя непредсказуемо в дорожных ситуациях?","Дети часто ведут себя непредсказуемо, поэтому другие участники движения всегда должны рассчитывать на неожиданное. Из-за внешних раздражителей маленькие дети постоянно отвлекаются от дороги и движения. Их взгляд всё время блуждает по сторонам и задерживается на интересных событиях или предметах. Восприятие шума также развивается только с возрастом и у детей ограничено. Поэтому дети часто не могут определить, с какой стороны исходит звук, и им труднее на слух оценить, откуда приближается транспортное средство. Кроме направления звука, восприятие расстояний, скоростей и тормозного пути в детстве ещё не полностью сформировано. Поэтому дети часто не могут полностью оценить дорожную ситуацию.",Они легко отвлекаются,Они часто не способны полностью понять дорожную ситуацию,"Они часто не способны правильно определить направление, откуда исходит звук",
1.1.02-107,en,ru,A child is walking on the pavement with a dog on a lead. Can this cause a dangerous situation?,"Dangerous situations can arise here. The dog could break loose, and the child could run after him. It would also be conceivable that the dog would run onto the road, and the child would pull along. They should, therefore, drive slowly and be ready to brake.","Yes, if the dog suddenly runs onto the roadway and pulls the child along behind","Yes, if the dog tears away and the child runs after the dog","No, because dogs are afraid of traffic",,Ребёнок идёт по тротуару с собакой на поводке. Может ли это привести к опасной ситуации?,"Здесь могут возникнуть опасные ситуации. Собака может вырваться, а ребёнок может побежать за ней. Также возможно, что собака выбежит на дорогу и потянет за собой ребёнка. Поэтому следует ехать медленно и быть готовым к торможению.","Да, если собака внезапно выбежит на проезжую часть и потянет ребёнка за собой","Да, если собака вырвется, а ребёнок побежит за собакой","Нет, потому что собаки боятся движения транспорта",
1.1.02-108-B,en,ru,What must you heed in this situation?,"When public transport and school buses are at a stop and their hazard warning lights are switched on, the following applies: Vehicles may only pass them at walking speed and at a sufficient distance. This applies to oncoming traffic as well as to vehicles travelling in the same direction as the bus. Any danger to passengers must be ruled out by you as the driver of the vehicle.",- pass at walking speed only,- pass only if you are sure that passengers are not endangered,- not pass under any circumstances,,Что Вы должны учитывать в этой ситуации?,"Если общественный транспорт или школьные автобусы стоят на остановке с включённой аварийной сигнализацией, действует следующее: проезжать мимо можно только со скоростью пешехода и только если пассажиры не подвергаются опасности. При необходимости нужно остановиться.",Проезжать мимо только со скоростью пешехода,"Проезжать мимо только если Вы уверены, что пассажиры не подвергаются опасности",Не проезжать ни при каких обстоятельствах,
1.1.02-109-B,en,ru,Which statements are correct in this situation?,"Vehicles coming from both directions may only pass public buses, school buses and trams stopped at bus stops with caution. As the bus has not switched on its hazard warning lights, you do not have to slow your vehicle down to walking speed. Be especially attentive in the situation!",Cars coming from the opposite direction may pass the bus provided that they do so with care,You may pass the bus provided that you do so with care,"As you are coming from the opposite direction, you do not need to worry about the bus",,Какие утверждения верны в этой ситуации?,"Транспортные средства с обоих направлений могут проезжать мимо общественных автобусов, школьных автобусов и трамваев, стоящих на остановках, только с осторожностью. Если включена аварийная сигнализация, проезжать можно только со скоростью пешехода и с особой внимательностью.","Автомобили, движущиеся навстречу, могут проехать мимо автобуса, если делают это осторожно","Вы можете проехать мимо автобуса, если делаете это осторожно","Поскольку Вы движетесь навстречу, Вам не нужно обращать внимание на автобус",
1.1.02-110-B,en,ru,Which statements are correct in this situation?,"If a bus is at a stop and its hazard warning lights are switched on, you as the driver may only pass the bus at walking speed on the same carriageway. Keep a sufficient distance. If necessary, you must stop and wait. The reason for this is the safety of bus passengers, which must always be ensured. This also applies to road users travelling in oncoming traffic on the same carriageway.",The bus may be passed in either lane but no faster than at walking speed,Vehicles in both lanes must stop if passengers would otherwise be endangered,The vehicles in the left lane may pass the bus without paying any special attention,,Какие утверждения верны в этой ситуации?,"Если автобус стоит на остановке с включённой аварийной сигнализацией, водитель может проезжать мимо него только со скоростью пешехода. Если иначе пассажиры могли бы подвергнуться опасности, транспортные средства должны остановиться.","Автобус можно объехать по любой полосе, но не быстрее скорости пешехода","Транспортные средства на обеих полосах должны остановиться, если иначе пассажиры подверглись бы опасности",Транспортные средства на левой полосе могут проехать мимо автобуса без особого внимания,
1.1.02-112,en,ru,In a residential area a ball rolls out in front of your vehicle. How must you react?,"If a ball rolls in front of your vehicle in a residential area, you must expect a child to suddenly run into the road. You must therefore brake and be ready to stop, as the principle of trust does not apply in this case.",Brake,Continue driving,Avoid hitting it,,В жилом районе перед Вашим автомобилем выкатывается мяч. Как Вы должны отреагировать?,"Если в жилом районе перед Вашим автомобилем выкатывается мяч, нужно ожидать, что ребёнок внезапно выбежит на дорогу. Поэтому необходимо затормозить и быть готовым к полной остановке.",Затормозить,Продолжать движение,Объехать его,
1.1.02-113,en,ru,You are approaching children playing on the pavement. How must you behave?,Children playing on the pavement could unexpectedly run onto the roadway. The principle of trust is therefore suspended. You must reduce speed and be ready to brake.,Slow down and be ready to brake,Continue driving as before so as not to impede the traffic behind you,Sound your horn and continue driving,,"Вы приближаетесь к детям, играющим на тротуаре. Как Вы должны вести себя?","Дети, играющие на тротуаре, могут неожиданно выбежать на проезжую часть. Поэтому принцип доверия здесь не действует. Нужно снизить скорость и быть готовым к торможению.",Снизить скорость и быть готовым к торможению,"Продолжать движение как раньше, чтобы не мешать транспорту позади",Подать звуковой сигнал и продолжить движение,
1.1.02-114,en,ru,What should you anticipate in this situation?,"In this situation, you should be prepared for the danger of the dog running into the lane and dragging the child behind it, and of the dog breaking loose and the child running after it.","- will run onto the carriageway, pulling the child behind it",- will break free and the child will run after it,- will be kept securely under control by the child,,С чем Вы должны считаться в этой ситуации?,"В этой ситуации нужно быть готовым к тому, что собака выбежит на полосу движения и потянет за собой ребёнка. Также возможно, что собака вырвется, а ребёнок побежит за ней. Поэтому следует снизить скорость и быть готовым к торможению.","Побежит на проезжую часть, потянув за собой ребёнка","Вырвется, и ребёнок побежит за ней",Будет надёжно удерживаться ребёнком под контролем,
1.1.02-115,en,ru,"In this situation, do you have to proceed slowly and be ready to brake?","As the bus is at the stop and flashing on the right, you should only drive past it very carefully. In addition, there is a person standing directly in front of the bus and thus in your immediate vicinity. You must also expect passengers to get off the bus. Other people may approach the bus from the other side of the road and want to get on. You should therefore slow down in any case so that you can brake immediately if necessary.","Yes, because passengers could cross the road from in front of the bus","Yes, because pedestrians not alighting from the bus could cross the road","Yes, because the bus will begin moving immediately",,В этой ситуации нужно ли Вам двигаться медленно и быть готовым к торможению?,"Так как автобус стоит на остановке и мигает справа, проезжать мимо него следует только очень осторожно. Кроме того, есть вероятность, что пассажиры или другие пешеходы перейдут дорогу перед автобусом.","Да, потому что пассажиры могут переходить дорогу перед автобусом","Да, потому что пешеходы, не выходившие из автобуса, также могут переходить дорогу","Да, потому что автобус сразу начнёт движение",
1.1.02-116,en,ru,The tram has just become stationary at the stop. What is the right course of action?,You may carefully pass a stopping tram at walking speed - but only if this does not endanger or obstruct any passengers.,- may not be endangered,- may not be impeded,- may be warned using the horn,,Трамвай только что остановился на остановке. Как правильно поступить?,"Останавливающийся трамвай можно осторожно объехать со скоростью пешехода, но только если при этом пассажиры не подвергаются опасности и им не создаются помехи. При необходимости нужно ждать.",Не должны подвергаться опасности,Не должны испытывать помех,Можно предупредить звуковым сигналом,
1.1.02-117,en,ru,Why must you pause here?,"It's not clear what the child will do. It would be possible for the child to run onto the road without paying attention to the traffic. Therefore, you must carefully pass through: You should drive very slowly and be ready to brake.",- the child,- the motorbike,- the off-road vehicle,,Почему здесь нужно остановиться?,"Непонятно, что сделает ребёнок. Он может выбежать на дорогу, не обращая внимания на движение. Поэтому нужно остановиться и не продолжать движение, пока ситуация не станет безопасной.",Из-за ребёнка,Из-за мотоцикла,Из-за внедорожника,
1.1.02-119,en,ru,What should you do?,"Special caution is always required towards children in road traffic. In this situation, you must expect that the small child will continue to drive onto the road behind the van. Slow down to walking speed and remain alert and ready to brake at all times. Stop if necessary if you are not sure how the child will behave. It would be grossly negligent to just honk your horn and drive on.",Slow to walking pace,Remain ready to brake,Continue driving as before,,Что Вы должны сделать?,"К детям в дорожном движении всегда требуется особая осторожность. В этой ситуации нужно ожидать, что маленький ребёнок может внезапно выбежать на дорогу. Поэтому следует снизить скорость до скорости пешехода и оставаться готовым к торможению.",Снизить скорость до скорости пешехода,Оставаться готовым к торможению,Продолжать движение как раньше,
1.1.02-120-M,en,ru,What should you do?,"Pedestrians always have absolute priority at pedestrian crossings. Therefore, brake your vehicle in good time and in a clearly visible manner. This way, pedestrians can easily see that you are fulfilling your obligation to wait and that they can enter the roadway. Even if the pedestrians are still standing at the roadside, it would be absolutely forbidden to simply drive on.","Brake early, to clearly indicate to the pedestrians that I am allowing them to cross","Continue driving, even if the pedestrians stop briefly","Arc around the pedestrians, to avoid impeding the following traffic",,Что Вы должны сделать?,"На пешеходном переходе пешеходы имеют безусловный приоритет. Поэтому нужно своевременно и ясно затормозить, чтобы показать пешеходам, что Вы позволяете им перейти дорогу.","Заранее затормозить, чтобы ясно показать пешеходам, что я позволяю им перейти дорогу","Продолжать движение, даже если пешеходы ненадолго остановятся","Объехать пешеходов по дуге, чтобы не мешать транспорту позади",
