questionExternalId,sourceLanguage,targetLanguage,questionTextSource,explanationSource,answerASource,answerBSource,answerCSource,answerDSource,questionTextTarget,explanationTarget,answerATarget,answerBTarget,answerCTarget,answerDTarget
2.7.01-166,en,tr,Your vehicle is equipped with a hill-start assist. What benefit does this assist system provide?,"The hill assist can make it easier for you to start off on a hill by releasing the brakes, thus preventing unintentional rolling back.",- prevent my vehicle from rolling backwards unintentionally,- assume control of releasing the brakes,- drive all wheels simultaneously,,Aracınız yokuş kalkış asistanıyla donatılmış. Bu sistemin faydası nedir?,Yokuş kalkış asistanı aracın istemeden geriye kaymasını önlemeye yardımcı olur. Frenleri bırakma kontrolünü tamamen devralmaz ve tüm tekerlekleri aynı anda tahrik etmez.,- aracımın istemeden geriye kaymasını önler,- frenlerin bırakılmasını kontrol eder,- tüm tekerlekleri aynı anda tahrik eder,
2.7.01-167,en,tr,What applies when using driver assistance systems for longitudinal and lateral control of your vehicle?,"Before using the driver assistance system, you should understand the system's limitations. This way you know exactly which dangerous situations and malfunctions you need to pay more attention to. 
If you notice a driver assistance system malfunction, you should oversteer as quickly as possible. Through targeted oversteering, any errors in the driver assistance system during longitudinal and lateral guidance can be responded to manually. Oversteering can usually be triggered by gently pressing the accelerator and brake or by carefully counter-steering.",I need to know the system limits of the driver assistance system,I must override the driver assistance system immediately in the event of a malfunction,"When I am tired, I can let the driver assistance system take care of longitudinal and lateral control",,Aracınızın boyuna ve enine kontrolü için sürücü destek sistemleri kullanırken ne geçerlidir?,Sistem sınırlarını bilmeli ve arıza durumunda sistemi hemen geçersiz kılmalısınız. Yorgunken kontrolü sisteme bırakamazsınız.,Sürücü destek sisteminin sistem sınırlarını bilmeliyim,Arıza durumunda sürücü destek sistemini hemen geçersiz kılmalıyım,Yorgunsam boyuna ve enine kontrolü sürücü destek sistemine bırakabilirim,
2.7.01-202,en,tr,What must you be prepared for when driving a partly loaded tank truck?,"When a tank vehicle that you drive with partially loaded chambers, you need to adjust to increased risk of skidding and increased danger of tilting in curves.",A great danger of tipping over when taking bends,A great danger of skidding,Heavy steering when driving down slopes,,Kısmen dolu tanker kamyonu kullanırken neye hazırlıklı olmalısınız?,Sıvı yükün hareketi nedeniyle virajlarda devrilme ve kayma tehlikesi büyüktür.,Virajlarda büyük devrilme tehlikesi,Büyük kayma tehlikesi,Yokuş aşağı sürüşte ağır direksiyon,
2.7.01-204,en,tr,How can you avoid excessive wear of the service brakes on a long downhill slope?,"By timely switch back, you can conserve avoid heating the service brake. The use of the retarder is also helpful. The parking brake, however, is not right.",Change gears down in time,Apply the retarders,Apply the parking brake,,Uzun yokuş aşağı yolda servis frenlerinin aşırı aşınmasını nasıl önleyebilirsiniz?,Zamanında vites küçültmeli ve sürekli fren/retarder kullanmalısınız. Park freni sürüş sırasında bu amaçla kullanılmaz.,Zamanında vites küçültmek,Retarderi/sürekli freni kullanmak,Park frenini kullanmak,
2.7.01-205,en,tr,"You are driving downhill in a fully loaded bus and have underestimated the slope. Despite retarders being engaged, the speed increases appreciably. What must you do?",Coming soon...,Engage the service brakes to be able to change down gear,Release the retarders and regulate speed with the service brakes only,,,Tam yüklü otobüsle yokuş aşağı gidiyorsunuz ve eğimi hafife aldınız. Retarder devrede olmasına rağmen hız belirgin artıyor. Ne yapmalısınız?,Vites küçültebilmek için servis freniyle fren yapmalısınız. Retarderi bırakıp yalnızca servis freniyle hızı düzenlemek doğru değildir.,Vites küçültebilmek için servis frenlerini kullanmak,Retarderi bırakıp hızı yalnızca servis freniyle düzenlemek,,
2.7.01-206,en,tr,What must you remember when passengers are boarding and alighting?,Coming soon...,You may only activate the enabling device of automatic doors after the bus has stopped,You must watch all directly operated doors,"In the case of automatic doors, you may set off already when the indicator lamp for an open door is still lit",,Yolcular binerken ve inerken neyi unutmamalısınız?,Otomatik kapıların serbest bırakma tertibatını yalnızca otobüs durduktan sonra etkinleştirebilirsiniz. Doğrudan kumandalı kapıları izlemelisiniz. Açık kapı lambası yanarken hareket edemezsiniz.,Otomatik kapıların serbest bırakma tertibatını yalnızca otobüs durduktan sonra etkinleştirebilirsiniz,Doğrudan kumandalı tüm kapıları izlemelisiniz,Otomatik kapılarda açık kapı kontrol lambası hâlâ yanarken hareket edebilirsiniz,
2.7.01-207,en,tr,What must you remember when the doors of your bus are operated independently?,Coming soon...,You must regularly make sure that the squeeze protection is functioning,"For doors without squeeze protection, you must make sure that no passenger is squeezed in the doors","In the case of doors with squeeze protection, you may set off already when the indicator lamp for an open door is still lit",,Otobüsünüzün kapıları bağımsız çalıştırılıyorsa neyi unutmamalısınız?,Sıkışma korumasının çalıştığını düzenli kontrol etmeli ve sıkışma koruması olmayan kapılarda yolcunun sıkışmadığından emin olmalısınız. Açık kapı lambası yanarken hareket edemezsiniz.,Sıkışma korumasının çalıştığını düzenli olarak kontrol etmelisiniz,Sıkışma koruması olmayan kapılarda hiçbir yolcunun kapıya sıkışmadığından emin olmalısınız,Sıkışma korumalı kapılarda açık kapı kontrol lambası hâlâ yanarken hareket edebilirsiniz,
2.7.01-208,en,tr,What must you remember in regular traffic?,Coming soon...,The destination and route signs must show the correct information,The number of the bus line must be visible on the rear of the bus,"In darkness, destination and route signs are only allowed to be lit when stopping",,Düzenli sefer trafiğinde neyi unutmamalısınız?,Hedef ve güzergâh göstergeleri doğru bilgileri göstermeli ve otobüs hattı numarası otobüsün arkasında görünür olmalıdır. Karanlıkta göstergeler sadece dururken aydınlatılmaz.,Hedef ve güzergâh göstergeleri doğru bilgileri göstermelidir,Otobüs hattı numarası otobüsün arkasında görünür olmalıdır,Karanlıkta hedef ve güzergâh göstergeleri sadece dururken aydınlatılabilir,
2.7.01-209,en,tr,On which journeys are you not allowed to transport persons who are standing up?,Coming soon...,- in non-regular traffic,- in tourist traffic to holiday destinations,- in regular traffic,,Hangi yolculuklarda ayakta yolcu taşımanıza izin verilmez?,Arızi taşımacılıkta ve tatil yerlerine yapılan turistik seferlerde ayakta yolcu taşınamaz. Düzenli seferde buna izin verilebilir.,- arızi taşımacılıkta,- tatil yerlerine yapılan turistik taşımacılıkta,- düzenli sefer trafiğinde,
2.7.01-211,en,tr,What must you provide for in winter?,Coming soon...,The steps must be free of snow and ice,The floor must remain slip-proof,The side windows in the passenger area must not mist over,,Kışın neyi sağlamalısınız?,"Basamaklar kar ve buzdan arındırılmış olmalı, zemin kaymaz kalmalı ve yolcu bölümündeki yan camlar buğulanmamalıdır.",Basamaklar kar ve buzdan arındırılmış olmalıdır,Zemin kaymaz kalmalıdır,Yolcu bölümündeki yan camlar buğulanmamalıdır,
2.7.01-212,en,tr,What must you remember in the case of bus doors?,Coming soon...,The door areas must remain free while driving,You may only set off when all doors are completely closed,You may open the doors in the summer while driving if the passengers so wish,,Otobüs kapıları konusunda neyi unutmamalısınız?,Sürüş sırasında kapı alanları boş kalmalı ve yalnızca tüm kapılar tamamen kapandıktan sonra hareket edilmelidir. Yazın yolcular isterse kapılar sürüş sırasında açılamaz.,Sürüş sırasında kapı alanları boş kalmalıdır,Ancak tüm kapılar tamamen kapalıyken hareket edebilirsiniz,Yazın yolcular isterse kapıları sürüş sırasında açabilirsiniz,
2.7.01-216,en,tr,For what are you allowed to use the loudspeaker system when driving in regular traffic?,Coming soon...,To transmit traffic information from the radio,To give operational information,To entertain the passengers,,Düzenli seferde giderken hoparlör sistemini ne için kullanabilirsiniz?,Hoparlör sistemi işletmeyle ilgili bilgiler için kullanılabilir. Radyo trafik haberlerini aktarmak veya yolcuları eğlendirmek için kullanılmamalıdır.,Radyodan trafik bilgilerini aktarmak için,İşletmeyle ilgili bilgiler vermek için,Yolcuları eğlendirmek için,
2.7.01-217,en,tr,What must you show passengers if requested in regular traffic?,Coming soon...,Transport rates and transport conditions,Timetable,City map with road register,,Düzenli seferde yolcular isterse neyi göstermelisiniz?,"Yolcular isterse taşıma ücretlerini, taşıma koşullarını ve sefer tarifesini gösterebilmelisiniz. Yol adları listeli şehir haritası zorunlu değildir.",Taşıma ücretleri ve taşıma koşulları,Sefer tarifesi,Yol dizinli şehir haritası,
2.7.01-218,en,tr,When must you intervene as bus driver?,Coming soon...,- improperly use safety devices (e.g. emergency door openers),- throw objects out of the bus,- smoke in a regular bus,,Otobüs sürücüsü olarak ne zaman müdahale etmelisiniz?,"Yolcular güvenlik donanımlarını kötüye kullanırsa, otobüsten dışarı nesne atarsa veya düzenli otobüste sigara içerse müdahale etmelisiniz.",- güvenlik tertibatlarını uygunsuz kullanırlarsa (ör. acil kapı açıcıları),- otobüsten dışarı nesne atarlarsa,- düzenli otobüste sigara içerlerse,
2.7.01-219,en,tr,When must you intervene as bus driver?,Coming soon...,- annoy others by making noise,- open doors without permission,- drink refreshing beverages,,Otobüs sürücüsü olarak ne zaman müdahale etmelisiniz?,Yolcular gürültüyle başkalarını rahatsız ederse veya kapıları izinsiz açarsa müdahale etmelisiniz. Serinletici içecek içmek tek başına müdahale sebebi değildir.,- gürültü yaparak başkalarını rahatsız ederlerse,- kapıları izinsiz açarlarsa,- serinletici içecek içerlerse,
2.7.01-220,en,tr,Which persons may you refuse to transport?,Coming soon...,Persons who would endanger safety and order of operation,Persons who would endanger the safety of other passengers,Persons accompanied by a dog,,Hangi kişileri taşımayı reddedebilirsiniz?,İşletmenin güvenlik ve düzenini veya diğer yolcuların güvenliğini tehlikeye atacak kişileri taşımayı reddedebilirsiniz. Köpek eşliğinde olmak tek başına ret sebebi değildir.,İşletmenin güvenlik ve düzenini tehlikeye atacak kişiler,Diğer yolcuların güvenliğini tehlikeye atacak kişiler,Köpek eşliğindeki kişiler,
2.7.01-221,en,tr,What are you not allowed to carry on a bus?,Coming soon...,Dangerous and malodorous materials,Objects which can cause injuries to passengers,Small animals in cages,,Otobüste ne taşıyamazsınız?,Tehlikeli ve kötü kokulu maddeler ile yolcuları yaralayabilecek nesneler taşınamaz. Kafesteki küçük hayvanlar genel olarak taşınabilir.,Tehlikeli ve kötü kokulu maddeler,Yolcuların yaralanmasına neden olabilecek nesneler,Kafesteki küçük hayvanlar,
2.7.01-222,en,tr,What must you remember when transporting luggage in buses?,Coming soon...,The luggage must be safely loaded,Passages and doors must remain free,Luggage may only be transported in specially marked luggage compartments,,Otobüslerde bagaj taşırken neyi unutmamalısınız?,"Bagaj güvenli şekilde yüklenmeli, geçişler ve kapılar boş kalmalıdır. Bagaj sadece özel işaretli bölmelerde taşınmak zorunda değildir.",Bagaj güvenli şekilde yüklenmelidir,Geçişler ve kapılar boş kalmalıdır,Bagaj sadece özel işaretli bagaj bölmelerinde taşınabilir,
2.7.01-223,en,tr,What must you remember when transporting animals in buses?,Coming soon...,They may not be transported on seats,The animals may not inconvenience passengers,Dogs may only be transported when wearing a muzzle,,Otobüslerde hayvan taşırken neyi unutmamalısınız?,Hayvanlar koltuklarda taşınamaz ve yolcuları rahatsız etmemelidir. Köpeklerin yalnızca ağızlıkla taşınabileceği mutlak doğru değildir.,Koltuklarda taşınamazlar,Hayvanlar yolcuları rahatsız etmemelidir,Köpekler yalnızca ağızlık takılıysa taşınabilir,
2.7.01-225,en,tr,What must you reckon with at a bus stop when driving a school bus?,Coming soon...,- may try to board the bus while the doors are closing,- may still push into a fully loaded bus,,,Okul otobüsü kullanırken durakta neyi hesaba katmalısınız?,Çocuklar kapılar kapanırken binmeye çalışabilir veya tamamen dolu otobüse hâlâ sıkışarak girmeye çalışabilir.,- kapılar kapanırken otobüse binmeye çalışabilirler,- tamamen dolu otobüse hâlâ sıkışarak girmeye çalışabilirler,,
2.7.01-226,en,tr,When must a school bus be marked with orange school bus signs?,Coming soon...,When school children are transported,Before and after transporting school children,,,Okul otobüsü ne zaman turuncu okul otobüsü işaretleriyle işaretlenmelidir?,Okul çocukları taşınırken ve taşımadan önce/sonra okul otobüsü işaretleri kullanılmalıdır.,Okul çocukları taşınırken,Okul çocukları taşınmadan önce ve sonra,,
2.7.01-227,en,tr,What must you do as driver of a school bus before leaving a bus stop?,Coming soon...,Make sure that all doors are properly closed,Make sure there is no child in front of the bus,Switch off the hazard warning lights,,Okul otobüsü sürücüsü olarak duraktan ayrılmadan önce ne yapmalısınız?,Tüm kapıların düzgün kapalı olduğundan ve otobüsün önünde çocuk bulunmadığından emin olmalısınız. Dörtlü ikaz ışıkları duruma göre kullanılmalıdır.,Tüm kapıların düzgün kapalı olduğundan emin olmak,Otobüsün önünde çocuk olmadığından emin olmak,Dörtlü ikaz ışıklarını kapatmak,
2.7.01-228,en,tr,When must you intervene as driver of a school bus while you are driving?,Coming soon...,- enter the marked off area,- are standing on the seats,- change places,,Okul otobüsü sürücüsü olarak sürüş sırasında ne zaman müdahale etmelisiniz?,Çocuklar ayrılmış/işaretli alana girerse veya koltukların üzerinde ayakta durursa müdahale etmelisiniz. Yer değiştirmek tek başına her zaman müdahale sebebi değildir.,- işaretlenmiş/ayrılmış alana girerlerse,- koltukların üzerinde ayakta dururlarsa,- yer değiştirirlerse,
2.7.01-229,en,tr,What must you remember as driver of a regular bus or school bus when approaching bus stops?,Coming soon...,- switch on the hazard warning lights when approaching certain bus stops,- slow down in good time when approaching and avoid sudden braking,- switch on the hazard warning lights when leaving all bus stops,,Düzenli otobüs veya okul otobüsü sürücüsü olarak duraklara yaklaşırken neyi unutmamalısınız?,"Bazı duraklara yaklaşırken dörtlü ikaz ışıklarını yakmalı, zamanında yavaşlamalı ve ani frenlemeden kaçınmalısınız. Tüm duraklardan çıkarken dörtlü yakılmaz.",- belirli duraklara yaklaşırken dörtlü ikaz ışıklarını yakmak,- zamanında yavaşlamak ve ani frenlemeden kaçınmak,- tüm duraklardan ayrılırken dörtlü ikaz ışıklarını yakmak,
2.7.01-231,en,tr,"As driver of a regular bus, you want to leave a bus stop. What is correct?",Coming soon...,Only switch on the indicator just before setting off,Do not force your way into the flow of traffic,Switch on the hazard warning lights when joining the flow of traffic,,Düzenli otobüs sürücüsü olarak duraktan ayrılmak istiyorsunuz. Hangisi doğrudur?,Hareket etmeden hemen önce sinyal vermeli ve trafiğe zorla girmemelisiniz. Trafiğe katılırken dörtlü ikaz ışıkları kullanılmaz.,Ancak hareket etmeden hemen önce sinyal vermek,Trafik akışına zorla girmemek,Trafik akışına katılırken dörtlü ikaz ışıklarını yakmak,
2.7.01-232,en,tr,What must you remember when you want to use the ramp or lift of a bus?,Coming soon...,The ramp may only be moved in or out when the bus is standing,The lift may only be operated when the bus is standing,Ramps and lifts may also be moved in while the bus is setting off,,Otobüsün rampasını veya liftini kullanmak istediğinizde neyi unutmamalısınız?,Rampa ve lift yalnızca otobüs dururken hareket ettirilebilir veya kullanılabilir. Otobüs hareket ederken içeri alınamaz.,Rampa yalnızca otobüs dururken açılıp kapatılabilir,Lift yalnızca otobüs dururken çalıştırılabilir,"Rampa ve lift, otobüs hareket ederken de içeri alınabilir",
2.7.01-236,en,tr,You are driving a bus in non-regular traffic. Passengers ask you to take a break. What must you remember?,Coming soon...,Choose a location to stop where passengers are not endangered when alighting,Breaks may only be taken at locations which have public toilets,,,Arızi taşımacılıkta otobüs kullanıyorsunuz. Yolcular mola istiyor. Neyi unutmamalısınız?,Yolcular inerken tehlikeye düşmeyecekleri bir durma yeri seçmelisiniz. Molalar sadece umumi tuvaleti olan yerlerde yapılmak zorunda değildir.,Yolcular inerken tehlikeye atılmayacakları bir durma yeri seçmek,Molalar yalnızca umumi tuvaleti olan yerlerde yapılabilir,,
2.7.01-238,en,tr,A motor vehicle with air brakes has not been used for several days. When may you set off at the earliest (vehicle fully loaded)?,"If your vehicle was several days, you should make sure that the pressure warning device is no more signals. The compressed air system has most likely lost air pressure while standing.",When the signals for the pressure warning device have stopped,When the spring-loaded brake releases automatically,When 3 bar reserve pressure is shown,,Havalı frenli motorlu araç birkaç gündür kullanılmadı. En erken ne zaman hareket edebilirsiniz (araç tam yüklü)?,Basınç uyarı cihazının sinyalleri kesildiğinde hareket edebilirsiniz. Yay kurmalı frenin otomatik çözülmesi veya 3 bar basınç tek başına yeterli değildir.,Basınç uyarı cihazının sinyalleri durduğunda,Yay kurmalı fren otomatik olarak çözüldüğünde,3 bar rezerv basınç gösterildiğinde,
2.7.01-242,en,tr,What must you do after changing a wheel?,Wheel nuts always ask the manufacturer instructions to put on. Not too tight. tighten wheel nuts after a short drive is also correct. The workshop does not have to be informed.,Tighten the wheel nuts according to the manufacturer's instructions,Tighten the wheel nuts again after driving a short distance,Inform the garage workshop that the wheel has been changed,,Tekerlek değiştirdikten sonra ne yapmalısınız?,Bijon somunlarını üretici talimatlarına göre sıkmalı ve kısa bir mesafe gittikten sonra tekrar sıkmalısınız. Atölyeye bilgi vermek zorunlu değildir.,Bijon somunlarını üretici talimatlarına göre sıkmak,Kısa bir mesafe gittikten sonra bijon somunlarını tekrar sıkmak,Tekerleğin değiştirildiğini garaj atölyesine bildirmek,
2.7.01-247,en,tr,A vehicle with a full load has a damaged tyre on the lift axle. What can you do?,In a puncture on the lifting axle you need to perform this vehicle and the truck breakdown service call to change a wheel according to the manual. to lift the axle and continue the journey is not right.,Change the tyre according to the instruction manual for this vehicle,Call the truck breakdown service,Raise the lift axle and continue your journey,,Tam yüklü bir araçta lift aksındaki lastik hasarlı. Ne yapabilirsiniz?,Bu araç için kullanım kılavuzuna göre lastiği değiştirebilir veya kamyon arıza servisini çağırabilirsiniz. Lift aksını kaldırıp yolculuğa devam etmek doğru değildir.,Bu araç için kullanım kılavuzuna göre lastiği değiştirmek,Kamyon arıza servisini çağırmak,Lift aksını kaldırıp yolculuğa devam etmek,
2.7.01-250,en,tr,What transport of goods is excluded from the Motor Carrier Act?,In the road haulage law stipulates that industrial goods transport vehicles that do not exceed including trailers a permissible overall weight of 3.5 tonnes.,The commercial transport of goods in trucks whose permissible total mass including their trailers does not exceed 3.5 t,The commercial transport of goods in trucks with a permissible total mass of up to 7.5 t,The commercial transport of bulk goods,,Hangi yük taşımacılığı Karayolu Yük Taşımacılığı Kanunu kapsamı dışındadır?,"Römorkları dahil izin verilen toplam kütlesi 3,5 t’yi aşmayan kamyonlarla ticari yük taşımacılığı kapsam dışıdır.","Römorkları dahil izin verilen toplam kütlesi 3,5 t’yi aşmayan kamyonlarla ticari yük taşımacılığı","İzin verilen toplam kütlesi 7,5 t’ye kadar olan kamyonlarla ticari yük taşımacılığı",Dökme yüklerin ticari taşınması,
2.7.01-251,en,tr,For which vehicles in commercial goods traffic do you need a permit?,"Permission urkunden in commercial freight must then present if for vehicles with 8 t maximum permissible weight, including trailers drive want and also for vehicles with 4 t maximum permissible weight without a trailer.",For vehicles with a permissible total mass of 8 t including trailers,For vehicles with a permissible total mass of 4 t excluding trailers,For vehicles with a permissible total mass of 3 t including trailers,,Ticari yük taşımacılığında hangi araçlar için izin gerekir?,"Römorklar dahil izin verilen toplam kütlesi 3,5 t’yi aşan araçlarda izin gerekir. 8 t ve 4 t seçenekleri buna dahildir; 3 t dahil kombinasyon için gerekmez.",Römorklar dahil izin verilen toplam kütlesi 8 t olan araçlar için,Römorklar hariç izin verilen toplam kütlesi 4 t olan araçlar için,Römorklar dahil izin verilen toplam kütlesi 3 t olan araçlar için,
2.7.01-253,en,tr,Your bus is equipped with a ramp operated by external power or lift operated by external power. What must you check regularly?,Coming soon...,The safety devices (e.g. reversing device),The indicators and acoustic signal for the ramp,Whether the ramp or lift function whilst the bus is moving,,Otobüsünüz dış güçle çalışan rampa veya liftle donatılmış. Neyi düzenli kontrol etmelisiniz?,"Güvenlik tertibatları, örneğin geri alma tertibatı, ayrıca rampanın göstergeleri ve sesli sinyali düzenli kontrol edilmelidir. Rampanın/liftin otobüs hareket ederken çalışması kontrol edilmez.",Güvenlik tertibatları (ör. geri alma tertibatı),Rampanın göstergeleri ve sesli sinyali,Otobüs hareket halindeyken rampa veya liftin çalışıp çalışmadığı,
2.7.01-254,en,tr,Where are you not allowed to use retread tyres on 100 km/h buses?,Coming soon...,On the front axle,On all axles,On the rear axle,,100 km/saat otobüslerde kaplanmış lastikleri nerede kullanamazsınız?,100 km/saat otobüslerde kaplanmış lastikler ön aksta kullanılamaz.,Ön aksta,Tüm akslarda,Arka aksta,
2.7.01-255,en,tr,"What must you be careful about, when putting on a wheel?",Please pay attention to tightening the wheel nuts to the specified torque and mutual tightening the wheel nuts. The length of the ride is not decisive.,Tightening the wheel nuts with the prescribed torque,The alternative tightening of the wheel nuts,Checking the wheel nuts only after having driven 500 km,,Tekerlek takarken neye dikkat etmelisiniz?,Bijon somunları öngörülen torkla ve çapraz/sıralı şekilde sıkılmalıdır. Bijonlar sadece 500 km sonra kontrol edilmez.,Bijon somunlarını öngörülen torkla sıkmak,Bijon somunlarını dönüşümlü/çapraz sıkmak,Bijon somunlarını yalnızca 500 km sürdükten sonra kontrol etmek,
2.7.01-256,en,tr,What must you be aware of when operating your motor vehicle in wintry conditions?,"To ensure safety, you must drive with winter tyres, have sufficient antifreeze and clear the steps of ice and snow.",My vehicle must be fitted with winter tyres,All entry/exit steps must be clear of snow and ice prior to use,The vehicle must be filled with a sufficient amount of windscreen antifreeze,,Kış koşullarında motorlu aracınızı kullanırken neye dikkat etmelisiniz?,"Araç kış lastikleriyle donatılmalı, tüm giriş/çıkış basamakları kullanımdan önce kar ve buzdan arındırılmalı ve cam yıkama sisteminde yeterli antifriz bulunmalıdır.",Aracımda kış lastikleri takılı olmalıdır,Tüm giriş/çıkış basamakları kullanımdan önce kar ve buzdan temizlenmelidir,Araçta yeterli cam yıkama antifrizi bulunmalıdır,
