questionExternalId,sourceLanguage,targetLanguage,questionTextSource,explanationSource,answerASource,answerBSource,answerCSource,answerDSource,questionTextTarget,explanationTarget,answerATarget,answerBTarget,answerCTarget,answerDTarget
2.2.23-063,en,tr,"When driving, what can cause you to miss warning signals?","Noise that is too loud, such as listening to music that is too loud, can drown out the warning signal and cause you to react to it too late.
Distractions caused by talking on the phone can also mean that you hear warning signals too late or not at all.",Listening to loud music,Becoming distracting during a telephone call,Driving at a low engine speed,,Sürüş sırasında uyarı sinyallerini kaçırmanıza ne neden olabilir?,Yüksek sesle müzik dinlemek ve telefon görüşmesi sırasında dikkatin dağılması uyarı sinyallerinin duyulmamasına yol açabilir. Düşük motor devri belirleyici değildir.,Yüksek sesle müzik dinlemek,Telefon görüşmesi sırasında dikkatin dağılması,Düşük motor devrinde sürmek,
2.2.23-064,en,tr,What is the benefit of wearing an integral helmet when riding a motorcycle?,"A full-face helmet offers more protection than other helmet models, as full-face helmets are completely closed. The chin forms a whole with the helmet and cannot be pushed up, which means you are well protected against injuries. The complete face protection keeps wind, rain and insects away from your eyes. Your eyes are protected against wind and weather by the visor and your vision is not restricted by the weather.",- injuries,- insects,- becoming wet,,Motosiklet sürerken tam kapalı kask takmanın faydası nedir?,"Tam kapalı kask yaralanmalara, böceklere ve ıslanmaya karşı daha iyi koruma sağlar.",- yaralanmalara karşı,- böceklere karşı,- ıslanmaya karşı,
2.2.23-065,en,tr,What should you check on your two-wheeler before moving off?,You should check that the lights on your two-wheeler are working properly every time before you set off. It is also essential to check that the brakes are working before you set off.,The proper functioning of the lights,The proper functioning of the brakes,The ignition timing setting,,İki tekerlekli aracınızla hareket etmeden önce neyi kontrol etmelisiniz?,Hareket etmeden önce ışıkların ve frenlerin düzgün çalıştığını kontrol etmelisiniz. Ateşleme zamanlaması sürücünün düzenli kontrolü değildir.,Işıkların düzgün çalışması,Frenlerin düzgün çalışması,Ateşleme zamanlaması ayarı,
2.2.23-066,en,tr,"When riding a motorbike, what makes you more visible to other road users?","If you wear eye-catching clothing, for example a motorbike jacket in bright colours or a jacket that reflects light, you will be more visible to other road users.",By wearing high-visibility clothing,By wearing clothing with retro-reflective details during hours of darkness,By driving with the main beam light on,,Motosiklet sürerken diğer yol kullanıcıları tarafından daha iyi görülmenizi ne sağlar?,Görünürlüğü yüksek kıyafet ve karanlıkta retroreflektif ayrıntılı kıyafet görünürlüğünüzü artırır. Uzun farla sürmek doğru değildir.,Görünürlüğü yüksek kıyafet giymek,Karanlıkta retroreflektif detaylı kıyafet giymek,Uzun far açık sürmek,
2.2.23-067,en,tr,What criterion do motorbike boots have to fulfil?,"Pay attention to the exact fit, the boots should fit snugly and reach over your ankles without restricting your freedom of movement.
You should also make sure that the boots have non-slip soles, which provide good grip on the footrests.",- have an anti-slip sole,- extend over the ankle,- are loose-fitting,,Motosiklet botları hangi ölçütleri karşılamalıdır?,"Motosiklet botları kaymaz tabana sahip olmalı, bileği kapatmalı ve gevşek olmamalıdır.",- kaymaz tabana sahip olmalıdır,- bileğin üzerine kadar uzanmalıdır,- bol olmalıdır,
2.2.23-068,en,tr,What criterion do motorbike gloves have to fulfil?,"The motorbike gloves should fit snugly but not be too tight. Your fingers should be slightly bent without the fabric stretching.
The gloves should give you a good grip so that you can operate the brake and clutch levers without any problems.
Choose motorbike gloves made of abrasion-resistant materials such as leather or special textiles in order to be better protected against abrasions and burns in the event of a fall or accident.",- are close-fitting,- provide a good grip,- are made from abrasion-resistant material,,Motosiklet eldivenleri hangi ölçütleri karşılamalıdır?,"Motosiklet eldivenleri ele oturmalı, iyi kavrama sağlamalı ve aşınmaya dayanıklı malzemeden yapılmış olmalıdır.",- ele oturmalıdır,- iyi kavrama sağlamalıdır,- aşınmaya dayanıklı malzemeden yapılmış olmalıdır,
2.2.23-069,en,tr,You are riding a moped with a maximum design speed of 25 km/h. How do you need to protect yourself from head injuries?,"Since the moped can travel over 20 km/h, you must wear a suitable motorcycle helmet to adequately protect your head at this speed in traffic.",- must protect my head with a suitable and well-fitting motorcycle helmet,- must protect my head with a suitable and well-fitting bicycle helmet,- dot not have to protect my head when I’m travelling at walking speed,,Azami tasarım hızı 25 km/saat olan moped kullanıyorsunuz. Baş yaralanmalarına karşı nasıl korunmalısınız?,Bu mopedle trafikte uygun ve iyi oturan motosiklet kaskı takmalısınız. Bisiklet kaskı yeterli değildir.,- başımı uygun ve iyi oturan motosiklet kaskıyla korumalıyım,- başımı uygun ve iyi oturan bisiklet kaskıyla korumalıyım,- yürüme hızında giderken başımı korumama gerek yok,
2.2.23-070,en,tr,What should you bear in mind when buying a motorbike jacket and motorbike trousers?,"When purchasing motorcycle jackets and motorcycle pants, you should always pay attention to the safety standard markings so that you are adequately protected.
You should also make sure that the protectors sit exactly in the places they are intended for in order to protect you ideally in the event of a fall.",The protectors must be in the right places,I pay attention to safety standard labelling,Protection class A offers the highest level of protection,,Motosiklet ceketi ve pantolonu alırken neye dikkat etmelisiniz?,Koruyucular doğru yerlerde olmalı ve güvenlik standardı işaretlerine dikkat edilmelidir. Koruma sınıfı A en yüksek koruma değildir.,Koruyucular doğru yerlerde olmalıdır,Güvenlik standardı işaretlerine dikkat ederim,Koruma sınıfı A en yüksek koruma düzeyini sunar,
2.2.23-101,en,tr,What must be remembered with regard to vehicles with canvass covers?,For vehicles with tarpaulin you must take care that the view to the back is not impaired. Especially with unloaded trailers with high tarpaulins there is a risk of crosswind.,The canvass covers must not obstruct the driver's rear view through the outside mirrors,Unloaded trailers with high canvass cover superstructure are particularly sensitive to side wind,"When vehicles have canvass covers, a load must not be specially secured",,Brandalı araçlarda ne unutulmamalıdır?,"Branda, dış aynalardan arkaya görüşü engellememelidir. Yüksek brandalı boş römorklar yan rüzgâra özellikle duyarlıdır. Brandalı araçlarda yükün ayrıca güvenceye alınmasına gerek olmadığı doğru değildir.",Branda dış aynalardan arkaya görüşü engellememelidir,Yüksek brandalı boş römorklar yan rüzgâra özellikle duyarlıdır,Brandalı araçlarda yük özel olarak güvenceye alınmamalıdır,
2.2.23-103,en,tr,What must you adjust when driving a vehicle which is not your own?,"In order to drive safely with a vehicle that's not your own, you must adjust the driver-specific equipment such as seat, seatbelt, headrest and mirror according to your requirements. You can reset the trip meter, but you do not have to.","Seat, head rest, safety belt","Inside mirror, outside mirrors",Daily trip counter,,Kendinize ait olmayan bir aracı kullanırken neyi ayarlamalısınız?,"Koltuk, baş desteği, emniyet kemeri ve iç/dış aynaları kendinize göre ayarlamalısınız. Günlük kilometre sayacını ayarlamak güvenlik açısından zorunlu değildir.","Koltuk, baş desteği, emniyet kemeri","İç ayna, dış aynalar",Günlük kilometre sayacı,
2.2.23-104,en,tr,How do you secure a car with a manual gearbox against rolling away on a downhill slope?,"You can prevent a car with a manual transmission from rolling away by engaging a small gear, such as first gear or reverse gear. Use the parking brake and do not place the gearstick in the neutral position.",Apply the parking brake,Engage first gear or reverse gear,Put the gear lever in neutral position,,Manuel şanzımanlı bir arabayı yokuş aşağı kaymaya karşı nasıl güvenceye alırsınız?,Park frenini çekmeli ve birinci vites veya geri vitese takmalısınız. Vitesi boşa almak doğru değildir.,Park frenini çekmek,Birinci vitese veya geri vitese takmak,Vites kolunu boşa almak,
2.2.23-105,en,tr,How do you secure a car with automatic transmission against rolling away on a downhill slope?,"You can secure a car with automatic transmission against rolling away by activating the parking brake and additionally bringing the selector lever into the parking position 'P'. You may not select the position 'N', as this is the same as idling in a vehicle with manual transmission.",Apply the parking brake,"Put the selector lever in the ""P"" position","Put the selector lever in the ""N"" position",,Otomatik şanzımanlı bir arabayı yokuş aşağı kaymaya karşı nasıl güvenceye alırsınız?,Park frenini çekmeli ve vites seçiciyi P konumuna almalısınız. N konumu aracı güvenceye almaz.,Park frenini çekmek,Vites seçiciyi “P” konumuna almak,Vites seçiciyi “N” konumuna almak,
2.2.23-106,en,tr,What must you do when reversing?,"As a car driver, you are only allowed to drive backwards very slowly and with the utmost caution. When driving, look mainly to the back and in all other directions. You do not need to turn on the hazard warning light when reversing.",Mainly look to the back; also check the traffic situation at the front and at the side,Drive with particular attention and slowly,Never drive without switching on the hazard warning lights,,Geri giderken ne yapmalısınız?,"Özellikle arkaya bakmalı, öndeki ve yandaki trafik durumunu da kontrol etmeli; çok dikkatli ve yavaş sürmelisiniz. Dörtlü ikazları her zaman yakmak zorunlu değildir.",Özellikle arkaya bakmak; öndeki ve yandaki trafik durumunu da kontrol etmek,Özellikle dikkatli ve yavaş sürmek,Dörtlü ikaz ışıklarını yakmadan asla geri gitmemek,
2.2.23-107,en,tr,What can interfere with your view?,"Your vision may be impaired if the windowpane becomes dirty, if streaks form due to worn windscreen wipers, or if cargo obstructs your view.",The load,Worn wiper blades (formation of streaks),Smeared windows,,Görüşünüzü ne engelleyebilir?,"Yük, aşınmış silecek lastikleri nedeniyle oluşan izler ve kirli camlar görüşünüzü engelleyebilir.",Yük,Aşınmış silecek lastikleri (iz oluşumu),Kirli camlar,
2.2.23-113,en,tr,A single axle caravan with overrun brake is parked on a downhill slope. How do you have to secure it to prevent it from rolling away?,"In order to protect your caravan from rolling away, you must place the wheel chocks in front of the wheels and additionally secure the trailer with the parking brake.",Apply the parking brake,Put wheel chocks in front of the wheels,Put one wheel chock in front and one behind the same wheel,,Aşırı frenli tek akslı bir karavan yokuş aşağı park edilmiş. Kaymaması için nasıl güvenceye almalısınız?,Park frenini çekmeli ve tekerleklerin önüne takoz koymalısınız. Aynı tekerleğin önüne ve arkasına takoz koymak burada gerekli değildir.,Park frenini çekmek,Tekerleklerin önüne takoz koymak,Aynı tekerleğin önüne ve arkasına birer takoz koymak,
2.2.23-114,en,tr,You want to reverse. What must you ensure?,"In order not to endanger others, you should be aware and let instruct you, if necessary, to the rear projecting load. Only the reversing camera is not enough.",I must allow myself to be directed by someone if necessary,I have to be aware of the load projecting to the rear,It is enough for me to use a rear-view reversing camera,,Geri gitmek istiyorsunuz. Neyi sağlamalısınız?,Gerekirse birinden sizi yönlendirmesini istemeli ve arkaya taşan yükün farkında olmalısınız. Sadece geri görüş kamerasına güvenmek yeterli değildir.,Gerekirse birinden beni yönlendirmesini istemeliyim,Arkaya taşan yükü dikkate almalıyım,Sadece geri görüş kamerası kullanmam yeterlidir,
2.2.23-115,en,tr,You have attached equipment to your tractor. What do you have to do if you want to drive on public roads?,You have to inform to the working implement mounting your tractor through the respective requirements for the transport position and dangerous parts effectively disguise so you do not endanger others. Warning light not one of them.,- familiarise myself with the relevant instructions on the transport position of the equipment,- effectively cover dangerous parts,- drive with my hazard lights switched on,,Traktörünüze ekipman taktınız. Kamu yollarında sürmek istiyorsanız ne yapmalısınız?,Ekipmanın taşıma konumuna ilişkin talimatları öğrenmeli ve tehlikeli parçaları etkili şekilde kapatmalısınız. Dörtlü ikazlarla sürmek doğru değildir.,- ekipmanın taşıma konumuna ilişkin ilgili talimatları öğrenmek,- tehlikeli parçaları etkili şekilde kapatmak,- dörtlü ikaz ışıkları açık sürmek,
2.2.23-116,en,tr,You want to reverse your truck from a property lot onto a road. What must you do?,You have to when reverse erfoderlichenfalls instruct allow to rule out a risk to other road users. Pre Coming participants on the sidewalk also included.,- have to allow myself to be directed by someone if necessary,- have to watch out for approaching road users on the footpath,- do not have to indicate,,Kamyonunuzu bir mülkten yola geri geri çıkarmak istiyorsunuz. Ne yapmalısınız?,Gerekirse birinden sizi yönlendirmesini istemeli ve kaldırımdan yaklaşan yol kullanıcılarına dikkat etmelisiniz. Sinyal vermem gerekmez demek doğru değildir.,- gerekirse birinden beni yönlendirmesini istemek,- kaldırımda yaklaşan yol kullanıcılarına dikkat etmek,- sinyal vermem gerekmez,
2.2.23-117,en,tr,Your vehicle is snowed under. What do you have to do before you drive off?,"Before you drive, you must remove the ice from your vehicle, so as not to endanger other road users. Check all windows and mirrors as well as the roof.",- remove ice and snow from the windows,- remove ice and snow from the mirrors,- remove ice and snow from the roof of the vehicle,,Aracınız kar altında. Hareket etmeden önce ne yapmalısınız?,"Hareket etmeden önce camlardan, aynalardan ve aracın tavanından buz ve karı temizlemelisiniz.",- camlardan buz ve karı temizlemek,- aynalardan buz ve karı temizlemek,- aracın tavanından buz ve karı temizlemek,
2.2.23-118,en,tr,Your vehicle is snowed under. What do you have to do before you drive off?,"As a car driver, you must make sure before every journey that a risk to other road users is excluded. Therefore, you must also clear all windows and mirrors as well as the roof of ice and snow during the day. The engine must not be used to warm the car up.",- remove ice and snow from the windows and mirrors,- remove ice and snow from the lighting systems including during daytime,- allow the engine to warm up,,Aracınız kar altında. Hareket etmeden önce ne yapmalısınız?,"Cam ve aynalardaki buz/karı, gündüz de dahil olmak üzere aydınlatma sistemlerindeki buz/karı temizlemelisiniz. Motoru ısıtmak için çalıştırmak doğru değildir.",- camlardan ve aynalardan buz ve karı temizlemek,- gündüz de dahil olmak üzere aydınlatma sistemlerinden buz ve karı temizlemek,- motoru ısıtmak,
2.2.23-119,en,tr,What should be observed when positioning the head rests in your car?,"With correctly adjusted headrests the car driver reduces the force on the cervical spine in case of sudden vehicle movements. This makes headrests a direct protection device for the protection of the vehicle occupants in accidents. The headrests that can be adjusted electrically or manually in height and inclination should be adjusted so that the crown height of the head coincides with the top edge of the headrest. In order for their protective function to be fully effective, you should tilt the headrest so that your back of the head is no more than a few centimeters away from it.",The top of the head should be level with the upper edge of the head rest,The spacing between the rear of the head and the head rests should be as small as possible,The upper edge of the head rest should conjoin with the upper neck vertebra,,Arabanızdaki baş desteklerini ayarlarken neye dikkat edilmelidir?,Baş desteğinin üst kenarı başın üst kısmıyla aynı hizada olmalı ve başın arkası ile baş desteği arasındaki mesafe mümkün olduğunca küçük olmalıdır. Üst kenar boyun omuruyla aynı hizada olmamalıdır.,Başın üstü baş desteğinin üst kenarıyla aynı hizada olmalıdır,Başın arkası ile baş desteği arasındaki mesafe mümkün olduğunca küçük olmalıdır,Baş desteğinin üst kenarı üst boyun omuruyla birleşmelidir,
2.2.23-120,en,tr,When should you refrain from using the telephone even if you have a hands-free device?,"Despite the availability of a hands-free system, you are likely to become nervous and anxious during difficult conversations. You will pay more attention to the person you are talking to and concentrate less on the road. Distraction can cause you to miss something in traffic and not be able to react quickly enough. You should also avoid using your phone in difficult traffic situations.",When the telephone conversations are stressful,In complicated traffic conditions,If this would distract me,,Eller serbest sisteminiz olsa bile ne zaman telefon kullanmaktan kaçınmalısınız?,"Stresli telefon görüşmelerinde, karmaşık trafik durumlarında veya dikkatiniz dağılacaksa telefon kullanmaktan kaçınmalısınız.",Telefon görüşmeleri stresliyse,Karmaşık trafik durumlarında,Bu beni dikkatimden uzaklaştıracaksa,
2.2.23-121,en,tr,You want to use a smartphone mounted on your motor vehicle as a navigation device. What should you observe?,"To protect yourself, you should enter your destination in the stationary vehicle and, if possible, not operate the device while driving. Use the device's voice output. So you are not distracted and can concentrate on the traffic.",- enter the destination while the vehicle is stationary,"- if possible, I should avoid operating the device while driving",- use the device's voice output function,,Motorlu aracınıza takılı akıllı telefonu navigasyon cihazı olarak kullanmak istiyorsunuz. Neye dikkat etmelisiniz?,"Hedefi araç dururken girmeli, mümkünse sürüş sırasında cihazı kullanmaktan kaçınmalı ve cihazın sesli yönlendirmesini kullanmalısınız.",- hedefi araç dururken girmek,- mümkünse sürüş sırasında cihazı kullanmaktan kaçınmak,- cihazın sesli çıkış işlevini kullanmak,
2.2.23-122,en,tr,You receive a telephone call while driving. What must you be aware of?,Phone use is prohibited if it distracts you too much from the traffic. This inevitably happens when picking up and looking at the display.,- the telephone in not held in my hand for this purpose,- using the telephone only requires a momentary glance,- the telephone is not used for longer than 7 seconds here,,Sürüş sırasında telefon araması alıyorsunuz. Neye dikkat etmelisiniz?,Telefonu elinizde tutmamalısınız. Telefon kullanımı yalnızca kısa bakış gerektiriyor veya 7 saniyeden kısa sürüyor diye serbest değildir.,- telefonu bu amaçla elimde tutmamak,- telefon kullanımı sadece kısa bir bakış gerektirir,- telefon burada 7 saniyeden uzun kullanılmaz,
2.2.23-123,en,tr,"You are planning a long journey with your motor vehicle. Before commencing the journey, what should you check on the vehicle to avoid endangering yourself and others?","You should check your tyres at regular intervals, because wear, damage or incorrectly adjusted air pressure as well as insufficient tread depth represent a major safety risk.
A minimum tread depth of 1.6 mm applies. 
The headlights should also be checked for defects and their correct setting. For example, headlights that are set too high can dazzle oncoming traffic. 
A clear view should be ensured on every journey. This includes not only ensuring that the windscreen is free of dirt, but also that there is still sufficient windscreen washer fluid.",The tyres,The headlamp setting,That the windscreen wipers are working properly,,Motorlu aracınızla uzun bir yolculuk planlıyorsunuz. Kendinizi ve başkalarını tehlikeye atmamak için yolculuktan önce araçta neyi kontrol etmelisiniz?,"Lastikleri, far ayarını ve sileceklerin düzgün çalıştığını kontrol etmelisiniz.",Lastikler,Far ayarı,Sileceklerin düzgün çalışması,
2.2.23-124,en,tr,What is the main function of the headrest in a car?,The head restraint reduces the force on the occupants' cervical spine during heavy braking or accidents.,- enhances safety for the occupants,- improves the seating position,- replaces the seatbelt in the rear seats,,Arabadaki baş desteğinin ana işlevi nedir?,"Baş desteği, sert frenleme veya kaza sırasında yolcuların boyun omurgasına binen kuvveti azaltarak güvenliği artırır.",- yolcuların güvenliğini artırır,- oturma pozisyonunu iyileştirir,- arka koltuklarda emniyet kemerinin yerine geçer,
2.2.23-125,en,tr,"While driving, the inside of your vehicle’s windscreen begins to mist over. How can you counteract this?","By increasing the air circulation on the windscreen, you can prevent the windscreen from misting up. You can also switch on the air conditioning, which dries the air and helps to remove moisture from the windscreen.",By turning on the climate control system,By directing the airflow onto the windscreen at full power,By opening the window if the outdoor humidity level is high,,Sürüş sırasında aracınızın ön camının içi buğulanmaya başlıyor. Buna nasıl karşı koyabilirsiniz?,Klima sistemini açabilir ve hava akışını tam güçle ön cama yönlendirebilirsiniz. Dış nem yüksekse camı açmak doğru çözüm değildir.,Klima sistemini açarak,Hava akışını tam güçle ön cama yönlendirerek,Dışarıdaki nem yüksekse camı açarak,
2.2.23-126,en,tr,Your car is snowed in. What do you need to do before you start your journey?,"Before you drive off, you must remove the snow from the entire vehicle as it could fall while driving and endanger other road users. In addition, the snow could slide onto your windshield when you brake, blocking your visibility and making you completely unable to act.  Also remove the snow from the lighting equipment so that other road users can see you in good time and you have adequate visibility even in dark lighting conditions. 
Also make sure that no snow covers your license plates. If the license plates are illegible, you risk an administrative offense and a fine.",- remove snow from number plate,- remove snow from the vehicle’s roof,- remove snow from the lighting equipment,,Arabanız karla kaplı. Yola çıkmadan önce ne yapmalısınız?,"Yola çıkmadan önce plaka, araç tavanı ve aydınlatma sistemlerindeki karı temizlemelisiniz.",- plakadaki karı temizlemek,- aracın tavanındaki karı temizlemek,- aydınlatma sistemlerindeki karı temizlemek,
2.2.23-127,en,tr,Which parts of your motor vehicle do you have to completely clear of snow and ice before driving off?,"Before you drive off, you must remove the snow from the entire vehicle as it could fall while driving and endanger other road users. In addition, the snow could slide onto your windshield when you brake, blocking your visibility and making you completely unable to act.",The windscreen,The exterior mirrors,The side windows,,Yola çıkmadan önce motorlu aracınızın hangi kısımlarını tamamen kar ve buzdan temizlemelisiniz?,"Ön cam, dış aynalar ve yan camlar tamamen kar ve buzdan temizlenmelidir.",Ön cam,Dış aynalar,Yan camlar,
2.2.23-128,en,tr,You want to take a trip in winter weather conditions. What do you need to bear in mind?,"Before you drive off, you must remove the snow from the entire vehicle, as it could fall while you are driving, endangering other road users and, in the worst case, causing an accident. In addition, the snow could slide onto your windshield when you brake, blocking your visibility and making you completely unable to act.",- cause accidents when falling off,- damage other vehicles when falling off,- impair your own vision when falling off,,Kış hava koşullarında yolculuk yapmak istiyorsunuz. Neyi dikkate almalısınız?,"Araç üzerindeki kar ve buz düşerse kazalara neden olabilir, diğer araçlara zarar verebilir ve kendi görüşünüzü engelleyebilir.",- düşerken kazalara neden olabilir,- düşerken diğer araçlara zarar verebilir,- düşerken kendi görüşümü engelleyebilir,
