questionExternalId,sourceLanguage,targetLanguage,questionTextSource,explanationSource,answerASource,answerBSource,answerCSource,answerDSource,questionTextTarget,explanationTarget,answerATarget,answerBTarget,answerCTarget,answerDTarget
2.2.29-205,en,tr,A vehicle exceeds the legal limits for maximum masses and dimensions. What applies when wanting to drive this vehicle on public roads?,"With a special permit, you can with a support vehicle was which prescribed drive. It requires an additional permit. The route can not be freely selected.",An supplementary permit is needed,An escort vehicle may be prescribed,The route of the vehicle can be freely selected,,Bir araç yasal azami ağırlık ve ölçü sınırlarını aşıyor. Bu aracı kamu yollarında kullanmak istiyorsanız ne geçerlidir?,Ek izin gerekir ve refakat aracı öngörülebilir. Güzergâh serbestçe seçilemez.,Ek izin gerekir,Refakat aracı öngörülebilir,Aracın güzergâhı serbestçe seçilebilir,
2.2.30-102,en,tr,To which vehicles does the sunday and public holiday driving ban apply?,"Trucks over 7.5 tons and trucks with trailers may not be moved on public roads on Sundays and public holidays. However, trailers may be towed behind tractors.",Trucks with a permissible total mass exceeding 7.5 t,All trucks with trailers,Truck tractors with trailers,,Pazar ve resmi tatil sürüş yasağı hangi araçlar için geçerlidir?,"Pazar ve resmi tatil sürüş yasağı 7,5 tondan fazla izin verilen toplam ağırlığa sahip kamyonlar ve römorklu kamyonlar için geçerlidir. Römorklu çekici traktörler bu cevapta dahil değildir.","İzin verilen toplam ağırlığı 7,5 t’yi aşan kamyonlar",Römorklu tüm kamyonlar,Römorklu çekici traktörler,
2.2.30-103,en,tr,"What motor vehicles engaged in the commercial or paid transport of goods, are prohibited from driving on Sundays and public holidays?","The driving ban on Sundays and public holidays applies to License C, i.e. trucks with trailers or trucks with a maximum permissible mass of more than 7.5 tonnes. Cars can still drive.",Trucks with a gross vehicle weight rating in excess of 7.5 t,Trucks towing a trailer,Cars towing a trailer,,Ticari veya ücret karşılığı yük taşımacılığı yapan hangi motorlu araçların pazar ve resmi tatillerde sürüşü yasaktır?,"Yasak, izin verilen toplam ağırlığı 7,5 tondan fazla olan kamyonlar ve römork çeken kamyonlar için geçerlidir. Römorklu otomobiller dahil değildir.","İzin verilen toplam ağırlığı 7,5 t’yi aşan kamyonlar",Römork çeken kamyonlar,Römork çeken otomobiller,
2.2.30-201,en,tr,The German summer holiday traffic regulations apply to which vehicles used in the transport of goods for hire or reward?,The Holiday Travel Regulation applies to trucks for the commercial or paid transport of goods with a total permissible mass of more than 7.5 t and to trucks with trailers.,To trucks with a gross vehicle weight rating in excess of 7.5 t,To trucks with a trailer,To tractors,,"Almanya yaz tatili trafik yönetmeliği, ücretli veya ticari yük taşımacılığında kullanılan hangi araçlar için geçerlidir?","Tatil trafik yönetmeliği, izin verilen toplam ağırlığı 7,5 tondan fazla olan kamyonlar ve römorklu kamyonlar için geçerlidir. Traktörler bu cevapta yer almaz.","İzin verilen toplam ağırlığı 7,5 t’yi aşan kamyonlar için",Römorklu kamyonlar için,Traktörler için,
2.2.30-204,en,tr,You want to transport goods on a commercial basis or for payment. For which vehicles or vehicle combinations does the holiday travel regulation apply?,The holiday regulations apply to all trucks with a permissible total mass of over 7.5 tonnes and to trucks with trailers.,- a maximum permissible mass of over 7.5 t,- a trailer,- a maximum permissible mass of up to 7.5 t,,Ticari olarak veya ücret karşılığı yük taşımak istiyorsunuz. Tatil trafik yönetmeliği hangi araçlar veya araç kombinasyonları için geçerlidir?,"Tatil trafik yönetmeliği izin verilen toplam ağırlığı 7,5 tondan fazla olan kamyonlar ve römorklu kamyonlar için geçerlidir.","- izin verilen toplam ağırlığı 7,5 t’nin üzerinde olanlar",- römorklu olanlar,"- izin verilen toplam ağırlığı 7,5 t’ye kadar olanlar",
2.2.32-101,en,tr,You are entering a public road e.g. from a field or building site and considerably soil the road. Who is responsible for eliminating this traffic obstruction?,"If you significantly pollute a road due to leaving an unpaved area, then you, the polluter, must clean it.","You, as you have caused it",The competent road-building authority,The persons living along this section of the road,,Tarladan veya şantiyeden kamu yoluna çıkıyor ve yolu önemli ölçüde kirletiyorsunuz. Bu trafik engelinin giderilmesinden kim sorumludur?,Yolu kirleten siz olduğunuz için bu tehlike ve engelin giderilmesinden siz sorumlusunuz.,"Siz, çünkü buna siz sebep oldunuz",Yetkili yol yapım kurumu,Bu yol kesiminde oturan kişiler,
2.2.32-102,en,tr,What must you do to avoid endangering others by equipment or load which has fallen off your vehicle?,"You must immediately remove any objects from the roadway that have fallen down and endanger other road users. Secure the danger zone. If necessary, contact the police or road services.",- remove the parts yourself,- secure the danger spot and immediately inform the road service or police,- proceed and inform the nearest municipal office,,Aracınızdan düşen ekipman veya yük nedeniyle başkalarını tehlikeye atmamak için ne yapmalısınız?,"Düşen parçaları derhal kaldırmalı, tehlikeli yeri güvenceye almalı ve gerekirse yol servisini veya polisi hemen bilgilendirmelisiniz. En yakın belediyeye haber vermek için devam etmek yeterli değildir.",- parçaları kendim kaldırmak,- tehlikeli yeri güvenceye almak ve derhal yol servisini veya polisi bilgilendirmek,- devam edip en yakın belediye ofisine haber vermek,
2.2.32-203,en,tr,"Your vehicle has left a considerable amount of dirt on the carriageway, causing a risk to road traffic. What do you have to do?",The following road users will thank you if you eliminate immediately the pollution and the danger point to the elimination doing sufficiently marked. In an easy recognition of the danger spot doing nothing is wrong.,- clean up the dirt without delay,- properly indicate the point of danger until the cleaning has taken place,- do nothing if the point of danger is easily recognisable,,Aracınız yolda trafik güvenliği için risk oluşturan ciddi kir bıraktı. Ne yapmalısınız?,Kiri gecikmeden temizlemeli ve temizlik yapılana kadar tehlikeli yeri usulüne uygun şekilde işaretlemelisiniz. Tehlike kolay fark ediliyorsa hiçbir şey yapmamak doğru değildir.,- kiri gecikmeden temizlemek,- temizlik yapılana kadar tehlikeli yeri usulüne uygun şekilde işaretlemek,- tehlikeli yer kolay fark ediliyorsa hiçbir şey yapmamak,
