questionExternalId,sourceLanguage,targetLanguage,questionTextSource,explanationSource,answerASource,answerBSource,answerCSource,answerDSource,questionTextTarget,explanationTarget,answerATarget,answerBTarget,answerCTarget,answerDTarget
2.1.10-004,en,tr,What is the risk if you become distracted while using electronic devices when driving?,Using electronic devices while driving can cause you to miss traffic signs and wander off your lane (concentration distracted).,I may deviate from my lane,I may fail to notice road traffic signs,My stopping distance may be reduced,,Sürüş sırasında elektronik cihaz kullanarak dikkatiniz dağılırsa hangi risk vardır?,Dikkatiniz dağılırsa şeridinizden çıkabilir veya trafik işaretlerini fark etmeyebilirsiniz. Durma mesafeniz azalmaz.,Şeridimden sapabilirim,Trafik işaretlerini fark etmeyebilirim,Durma mesafem azalabilir,
2.1.10-005,en,tr,What frequently causes younger drivers to have “disco accidents”?,"All three are correct. The so-called disco accidents are caused by overtiredness, by physical exhaustion and by being unfit to drive.",- are over-tired,- are physically exhausted,- are not fit to drive,,Genç sürücülerde “diskotek kazalarına” sıkça ne sebep olur?,"Aşırı yorgunluk, fiziksel bitkinlik ve sürüşe elverişli olmama genç sürücülerde gece/eğlence sonrası kazalara yol açabilir.",- aşırı yorgun olmak,- fiziksel olarak bitkin olmak,- araç kullanmaya elverişli olmamak,
2.1.10-006,en,tr,What is the right thing to do if you sense signs of fatigue during a night-time journey?,"As soon as you feel tired, you should take a break immediately. The risk of falling asleep increases with every second. If possible, you can let your passenger drive if they have the driving licence.",I interrupt the journey to take an adequate break,"I allow a co-driver to drive, if possible","I decide against taking a break, and fight the tiredness",,Gece yolculuğunda yorgunluk belirtileri hissederseniz doğru davranış nedir?,Yeterli mola vermek için yolculuğu kesmeli ve mümkünse başka bir sürücünün kullanmasına izin vermelisiniz. Yorgunluğa karşı savaşarak devam etmek doğru değildir.,Yeterli mola vermek için yolculuğu keserim,Mümkünse başka bir sürücünün kullanmasına izin veririm,Mola vermekten vazgeçer ve yorgunlukla mücadele ederim,
2.1.10-101,en,tr,What can diminish alertness in road traffic?,"All external stimuli such as joy, anger, interesting things on the radio and lively conversations can negatively affect the attention while driving, as they can be distracting.","Strong emotions (e.g. delight, annoyance, impatience)",Animated conversation,Engrossing programs on the car radio,,Trafikte dikkati ne azaltabilir?,"Sevinç, öfke veya sabırsızlık gibi güçlü duygular, canlı konuşmalar ve radyodaki sürükleyici programlar dikkati azaltabilir.","Güçlü duygular (örneğin sevinç, öfke, sabırsızlık)",Canlı konuşma,Araç radyosunda sürükleyici programlar,
2.1.10-102,en,tr,What strongly distracts you while you are driving?,"Telephoning while driving is only allowed via a hands-free system. Even then it is still a distraction. The lighting of a cigarette is considered a strong distraction, as it directs the view from the roadway to the cigarette. Whining children and passengers can be very distracting, if necessary, take a pause.",Telephoning,Lighting a cigarette,Nagging children on the backseats,,Sürüş sırasında sizi ne güçlü şekilde dikkatinizden uzaklaştırır?,"Telefon görüşmesi, sigara yakmak ve arka koltuktaki çocukların huzursuzluğu sürüş sırasında güçlü dikkat dağınıklığı yaratabilir.",Telefon etmek,Sigara yakmak,Arka koltuktaki çocukların huzursuzluğu,
2.1.10-103,en,tr,When should you interrupt your journey?,"Especially on longer trips, it can always happen that concentration subsides. If you notice that your concentration wanes noticeably, you should definitely take a break.
You should also stop if you want to cancel an object that has fallen into the vehicle. By searching and lifting an object, you can distract yourself very much. Therefore, you can endanger yourself and other road users.",- want to pick an item that has fallen down in my vehicle,- notice that the concentration is decreasing,- want to activate the cruise control system,,Yolculuğu ne zaman kesmelisiniz?,Araç içinde düşen bir şeyi almak istediğinizde veya konsantrasyonunuzun azaldığını fark ettiğinizde yolculuğu kesmelisiniz. Hız sabitleyiciyi açmak için mola gerekmez.,- aracımda düşen bir şeyi almak istediğimde,- konsantrasyonumun azaldığını fark ettiğimde,- hız sabitleyiciyi etkinleştirmek istediğimde,
2.1.11-003,en,tr,A slow driver prevents you from proceeding quickly. What is right?,Never start a risky overtaking maneuver or force your frontman to speed up with your flash light. Keep the necessary safety distance and wait for a convenient opportunity for safe overtaking.,You follow him until there is a possibility to overtake,You flash your headlights to make him drive faster,You close up to him in order to shorten the overtaking distance,,Yavaş giden bir sürücü hızlı ilerlemenizi engelliyor. Hangisi doğrudur?,Sollama için güvenli bir fırsat çıkana kadar onu takip etmelisiniz. Selektör yapmak veya çok yaklaşmak tehdit ve zorlama olabilir.,Sollama imkânı olana kadar onu takip edersiniz,Daha hızlı gitmesi için selektör yaparsınız,Sollama mesafesini kısaltmak için ona yaklaşınız,
2.1.11-007,en,tr,What makes a good driver?,A good driver adheres to the traffic regulations and is characterized by a cooperative behavior in dealing with other road users. He/she refrains from risky driving styles and careless overtaking maneuvers. A good driver does not have to prove his/her skills to others.,"He treats others like partners, drives calmly and cooly and refrains from showing that he is superior","He uses every possibility to overtake, give the slip to others and show his superiority even if his manner of driving involves risks",He drives fast in order to show his abilities,,İyi bir sürücüyü ne gösterir?,"İyi sürücü diğerlerini trafikte ortak olarak görür, sakin ve soğukkanlı sürer, üstünlük göstermeye çalışmaz. Riskli şekilde sollamak veya hızlı sürerek kendini göstermek doğru değildir.","Başkalarına ortak gibi davranır, sakin ve soğukkanlı sürer, üstünlük göstermeye çalışmaz","Riskli olsa bile her sollama fırsatını kullanır, başkalarını atlatır ve üstünlüğünü gösterir",Yeteneklerini göstermek için hızlı sürer,
2.1.11-008,en,tr,"Travelling on a main road after a lengthy period of time of following behind, you are finally able to overtake a very slow-moving car. What should you do?",You should stay calm in this situation and overtake with a sufficient safety distance without endangering other road users. Harassing others by tightly cutting them should be avoided. Otherwise an accident could occur.,- I pull back in after an adequate distance in order not to impede the other driver,- I brake briefly in order to call the attention of the other driver to his slow speed,- I drive especially slowly in order to emphasise to the other driver the effects of his driving style,,Ana yolda uzun süre arkasından gittikten sonra çok yavaş giden aracı nihayet sollayabiliyorsunuz. Ne yapmalısınız?,Sollamadan sonra diğer sürücüyü engellememek için yeterli mesafe bırakarak şeride dönmelisiniz. Onu cezalandırmak için fren yapmak veya çok yavaş gitmek yanlıştır.,- diğer sürücüyü engellememek için yeterli mesafeden sonra tekrar şeride girerim,- diğer sürücünün yavaşlığına dikkat çekmek için kısa fren yaparım,- sürüş tarzının etkisini göstermek için özellikle yavaş giderim,
2.1.11-009-M,en,tr,The vehicle ahead has prevented you from overtaking for some time now. What is the right course of action?,"The car driver has to wait until overtaking is possible without danger and always maintain the necessary safety distance to the vehicle in front. Stay calm, because tailgating, turning the headlights on full beam for a long time or honking is considered coercion and will be punished with fines or even a withdrawal of your driving license.",I wait until I am able to overtake,I close the gap,I sound my horn and flash my headlights persistently,,Öndeki araç bir süredir sizi sollamaktan alıkoyuyor. Doğru davranış nedir?,"Güvenli şekilde sollayabileceğiniz anı beklemelisiniz. Mesafeyi kapatmak, korna çalmak veya sürekli selektör yapmak doğru değildir.",Sollayabileceğim zamana kadar beklerim,Mesafeyi kapatırım,Sürekli korna çalar ve selektör yaparım,
2.1.11-010,en,tr,"Right before you want to drive off, you got annoyed about something and have become very angry. What should you do?","Getting into the car angrily can negatively affect your driving style. If you are angry, your driving style is also aggressive and limited. Therefore, only get into your vehicle when you're abreacted.","I only drive off, once I have calmed down again","I drive off, in order to distract myself from my anger","I try to reach my destination quickly, so that I can calm down there",,Hareket etmeden hemen önce bir şeye sinirlendiniz ve çok öfkelendiniz. Ne yapmalısınız?,Güvenli sürüş için sakin olmanız gerekir. Ancak tekrar sakinleştikten sonra yola çıkmalısınız.,Ancak tekrar sakinleştiğimde hareket ederim,Öfkemden uzaklaşmak için hareket ederim,Sakinleşmek için hedefime hızlıca ulaşmaya çalışırım,
2.1.11-011,en,tr,You have just avoided a road traffic accident by performing an emergency braking manoeuvre. Your hands and knees are shaking. You are still far from your destination. What should you do?,You should calm down first. Because your restlessness can have a negative effect on your driving style. Find a place to stop and relax. Afterwards you may continue the journey.,"- to the next stopping place, in order to calm myself down","- to my destination, so that I can recover my composure",,,Acil fren yaparak bir trafik kazasını az önce önlediniz. Elleriniz ve dizleriniz titriyor. Hedefinize hâlâ uzaksınız. Ne yapmalısınız?,Sakinleşmek için en yakın uygun durma yerine gitmeli ve mola vermelisiniz. Titreme devam ederken hedefe kadar sürmek doğru değildir.,- sakinleşmek için en yakın durma yerine,- kendime gelmek için hedefime kadar,,
2.1.11-012,en,tr,What should you be aware of when driving a car after a long day's work?,"After a long day at work, you are usually not fully productive and get tired faster. That's why mistakes while driving can increase and your concentration decreases.",I drive with a lower level of concentration,I will become tired more quickly,I make fewer driving errors,,Uzun bir iş gününden sonra otomobil kullanırken neye dikkat etmelisiniz?,Uzun iş gününden sonra konsantrasyonunuz azalabilir ve daha hızlı yorulabilirsiniz. Daha az hata yapacağınızı düşünmek yanlıştır.,Daha düşük konsantrasyonla sürerim,Daha hızlı yorulurum,Daha az sürüş hatası yaparım,
2.1.11-013,en,tr,How can you recognise a good driver?,A good driver always takes care to act in partnership and also knows that people can make mistakes.,- exhibits a calm and relaxed driving style,- refrains from responding to provocations on the road,- always informs other traffic participants of their driving errors,,İyi bir sürücüyü nasıl tanırsınız?,"İyi sürücü sakin ve rahat sürer, trafikteki provokasyonlara cevap vermez. Diğerlerini sürekli hataları konusunda uyarmaya çalışmaz.",- sakin ve rahat sürüş tarzı gösterir,- trafikteki provokasyonlara karşılık vermez,- diğer yol kullanıcılarına sürüş hatalarını her zaman bildirir,
2.1.11-014-M,en,tr,The [red] car in front of you has been driving slowly for some time now. What is the correct course of action in this situation?,"You maintain your speed so as not to tailgate and keep the required safe distance. It is forbidden to tailgate, tailgate too closely or honk your horn in traffic.
The road is clear, but you can only see as far as the next bend. The visible distance is too short for an overtaking manoeuvre.",I maintain my speed,"I overtake, because the road is clear",I close the distance and sound my horn,,Önünüzdeki [kırmızı] araba bir süredir yavaş gidiyor. Bu durumda doğru davranış nedir?,Güvenli sollama imkânı yoksa hızınızı koruyup yeterli mesafede kalmalısınız. Mesafeyi kapatıp korna çalmak doğru değildir.,Hızımı korurum,Yol açık olduğu için sollarım,Mesafeyi kapatır ve korna çalarım,
2.1.11-015,en,tr,What frequently causes young people to have “disco accidents”?,"Young drivers in particular have less driving experience and a higher willingness to take risks through showing off. Dangerous situations are assessed more poorly and accidents occur more frequently.
A defensive driving style can prevent accidents.",A lack of awareness of the road traffic,A high readiness to take risks,A defensive driving style,,Gençlerde “diskotek kazalarına” sıkça ne sebep olur?,Trafik durumunun yeterince farkında olmamak ve risk almaya yüksek yatkınlık gençlerde gece/eğlence kazalarına yol açabilir. Savunmacı sürüş tarzı sebep değildir.,Trafik durumunun yeterince farkında olmamak,Yüksek risk alma eğilimi,Savunmacı sürüş tarzı,
2.1.11-016,en,tr,Why can driving under pressure of time be dangerous?,"When you are under time pressure, you may underestimate dangers because your willingness to take risks increases and people often drive too fast. You should still drive defensively and stick to the speed limits to avoid endangering yourself and others.",- risks are frequently underestimated,- the driver frequently goes too fast,- a defensive driving style is frequently adopted,,Zaman baskısı altında araç kullanmak neden tehlikeli olabilir?,Zaman baskısı altında riskler çoğu zaman küçümsenir ve sürücü sık sık fazla hızlı gider. Savunmacı sürüş tarzı tehlike nedeni değildir.,- riskler sık sık küçümsenir,- sürücü sık sık fazla hızlı gider,- savunmacı sürüş tarzı sık sık benimsenir,
2.1.11-017,en,tr,"You are on a road outside of a built-up area, and a car in front of you is driving much slower than is permitted to and has the capacity to. What is the right course of action?","Even if you don't like it, you must adapt your speed to that of the car and not get too close to it. Only overtake at a suitable place and not in front of it. Do not endanger yourself or others.",I adjust my speed to that of the car,I overtake at a suitable place,"I flash my headlights, until the car begins to drive faster",,Yerleşim dışındaki bir yolda gidiyorsunuz. Önünüzdeki araç izin verilen ve yapabileceği hızdan çok daha yavaş gidiyor. Doğru davranış nedir?,Hızınızı öndeki araca uyarlamalı ve uygun bir yerde güvenli şekilde sollamalısınız. Daha hızlı gitmesi için selektör yapmak doğru değildir.,Hızımı araca uyarlarım,Uygun bir yerde sollarım,Araç hızlanana kadar selektör yaparım,
2.1.11-018,en,tr,Why is it not advisable to change lanes frequently?,"Every lane change requires certain activities: observing traffic, flashing, changing the lane yourself. In this case, other road users can be overlooked and endangered. Changing lanes often doesn't save you much time, but the more often you change lanes, the more likely you are to make mistakes.",Because this can increase the risk of driving errors,Because the time gained by this is generally very small,Because this can endanger other road users,,Sık sık şerit değiştirmeniz neden tavsiye edilmez?,"Sık şerit değiştirmek sürüş hatası riskini artırabilir, diğer yol kullanıcılarını tehlikeye atabilir ve genellikle çok az zaman kazandırır.",Çünkü sürüş hatası riskini artırabilir,Çünkü bu yolla kazanılan zaman genellikle çok azdır,Çünkü diğer yol kullanıcılarını tehlikeye atabilir,
2.1.11-019,en,tr,You have narrowly avoided a road traffic accident through emergency braking. Your hands and knees are shaking. What is the right course of action?,"Stop at the next opportunity and take a break until you have calmed down. Maybe you can get out, walk a few metres and take a deep breath. 
You should also go through the situation again in your head later, as you may realise what didn't go perfectly. That way you can adjust your driving behaviour in the future.","I take a break at the soonest possible opportunity, in order to calm myself","Later, I ponder if I could have avoided the situation",I continue driving in order to calm myself,,Acil fren yaparak bir trafik kazasını kıl payı önlediniz. Elleriniz ve dizleriniz titriyor. Doğru davranış nedir?,En kısa uygun fırsatta mola verip sakinleşmelisiniz. Sakinleşmek için sürmeye devam etmek doğru değildir. Daha sonra durumu nasıl önleyebileceğinizi değerlendirebilirsiniz.,En yakın fırsatta sakinleşmek için mola veririm,Daha sonra bu durumu önleyip önleyemeyeceğimi düşünürüm,Sakinleşmek için sürmeye devam ederim,
2.1.11-020,en,tr,"While driving, you become very annoyed at the behaviour of another road user. What is the right course of action now?","It is important that you are not distracted by the traffic if you are annoyed by the behaviour of other drivers, because road safety is paramount. Concentrate on the traffic and continue driving calmly; if you are emotionally agitated while driving, you could overlook dangers. If necessary, take a break and only continue driving when you have calmed down.",I continue to concentrate on the road traffic,I continue driving in such a way that my anger does not negatively affect road safety,"If necessary, I take a break to calm myself down",,Sürüş sırasında başka bir yol kullanıcısının davranışına çok sinirlendiniz. Şimdi doğru davranış nedir?,Trafiğe odaklanmaya devam etmeli ve öfkenizin yol güvenliğini olumsuz etkilemesine izin vermemelisiniz. Gerekirse sakinleşmek için mola verin.,Trafiğe odaklanmaya devam ederim,Öfkemin yol güvenliğini olumsuz etkilemeyeceği şekilde sürerim,Gerekirse sakinleşmek için mola veririm,
2.1.11-111,en,tr,Why does environment friendly driving in general have a beneficial effect on traffic safety?,Avoid high speeds and drive anticipatory. This not only has a positive effect on the environment. It also contributes to greater road safety.,"Because drivers think ahead when travelling, so that possible dangers can be recognized in time and well avoided",Because environment friendly driving avoids high speeds so that dangerous situations occur less frequently,Because you can only drive slowly using alternative fuels,,Çevre dostu sürüş neden genellikle trafik güvenliğine de olumlu etki eder?,Çevre dostu sürüş öngörülü sürüşü ve yüksek hızlardan kaçınmayı gerektirir. Böylece tehlikeler zamanında fark edilir ve tehlikeli durumlar daha az oluşur.,Çünkü sürücüler öngörülü sürer ve olası tehlikeler zamanında fark edilip önlenebilir,Çünkü çevre dostu sürüş yüksek hızlardan kaçınır ve tehlikeli durumlar daha az olur,Çünkü alternatif yakıtlarla sadece yavaş sürülebilir,
2.1.11-112,en,tr,"The queue you are driving in is overtaken in an inconsiderate manner by a car. Because of oncoming traffic the driver wants to join the queue in front of the car driving in front of you. This driver is annoyed and ""closes the gap"". What do you do?","In such a situation, by deliberately giving in, you should reduce the speed and giving the other road user space to go back into lane in order to reduce the risk of an accident. Remember that everyone can misjudge.",You give in and let the jostling driver join the queue,"You also ""close the gap"" in order to teach the jostling driver a lesson","Nothing, since you are not concerned",,İçinde bulunduğunuz araç kuyruğu düşüncesizce bir araç tarafından sollanıyor. Karşı trafik nedeniyle sürücü önünüzdeki aracın önüne girmek istiyor. Önünüzdeki sürücü sinirlenip boşluğu kapatıyor. Ne yaparsınız?,Tehlikeyi artırmamak için siz sakin kalmalı ve itişen sürücünün kuyruğa girmesine izin vermelisiniz. Siz de boşluğu kapatmaya çalışmamalısınız.,Yol veririm ve araya girmek isteyen sürücünün kuyruğa girmesine izin veririm,Ben de ona ders vermek için boşluğu kapatırım,"Hiçbir şey yapmam, çünkü beni ilgilendirmez",
2.1.11-113,en,tr,A truck indicating to the right is driving in front of you. An impatient car driver is jostling you. What can you do?,"In this situation it is better to cut back and keep a safe distance. Maybe the truck driver would like to signal that the road is clear. However, it may also be that he/she intends to stop or turn right. Only overtake if there is no danger. Increase the distance to the truck so that the pushy driver can overtake.",I only overtake when I am completely certain that the traffic situation allows overtaking without danger,I open up the distance to the truck to make overtaking easier for the jostling driver,I overtake because I assume that the truck driver wishes to signal to me that overtaking is possible,,Önünüzde sağ sinyal veren bir kamyon gidiyor. Sabırsız bir otomobil sürücüsü sizi sıkıştırıyor. Ne yapabilirsiniz?,Yalnızca trafik durumunun tehlikesiz sollamaya izin verdiğinden tamamen eminseniz sollamalısınız. Kamyon sinyalinin size sollama işareti olduğunu varsaymayın.,Trafik durumunun tehlikesiz sollamaya izin verdiğinden tamamen eminsem sollarım,Sıkıştıran sürücünün sollamasını kolaylaştırmak için kamyonla mesafeyi açarım,Kamyon sürücüsünün bana sollamanın mümkün olduğunu işaret ettiğini varsayarak sollarım,
2.1.11-114,en,tr,"On a road not within a built-up area, a car is driving in front of you at a speed somewhat slower than that permitted. You are annoyed at the slower-moving car. What should you do?","You should definitely wait for a safe situation to overtake. Harassing someone by tailgating or flash light, however, represents a threat or even coercion. You should refrain from doing so.",I adjust my speed to that of the vehicle ahead,I overtake at a suitable place,"I flash my headlights, until the car in front begins to drive faster",,Yerleşim dışındaki bir yolda önünüzdeki araç izin verilenden biraz daha yavaş gidiyor. Bu yavaş araç sizi sinirlendiriyor. Ne yapmalısınız?,Hızınızı öndeki araca uyarlamalı ve sadece uygun yerde sollamalısınız. Daha hızlı gitmesi için selektör yapmak tehdit veya zorlama olabilir.,Hızımı öndeki araca uyarlarım,Uygun bir yerde sollarım,Öndeki araç hızlanana kadar selektör yaparım,
2.1.11-115,en,tr,What can frequently lead to road traffic accidents during night-time recreational drives at the weekend?,Too little driving experience during the dark and a lack of knowledge about driving behavior in fully occupied vehicles often leads to accidents during nocturnal recreational rides on the weekend.,- little experience driving after dark,- little experience with fully occupied vehicles,- little knowledge of road traffic regulations,,Hafta sonu geceleri yapılan eğlence amaçlı sürüşlerde trafik kazalarına sıkça ne yol açabilir?,Karanlıkta az sürüş deneyimi ve tamamen dolu araçlarla sürüş deneyiminin az olması hafta sonu gece sürüşlerinde kazalara yol açabilir. Trafik kurallarını az bilmek burada tipik sebep olarak belirtilmez.,- karanlıkta sürüş deneyiminin az olması,- tamamen dolu araçlarla deneyimin az olması,- trafik kuralları hakkında az bilgi,
2.1.11-116,en,tr,You are under time pressure. What must you ensure?,"Even if you are under time pressure, you must follow the traffic rules. This also means that you comply with the speed limits. After all, excessive speed is THE main cause of accidents.",- to exceed the speed,- to drive through the traffic lights even when red,- to reduce the safety,,Zaman baskısı altındasınız. Neyi sağlamalısınız?,"Zaman baskısı altında olsanız bile trafik kurallarına uymalısınız. Bu, hız sınırlarına uymayı da içerir; aşırı hız kazaların ana nedenlerinden biridir.",- hızı aşmamak,- kırmızı ışıkta geçmemek,- güvenliği azaltmamak,
2.1.11-117,en,tr,Serious accidents frequently occur when young people drive cars during night-time recreational drives at weekends. What causes can be particularly relevant here?,Unreasonable speed and willingness to take risks often lead to serious accidents among young people during weekend rides at night.,Inappropriate speed,High risk readiness,Hesitant driving style,,Gençlerin hafta sonu gece eğlence sürüşlerinde ciddi kazalar sık görülür. Hangi nedenler burada özellikle önemlidir?,Uygunsuz hız ve risk almaya yüksek yatkınlık gençlerin hafta sonu gece sürüşlerinde ciddi kazalara sıkça yol açar.,Uygun olmayan hız,Yüksek risk alma eğilimi,Tereddütlü sürüş tarzı,
