questionExternalId,sourceLanguage,targetLanguage,questionTextSource,explanationSource,answerASource,answerBSource,answerCSource,answerDSource,questionTextTarget,explanationTarget,answerATarget,answerBTarget,answerCTarget,answerDTarget
2.2.23-201,en,tr,What must you do to prevent a two-axle truck from rolling down a steep slope?,"Against rolling away in a steep slope, you should apply the parking brake and put a wheel chock of a rear wheel. The duration of a two-axle truck brake does not work on steep slopes.",Engage the parking brake,Place a wheel chock under a rear wheel,Apply the retarders,,İki akslı bir kamyonun dik yokuşta aşağı kaymasını önlemek için ne yapmalısınız?,Dik yokuşta kaymayı önlemek için park frenini çekmeli ve arka tekerleklerden birinin altına takoz koymalısınız. Retarder aracı park halinde güvenceye almak için yeterli değildir.,Park frenini çekmek,Arka tekerleklerden birinin altına takoz koymak,Retarderi devreye sokmak,
2.2.23-202,en,tr,What must you do to prevent a two-axle bus from rolling down a slope?,Coming soon...,Engage the parking brake,Place a wheel chock under a rear wheel,Engage the bus-stop brake,,İki akslı bir otobüsün yokuşta aşağı kaymasını önlemek için ne yapmalısınız?,Yokuşta kaymayı önlemek için park frenini çekmeli ve arka tekerleklerden birinin altına takoz koymalısınız. Durak freni bunun için yeterli değildir.,Park frenini çekmek,Arka tekerleklerden birinin altına takoz koymak,Durak frenini devreye sokmak,
2.2.23-212,en,tr,How can you reduce the danger created by the blind spot?,"A reduction in the dead angle can be achieved by observing the traffic behind. If you abbiegst only when you are sure no other road users that is next to you, can so a reduction can be achieved. Brisk turn is not right.",By monitoring the traffic behind at short intervals,By turning only when you are sure that no road users are beside the vehicle,By turning quickly,,Kör noktanın oluşturduğu tehlikeyi nasıl azaltabilirsiniz?,Arkadaki trafiği kısa aralıklarla izleyerek ve yanınızda başka yol kullanıcısı olmadığından emin olduktan sonra dönerek kör nokta tehlikesini azaltabilirsiniz. Hızlı dönmek doğru değildir.,Arkadaki trafiği kısa aralıklarla izleyerek,Sadece aracın yanında yol kullanıcısı olmadığından emin olduğumda dönerek,Hızlı dönerek,
2.2.23-213,en,tr,How do you secure the traffic area behind the vehicle when you reverse from a property piece of land into a street?,You can by a fuse items the traffic space. Horns or switching on the hazard warning lights are not included.,Ask someone to secure the road area behind your vehicle,By switching on the hazard warning lights,By sounding your horn several times,,Bir araziden/sahadan yola geri geri çıkarken aracın arkasındaki trafik alanını nasıl güvenceye alırsınız?,Gerekirse bir kişiden aracınızın arkasındaki yol alanını güvenceye almasını istemelisiniz. Korna çalmak veya dörtlü ikazları yakmak tek başına yeterli değildir.,Birinden aracımın arkasındaki yol alanını güvenceye almasını isterim,Dörtlü ikaz ışıklarını yakarak,Birkaç kez korna çalarak,
2.2.23-214,en,tr,What must you be aware of when loading your vehicle with loose bulk material?,"This will be covered during the loading of loose bulk material must, if it could be blown while driving down and loaded so that it can not fall over the side while driving.","- be covered, if it could be blown away along the journey",- be loaded in such a way that it cannot fall over the tailgate along the journey,- be transported as far back as possible on the loading surface,,Aracınızı gevşek dökme malzemeyle yüklerken neye dikkat etmelisiniz?,Gevşek dökme malzeme yolculuk sırasında uçabilecekse örtülmeli ve sürüş sırasında arka kapaktan dökülmeyecek şekilde yüklenmelidir. Yük mümkün olduğunca arkaya yerleştirilmemelidir.,- yolculuk sırasında uçabilecekse örtülmelidir,- yolculuk sırasında arka kapaktan dökülmeyecek şekilde yüklenmelidir,- yükleme alanında mümkün olduğunca arkaya taşınmalıdır,
2.2.23-215,en,tr,You want to de-ice the body of your vehicle. What equipment is suitable for this purpose?,"You can use all the third De-icing, Enteisungsbühne or a Enteisungsleiter with seat belt and back hoop.",A de-icing platform,A de-icing gantry,A de-icing ladder with safety belt and rear safety guard,,Aracınızın üst yapısındaki buzu çözmek istiyorsunuz. Bunun için hangi ekipman uygundur?,"Araç üst yapısındaki buzun güvenli şekilde çözülmesi için buz çözme platformu, buz çözme portalı veya emniyet kemerli ve arka korumalı buz çözme merdiveni kullanılabilir.",Buz çözme platformu,Buz çözme portalı,Emniyet kemerli ve arka korumalı buz çözme merdiveni,
2.2.23-216,en,tr,"After stopping for a lengthy time, you wish to continue driving. What should you do?","3 answers are correct. The top priority is road safety. Therefore, please, if there are children under the vehicle check. Make a visual inspection of the vehicle condition check and by securing the load.",I should check that there are no children under the vehicle,I have to perform a visual inspection of the condition of the vehicle,I have to check that the load is secure,,Uzun süre durduktan sonra sürüşe devam etmek istiyorsunuz. Ne yapmalısınız?,"Sürüşe devam etmeden önce aracın altında çocuk olmadığını kontrol etmeli, aracın durumunu görsel olarak incelemeli ve yükün güvenliğini kontrol etmelisiniz.",Aracın altında çocuk olmadığını kontrol etmeliyim,Aracın durumunu görsel olarak kontrol etmeliyim,Yükün güvenli olduğunu kontrol etmeliyim,
2.2.23-217,en,tr,"You have installed a front-mounted, forward-extending attachment to your motor vehicle. What must you be aware of?",Because of your extensive forward front attachment you need to consider while driving the modified vehicle dimensions. can ward where visibility is restricted by an appropriate person and dangerous parts of the front mounted implement effective disguise. All three are correct.,- arrange for a suitable person to direct me in situations where my visibility is impaired,- take the modified vehicle dimensions into account while driving,- effectively cover the dangerous parts of the front-mounted attachment,,Motorlu aracınıza öne doğru uzanan ön ekipman taktınız. Neye dikkat etmelisiniz?,Görüşünüz kısıtlıysa uygun bir kişiden yönlendirme almalısınız. Değişen araç ölçülerini dikkate almalı ve ön ekipmanın tehlikeli parçalarını etkili şekilde kapatmalısınız.,- görüşüm kısıtlıysa uygun bir kişiden beni yönlendirmesini istemek,- sürüş sırasında değişen araç ölçülerini dikkate almak,- ön ekipmanın tehlikeli parçalarını etkili şekilde kapatmak,
2.2.23-218,en,tr,You want to continue your journey after taking a break at a service station. What should you check before recommencing your journey?,"After ending a break, you should make sure that there are no loose objects in the footwell. You should also point out and check that all passengers have sat on their seat. Also check that all doors are closed correctly.",- there are no loose objects in my footwell,- all doors are closed correctly,- all passengers are seated,,Dinlenme tesisinde mola verdikten sonra yolculuğa devam etmek istiyorsunuz. Devam etmeden önce neyi kontrol etmelisiniz?,"Ayak bölmenizde gevşek eşya olmadığını, tüm kapıların doğru kapandığını ve tüm yolcuların oturduğunu kontrol etmelisiniz.",- ayak bölümümde gevşek eşya olmadığını,- tüm kapıların doğru kapandığını,- tüm yolcuların oturduğunu,
2.2.23-219,en,tr,How can you clear the snow and ice from the structure of your vehicle?,"When de-icing the vehicle, it is essential to use suitable aids such as de-icing bridges or de-icing ladders with sufficient fall protection to minimize the risk of falls.  Pressing against the tarpaulin structure from the inside with a suitable tool makes it possible to loosen ice and snow without having to climb onto the roof, which also reduces the risk of accidents.",By using a de-icing platform,By using a deicing ladder with adequate fall protection,By pressing against the tarpaulin structure from the inside with a suitable implement (e.g. a broom),,Aracınızın üst yapısındaki kar ve buzu nasıl temizleyebilirsiniz?,"Buz çözme platformu, düşmeye karşı yeterli korumalı buz çözme merdiveni veya branda yapısına içeriden uygun bir araçla bastırma yöntemi kullanılabilir.",Buz çözme platformu kullanarak,Yeterli düşme korumalı buz çözme merdiveni kullanarak,Branda yapısına içeriden uygun bir araçla (ör. süpürge) bastırarak,
2.2.23-301,en,tr,What must you remember in terms of lighting when you wish to attach a trailer?,"Regarding the lighting, you should attached to a trailer, you should make sure that the voltage of tractor and trailer is the same and plug and socket must be properly connected. And extends the trailer sideways more than 40 cm above the running lights of the tractor addition, he must have his own position lamps.",The trailer must have its own side lights if it extends laterally more than 40 cm beyond the side lights of the truck tractor,Truck tractor and trailer must have the same electric tension. Plug and socket must be properly connected,The electric tension of the truck tractor and trailer may be different if the tension of the trailer is lower,,Römork takmak istediğinizde aydınlatma açısından neyi unutmamalısınız?,"Römork yan lambalardan 40 cm’den fazla yana taşıyorsa kendi yan lambalarına sahip olmalıdır. Çekici ve römorkun elektrik voltajı aynı olmalı, fiş ve priz doğru bağlanmalıdır.","Römork, çekicinin yan lambalarından 40 cm’den fazla yana taşıyorsa kendi yan lambalarına sahip olmalıdır",Çekici ve römork aynı elektrik voltajına sahip olmalıdır. Fiş ve priz doğru bağlanmalıdır,Römorkun voltajı daha düşükse çekici ve römorkun elektrik voltajı farklı olabilir,
2.2.23-302,en,tr,The tarpaulin of your trailer is frozen over. What could happen when you start a journey?,"When the tarp is iced up your trailer, it can happen that can be severely damaged by falling ice sheets during braking air and electrical lines on the car, people are critically injured and other vehicles will be significantly damaged. Please remove the ice from the tarpaulin.",- serious damage to air lines and electric cables when braking,- people to suffer life-threatening injuries,- severely damage other vehicles,,Römorkunuzun brandası donmuş. Yola çıkınca ne olabilir?,"Düşen buz parçaları frenleme sırasında hava hatlarına ve elektrik kablolarına ciddi zarar verebilir, insanlara hayati tehlike oluşturabilir ve diğer araçlara ağır hasar verebilir.",- frenleme sırasında hava hatları ve elektrik kablolarına ciddi zarar verebilir,- insanların hayati tehlike taşıyan yaralanmalar yaşamasına neden olabilir,- diğer araçlara ağır hasar verebilir,
2.2.23-401,en,tr,A two-axle trailer with overrun brakes and fifth-wheel steering is parked on a slope. How must it be secured against rolling?,Coming soon...,By engaging the parking brake,By placing a wheel chock under a rear wheel,By supporting the forked draw-bar at the height of the coupling,,Aşırı frenli ve beşinci tekerlek yönlendirmeli iki akslı bir römork yokuşta park edilmiş. Kaymaya karşı nasıl güvenceye alınmalıdır?,"Römork park freni çekilerek, arka tekerleğin altına takoz konarak ve çeki demiri bağlantı yüksekliğinde desteklenerek güvenceye alınmalıdır.",Park frenini çekerek,Arka tekerleklerden birinin altına takoz koyarak,Çatal çeki demirini bağlantı yüksekliğinde destekleyerek,
2.2.23-402,en,tr,You have mounted twin tyres on your truck tractor. What must you remember?,Coming soon...,Additional lights must be mounted on the outside in darkness if the tyres extend laterally more than 40 cm beyond the lights,"If the width of the truck tractor exceeds 2.75 m due to the twin tyres, the excessive width must be marked by warning plates","The width of the truck tractor must not exceed 2.55 m, also with twin tyres",,Çekici kamyonunuza çift lastik taktınız. Neyi unutmamalısınız?,"Çift lastikler lambalardan yana 40 cm’den fazla taşıyorsa karanlıkta dışa ek lambalar takılmalıdır. Çift lastikler nedeniyle genişlik 2,75 m’yi aşarsa fazla genişlik uyarı levhalarıyla işaretlenmelidir.",Lastikler lambalardan yana 40 cm’den fazla taşıyorsa karanlıkta dışa ek lambalar takılmalıdır,"Çift lastikler nedeniyle çekicinin genişliği 2,75 m’yi aşarsa fazla genişlik uyarı levhalarıyla işaretlenmelidir","Çekici kamyonun genişliği çift lastiklerle de 2,55 m’yi aşmamalıdır",
2.2.23-403,en,tr,In what situations may I allow a cyclist to be pulled along?,Pulling along cyclists is dangerous for both you and the cyclist and is not allowed,- in no circumstances,- if I drive no faster than walking speed,- if I am driving on less-frequented roads,,Hangi durumlarda bir bisikletlinin aracınıza tutunarak çekilmesine izin verebilirsiniz?,Bisikletlinin araca tutunarak çekilmesine hiçbir durumda izin verilmez. Bu hem sizin hem bisikletli için tehlikelidir.,- hiçbir durumda,- yürüme hızından hızlı gitmezsem,- az kullanılan yollarda gidiyorsam,
2.2.23-404,en,tr,"As a moped driver (not a light moped), what precautions must you take against head injuries?","To protect your head against injury, an adequate helmet is required. A cyclist or construction helmet is not legal nor sufficient.",- a suitable crash helmet,- a certified helmet for cyclists,- a certified construction site helmet,,Moped sürücüsü olarak (hafif moped değil) baş yaralanmalarına karşı hangi önlemi almalısınız?,Baş yaralanmalarına karşı uygun koruyucu kask takmalısınız. Bisiklet kaskı veya inşaat kaskı yeterli değildir.,- uygun koruyucu kask,- sertifikalı bisiklet kaskı,- sertifikalı inşaat kaskı,
2.2.23-406,en,tr,Who is prohibited from using a mobile phone without a hands-free unit when driving?,"Car drivers are allowed to use mobile and car telephones while driving only with hands-free equipment. As soon as you need to pick up or hold the phone to make the call, it is forbidden to make a call while driving.",- cars,- trucks,- motorcycles,,Sürüş sırasında eller serbest sistemi olmadan cep telefonu kullanması kimler için yasaktır?,"Otomobil, kamyon ve motosiklet sürücüleri sürüş sırasında telefonu ellerinde tutarak kullanamaz. Kullanım için eller serbest sistem gerekir.",- otomobil sürücüleri,- kamyon sürücüleri,- motosiklet sürücüleri,
2.2.23-407,en,tr,You want to attach a device to your tractor. In what situations do you have to be particularly careful?,"Especially cautious you should be when the attachments through your vehicle far back. Or even far beyond stand forward and protrude sideways. Again, all three right.",- laterally projects beyond the side of the vehicle,- projects far to the rear of the vehicle,- projects far to the front of the vehicle,,Traktörünüze bir cihaz takmak istiyorsunuz. Hangi durumlarda özellikle dikkatli olmalısınız?,"Takılı cihaz aracın yanlarından dışarı taşıyorsa, arkaya çok uzanıyorsa veya öne çok uzanıyorsa özellikle dikkatli olmalısınız.",- aracın yanından dışarı taşıyorsa,- aracın arkasına çok uzanıyorsa,- aracın önüne çok uzanıyorsa,
2.2.23-408,en,tr,"When riding a motorbike, how can you help other road users to see you better and as early as possible?",Wearing highly visible clothes (conspicuous clothes) and retro-reflective clothes at night will increase your visibility to other people on the road. Wearing dark clothes with no retro-reflective clothes makes you hard to see on the road.,By wearing conspicuous clothing,By wearing retro-reflective clothing after dark,By driving with the main beam light on,,Motosiklet sürerken diğer yol kullanıcılarının sizi daha iyi ve erken görmesine nasıl yardımcı olabilirsiniz?,Dikkat çekici kıyafet giyerek ve karanlıkta geri yansıtıcı kıyafet kullanarak görünürlüğünüzü artırabilirsiniz. Uzun farla gitmek doğru değildir.,Dikkat çekici kıyafet giyerek,Karanlıkta geri yansıtıcı kıyafet giyerek,Uzun far açık sürerek,
2.2.23-409,en,tr,What items form part of your protective clothing when riding a motorbike?,Wearing highly visible clothes (conspicuous clothes) and retro-reflective clothes at night will increase your visibility to other people on the road. Wearing dark clothes with no retro-reflective clothes makes you hard to see on the road.,Suitable crash helmet,Suitable gloves,Suitable tank bag,,Motosiklet sürerken koruyucu kıyafetinizin parçaları nelerdir?,Uygun koruyucu kask ve uygun eldiven koruyucu ekipmanın parçalarıdır. Depo çantası koruyucu kıyafet değildir.,Uygun koruyucu kask,Uygun eldiven,Uygun depo çantası,
2.2.23-410,en,tr,What items increase safety when riding a motorbike?,"Special motorcycle clothing (highly visible, retro-reflective gear at night for example) and a back protector will increase your safety and diminish the risk of injury",Back protectors,Special motorcycling clothing,Top case,,Motosiklet sürerken hangi parçalar güvenliği artırır?,Sırt koruyucuları ve özel motosiklet kıyafetleri güvenliği artırır ve yaralanma riskini azaltabilir. Topcase koruyucu ekipman değildir.,Sırt koruyucuları,Özel motosiklet kıyafeti,Topcase,
2.2.23-411,en,tr,You have fitted your motorbike with a tank bag and side panniers. What must you ensure?,"When loading your motorcycle with bags and panniers, make sure that you do not exceed the gross vehicle weight limit, that you adjust the rear wheel suspension as well as tire pressure due to additional weight",The gross vehicle weight rating may not be exceeded,The tyre inflation pressure should be adjusted to the larger loaded weight,The rear wheel suspension should be adjusted to the larger load if necessary,,Motosikletinize depo çantası ve yan çantalar taktınız. Neyi sağlamalısınız?,"İzin verilen toplam ağırlık aşılmamalı, lastik basıncı artan yüke göre ayarlanmalı ve gerekirse arka tekerlek süspansiyonu daha büyük yüke uyarlanmalıdır.",İzin verilen toplam ağırlık aşılmamalıdır,Lastik basıncı daha büyük yüke göre ayarlanmalıdır,Arka tekerlek süspansiyonu gerekirse daha büyük yüke göre ayarlanmalıdır,
2.2.23-412,en,tr,You want to drive your agricultural tractor with attached accessory equipment. What must you be aware of before driving off?,Put the implements in transport position and secure them so that they do not pose a danger. Observe the maximum permissible axle loads.,The accessory equipment must be put into the transport position and secured there,The maximum gross axle weight rating must be observed,The pedals of the single-wheeled brakes must be disengaged,,Takılı ekipmanlı tarım traktörünüzü kullanmak istiyorsunuz. Hareket etmeden önce neye dikkat etmelisiniz?,Takılı ekipman taşıma konumuna alınmalı ve orada güvenceye alınmalıdır. İzin verilen azami aks yükleri korunmalıdır. Tek teker fren pedalları ayrık olmamalıdır.,Takılı ekipman taşıma konumuna alınmalı ve orada güvenceye alınmalıdır,İzin verilen azami aks yüküne uyulmalıdır,Tek teker frenlerinin pedalları ayrılmış olmalıdır,
2.2.23-413,en,tr,"You are driving an agricultural tractor with a mounted implement. After finishing working in the field, you want to drive on to a public road. What must you check first?","You must check the transport position of the implement for road travel, as well as the connection device between the tractor and the implement. Furthermore, check the condition and function of the lighting equipment.",The coupling device between the tractor and the mounted implement,The transport position of the mounted implement for driving on roads,The condition and proper functioning of the lighting systems,,Takılı ekipmanlı tarım traktörü kullanıyorsunuz. Tarladaki işi bitirdikten sonra kamu yoluna çıkmak istiyorsunuz. Önce neyi kontrol etmelisiniz?,"Traktör ile takılı ekipman arasındaki bağlantı tertibatını, ekipmanın yol sürüşü için taşıma konumunu ve aydınlatma sistemlerinin durumunu ve çalışmasını kontrol etmelisiniz.",Traktör ile takılı ekipman arasındaki bağlantı tertibatı,Takılı ekipmanın yolda sürüş için taşıma konumu,Aydınlatma sistemlerinin durumu ve doğru çalışması,
2.2.23-414,en,tr,"You are driving a tractor with an attachment. After working in a field, now you want to drive on a public road. What should you note first?","Before driving a tractor with a mounted implement on a road, check that the implement is in the transport position. In addition, the pedals for the individual wheel brakes must be locked and the necessary warning signs must be attached to indicate the width of the vehicle.",The foot pedals are locked for the single wheel brake,The attachment is in its transport position,The necessary warning panels are attached to indicate the vehicle width,,Ekipman takılı traktör kullanıyorsunuz. Tarladaki çalışmadan sonra kamu yoluna çıkmak istiyorsunuz. Önce neye dikkat etmelisiniz?,"Tek teker fren pedalları kilitli olmalı, ekipman taşıma konumunda olmalı ve araç genişliğini göstermek için gerekli uyarı levhaları takılı olmalıdır.",Tek teker fren pedalları kilitlidir,Ekipman taşıma konumundadır,Araç genişliğini göstermek için gerekli uyarı levhaları takılıdır,
2.2.26-102,en,tr,You come to a stop unexpectedly on a pedestrian crossing. What do you do?,"To avoid danger for pedestrians, pedestrian crossings must be kept clear. Therefore, you need to clear the crossing as soon as possible. Drive forwards or backwards as far as the traffic conditions allow. Pay attention to other road users. Do not drive on the sidewalk. This is intended exclusively for pedestrians.",Move slightly forward or backward in order to clear the crossing as quickly as possible,Move half onto the footpath in order to clear the crossing,"Reverse under no circumstances, even though the roadway is clear behind you",,Beklenmedik şekilde yaya geçidinde durdunuz. Ne yaparsınız?,Yaya geçidini mümkün olan en kısa sürede boşaltmak için trafik koşulları izin veriyorsa biraz ileri veya geri hareket etmelisiniz. Kaldırıma çıkmamalısınız.,Geçidi mümkün olduğunca çabuk boşaltmak için biraz ileri veya geri hareket ederim,Geçidi boşaltmak için yarı kaldırıma çıkarım,Arkamdaki yol boş olsa bile hiçbir koşulda geri gitmem,
2.2.29-001,en,tr,What may result from taking part in illegal road races?,Participation in illegal road races can lead to serious traffic accidents and can result in a custodial sentence for the driver and the revocation of the driver's licence.,The occurrence of serious road traffic accidents,The imposition of a term of imprisonment on the vehicle driver,The confiscation of the vehicle driver's driving licence,,Yasa dışı yol yarışlarına katılmanın sonucu ne olabilir?,"Yasa dışı yol yarışları ciddi trafik kazalarına, sürücü için hapis cezasına ve sürücü belgesinin geri alınmasına yol açabilir.",Ciddi trafik kazalarının meydana gelmesi,Araç sürücüsüne hapis cezası verilmesi,Araç sürücüsünün sürücü belgesine el konulması,
2.2.29-203,en,tr,A 2.50 m wide motor vehicle is loaded with bulky goods projecting laterally more than 50 cm over the side and rear lights. What must be remembered when transporting the load?,"If your load 50 cm extends laterally beyond the front and rear position lamps, please make sure to take the charge forward and backward marked and carry the special permission of the Road Safety Authority.",The extra-wide load must be marked to the front and rear,A special permit from the road traffic licensing authority must be carried,"If an amber rotating lamp is used, the load can be transported as a matter of course",,"2,50 m genişliğinde bir motorlu araç, yan ve arka lambalardan 50 cm’den fazla yana taşan hacimli yükle yüklenmiştir. Bu yük taşınırken ne unutulmamalıdır?",Ekstra geniş yük öne ve arkaya işaretlenmeli ve karayolu trafik ruhsatlandırma makamından özel izin taşınmalıdır. Sarı döner lamba tek başına yeterli değildir.,Ekstra geniş yük öne ve arkaya işaretlenmelidir,Karayolu trafik ruhsatlandırma makamından özel izin taşınmalıdır,Sarı döner lamba kullanılırsa yük doğal olarak taşınabilir,
2.2.29-204,en,tr,A 3-metre wide construction machine is to be transported on public roads. Under which conditions may you perform the transport?,With your 3-meter wide construction machine on public roads you must charge your mark and the competent authority must ask you a permit for the transport have been granted.,The load must be labelled,The competent authority has issued a permit for the transport,The load need not be labelled,,3 metre genişliğinde bir iş makinesi kamu yollarında taşınacak. Hangi şartlarda bu taşımayı yapabilirsiniz?,Yük işaretlenmeli ve yetkili makam taşıma için izin vermiş olmalıdır.,Yük işaretlenmelidir,Yetkili makam taşıma için izin vermiştir,Yükün işaretlenmesine gerek yoktur,
