questionExternalId,sourceLanguage,targetLanguage,questionTextSource,explanationSource,answerASource,answerBSource,answerCSource,answerDSource,questionTextTarget,explanationTarget,answerATarget,answerBTarget,answerCTarget,answerDTarget
2.7.01-135,en,tr,You are planning a longer journey with a purely electric vehicle. What should you be aware of?,"If you are planning a longer journey with a purely electric vehicle, you should consider that your car has a much lower range compared to conventional vehicles. In addition, the capacity of the batteries is influenced by the outside temperature.",The availability of electric charging stations,The battery charging time,The influence of external ambient temperatures on the range,,Ani fren sırasında elektronik stabilite programı (ESP) size nasıl yardımcı olur?,ESP aracın savrulmasını azaltabilir ve yön dengesini korumaya yardımcı olabilir. Fizik sınırlarını ortadan kaldırmaz.,- aracın savrulmasını azaltabilir,- yön dengesini korumaya yardımcı olabilir,- fren mesafesini her durumda kısaltır,
2.7.01-136,en,tr,What should you be aware of when charging purely electric vehicles?,"When charging pure electric vehicles, you must be aware that they cannot be recharged at every gas station. Only use the charging cables approved by the manufacturer. Depending on the power connection, the charging time varies.",The charge time depends on the power supply,Charging should only be performed with a charging cable approved by the manufacturer,Charging is available at every filling station,,Adaptif hız sabitleyici (ACC) hangi durumda size yardımcı olabilir?,ACC öndeki araca olan mesafeyi ve seçilen hızı korumaya yardımcı olur. Sürücünün sorumluluğunu ortadan kaldırmaz.,- öndeki araca mesafeyi korumada,- seçilen hızı korumada,- kavşakta geçiş önceliğini belirlemede,
2.7.01-137,en,tr,How is a purely electric vehicle different from a vehicle with a combustion engine?,Pure electric vehicles are almost noiseless. These vehicles also have no direct exhaust emissions. The aerodynamic drag depends on the volume of the body and not on the type of drive.,- have a lower engine noise,- do not have any direct exhaust emissions,- have a lower aerodynamic drag,,Acil fren asistanı hangi durumda yardımcı olabilir?,Acil fren asistanı kritik durumlarda frenlemeyi destekleyebilir veya otomatik acil frenleme başlatabilir. Dikkatsiz sürüşü telafi etmez.,- kritik frenleme durumlarında,- çarpışma tehlikesinde,- sürüşe uygun olmadığımda,
2.7.01-138,en,tr,You are driving a purely electric vehicle in a residential area. What should you be aware of due to your lower engine noise?,"With a pure electric vehicle, you are almost noiseless on the road and you can acoustically be hardly perceived by other road users. Especially cyclists are at risk if they hear no engine noise. Without looking back, they often turn.",Pedestrians will not notice me or will do so later than usual,"Cyclist travelling ahead will turn left, without looking behind them",Vehicles following behind will tailgate me,,Sürücü destek sistemleri hakkında neyi bilmelisiniz?,Sistemin sınırlarını bilmeli ve her zaman trafiği kendiniz izlemelisiniz. Sistemler sorumluluğu tamamen devralmaz.,Sistem sınırlarını bilmeliyim,Trafiği kendim izlemeliyim,Sistemin tüm görevleri her zaman tamamen devraldığını varsayabilirim,
2.7.01-139,en,tr,You are driving a motor vehicle fitted with anti-lock braking system (ABS). How do you achieve the shortest possible braking distance?,"If you drive a car with an automatic anti-lock braking system, you achieve the shortest braking distance by braking abruptly and with maximum pedal force. The ABS prevents the wheels from locking during braking.",- suddenly and with maximum force,- carefully and then increasingly harder,- multiple times at quick intervals and with maximum force,,Hangi durumlarda sürücü destek sistemlerinin işlevi sınırlanabilir?,"Kötü hava, kirli sensörler veya eksik yol işaretleri sistemlerin çalışmasını sınırlayabilir.",Kötü hava koşullarında,Sensörler kirliyse,Yol işaretleri eksikse,
2.7.01-140,en,tr,A lane assist system with corrective steer control can help you when driving. What should you be aware of?,"A prerequisite for a perfect function of the lane departure warning system are good road markings. Keep in mind that technical driving assistants cannot compensate for inability to drive. As a car driver, you must be able to intervene into the driving experience at all times.",- keep the vehicle in lane if the road markings are clear,- not function if the road markings are poor,- compensate for a lack of fitness to drive (e.g. tiredness),,Otomatik acil frenleme sistemi ne yapabilir?,"Sistem çarpışma tehlikesini algılayabilir, sürücüyü uyarabilir ve gerekirse otomatik frenleme başlatabilir.",Çarpışma tehlikesini algılayabilir,Sürücüyü uyarabilir,Gerekirse otomatik frenleme başlatabilir,
2.7.01-141,en,tr,You are driving at high speed into a bend. What could happen if you had to brake suddenly?,"If you drive fast into a tight curve, you lose road grip when you brake hard and slide out of the curve. (Centrifugal force)",- could lose its grip on the road,- could skid out of the bend,- will constantly maintain its driving stability with the stability control,,Sürücü destek sistemleri kullanırken ne geçerlidir?,"Sürücü destek sistemleri sürücüyü destekler, fakat sürüş sorumluluğu sürücüde kalır. Sistemler her durumda kusursuz çalışmaz.",Sürüş sorumluluğu bende kalır,Sistem sınırlarını dikkate almalıyım,Sistem her durumda kusursuz çalışır,
2.7.01-142,en,tr,What can result in your motor vehicle skidding while driving round a bend?,"If you turn sharply, your vehicle may start to skid on bends. This can also happen if you drive too fast. Adjust your speed when cornering.",Heavy oversteer,Driving too fast,Gently accelerating at the exit of the bend,,Hangi durumlar acil fren asistanının işlevini kısıtlayabilir?,"Kirli sensörler, kötü hava koşulları ve sistemin algılayamadığı engeller acil fren asistanını sınırlayabilir.",Kirli sensörler,Kötü hava koşulları,Algılanamayan engeller,
2.7.01-143,en,tr,"The lane keeping assist system warns you with acoustic, haptic or optical signals. What might be the cause of this?","If you drift out of your lane, the lane departure warning system detects this by recognising that you are approaching the lane marking. The permissible total mass must not be exceeded.",My vehicle is getting close to the road markings at the side of the road,My vehicle is undercutting the safety distance to the vehicle ahead,Another vehicle is overtaking me with not enough side clearance,,Adaptif hız sabitleyici kullanırken neyi unutmamalısınız?,"ACC sadece destek sağlar. Trafiği izlemeli, sistem sınırlarını bilmeli ve gerektiğinde kendiniz fren yapmalısınız.",Trafiği izlemeliyim,Sistem sınırlarını bilmeliyim,Gerektiğinde kendim fren yapmalıyım,
2.7.01-144,en,tr,In what situation can the lane keep assist system with steering override help you?,"On motorways and country roads, steering intervention by the lane departure warning system can be helpful, as the markings are clearly visible there.
Due to poor markings and narrow lanes in roadworks, steering intervention by the lane departure warning system is not possible as it will most likely not be detected correctly.",- on motorways,- on rural roads,- in constricted roadworks sites with poor road markings,,Park asistanı hangi durumda yardımcı olabilir?,Park asistanı uygun park yerlerini algılamaya ve park manevrasında destek vermeye yardımcı olabilir. Park iznini kontrol etmez.,Uygun park yerlerini algılamada,Park manevrasında destek vermede,Park etmenin yasal olup olmadığını kesin belirlemede,
2.7.01-145,en,tr,With which driving task can the lane keep assist system with steering override help the driver?,"If the lane markings are good, Lane Keeping Assist with steering intervention can help you to keep the vehicle on the lane when driving straight ahead.
When turning, you cross lanes and markings; the lane departure warning system cannot intervene to support you here. When overtaking, you signal to the lane departure warning system by flashing that you are crossing the lane markings intentionally. Thus, it does not intervene during the overtaking process.",When driving in a straight line,When turning,When overtaking,,Şerit değiştirme asistanı neye yardımcı olabilir?,Şerit değiştirme asistanı kör noktadaki veya yan alandaki araçlar konusunda uyarabilir. Sürücünün kontrol yükümlülüğünü kaldırmaz.,Kör noktadaki araçlar konusunda uyarmaya,Yan alandaki araçlar konusunda uyarmaya,Omuz kontrolünü gereksiz kılmaya,
2.7.01-146,en,tr,What can negatively affect the functioning of the lane keep assist system?,"If the lane markings are in a poor condition, the lane keeping assistant cannot recognise where the lane to be maintained is. Due to additional lane markings in construction areas, it is not obvious which is the lane to be kept to.
Weather conditions can affect the sensors of the lane departure warning system. In addition, water or snow can distort the markings.",The weather conditions,The condition of the road markings,Additional road markings within a roadworks site,,Şerit takip asistanı ne zaman yardımcı olabilir?,Araç istemeden şeritten ayrılırsa sistem uyarı verebilir veya direksiyon müdahalesi yapabilir. Hız sınırını denetlemek ana görevi değildir.,İstemeden şeritten ayrılınca,Şerit çizgileri algılanabiliyorsa,Azami hız aşıldığında her zaman,
2.7.01-147,en,tr,Under what conditions will the lane keep assist system with steering override function optimally?,"The lane keeping assistant works best with clear lane markings. 
Poor or additional markings in roadworks will not allow the lane departure warning system to intervene, as it will most likely not be detected correctly.
Weather conditions can affect the sensors of the lane departure warning system. In addition, snow can distort the markings.",Where there are clear road markings,Where there are patches of snow on the road surface,Where there are additional roadworks markings,,Dönüş asistanı hangi durumda uyarı verebilir?,Dönüş asistanı dönüş sırasında yan taraftaki zayıf yol kullanıcıları veya engeller konusunda uyarabilir. Manevrayı tamamen devralmaz.,Yolcu tarafındaki zayıf yol kullanıcıları konusunda,Yolcu tarafındaki engeller konusunda,Tüm dönüş manevrasını tamamen yapmak için,
2.7.01-148,en,tr,What driver assistance system offers a high degree of road safety potential?,"The Autonomous Emergency Brake Assist constantly detects the traffic in front of the vehicle. If a hazard is imminent, the Emergency Brake Assist can carry out an emergency braking manoeuvre. 
Braking too late or too timidly are often causes of traffic accidents. Brake assistants usually react faster than humans and thus offer more safety.",The brake assist,The autonomous emergency brake,The cruise control system,,Hangi sürücü destek sistemleri özellikle güvenlik potansiyeline sahiptir?,Fren asistanı ve otomatik acil fren sistemi güvenlik potansiyeline sahiptir. Hız sabitleyici esas olarak konfor sistemidir.,Fren asistanı,Otomatik acil fren sistemi,Hız sabitleyici,
2.7.01-149,en,tr,How can driver assistance systems help you?,"In critical traffic situations, driver assistance systems can react quickly and intervene automatically by steering or braking etc..
If danger is imminent, they can warn you with light, sound and haptic signals. Driver assistance systems can also help you with driving tasks, such as keeping in lane.",- warn me of danger,- help me perform driving tasks,- intervene automatically in critical road traffic situations,,Sürücü destek sistemleri size nasıl yardımcı olabilir?,"Sürücü destek sistemleri tehlikeler konusunda uyarabilir, sürüş görevlerinde yardımcı olabilir ve kritik trafik durumlarında otomatik müdahale edebilir.",- beni tehlikelere karşı uyarabilir,- sürüş görevlerini yerine getirmemde yardımcı olabilir,- kritik trafik durumlarında otomatik müdahale edebilir,
2.7.01-150,en,tr,What can result if you accelerate too hard when driving a front-wheel drive car through a road bend?,"If you give a front-wheel drive car too much gas in a bend, it can swerve over the front axle. The front tyres lose their grip on the road and your vehicle can no longer be steered, but continues straight ahead and breaks away.",- The front of the car can swerve,- Steerability can be reduced,- The rear of the car can swerve,,Önden çekişli bir otomobille virajda çok sert hızlanırsanız ne olabilir?,Ön taraf savrulabilir ve direksiyon hakimiyeti azalabilir. Arka tarafın savrulması önden çekişli araç için tipik sonuç değildir.,- otomobilin ön tarafı savrulabilir,- yönlendirilebilirlik azalabilir,- otomobilin arka tarafı savrulabilir,
2.7.01-151,en,tr,Under what conditions can an active lane change assist system perform a lane change?,"The Active Lane Change Assistant only performs a lane change when it cannot detect any vehicle in the relevant safety zone. For an active lane change, the assistant must first detect a marked lane with several lanes.",- has detected an adequately marked carriageway with multiple lanes,- has not detected any vehicles in the relevant safety zone,- has detected a sufficiently large gap in the oncoming traffic,,Aktif şerit değiştirme asistanı hangi koşullarda şerit değiştirebilir?,"Sistem yeterli şekilde işaretlenmiş çok şeritli yolu algılamalı ve ilgili güvenlik alanında araç algılamamış olmalıdır. Karşı trafikte boşluk, otoyol tipi şerit değişimi için belirleyici değildir.",- yeterli işaretli çok şeritli taşıt yolu algılamışsa,- ilgili güvenlik alanında araç algılamamışsa,- karşı trafikte yeterince büyük boşluk algılamışsa,
2.7.01-152,en,tr,Your motor vehicle is equipped with an active lane keep assist system. What information can be indicated by the status display of this system?,"The system must be able to display when it is switched on, switched off or has a malfunction, as this is important for the driver.",- is activated,- is deactivated,- has a fault,,Motorlu aracınız aktif şerit takip asistanıyla donatılmış. Bu sistemin durum göstergesi hangi bilgileri gösterebilir?,"Durum göstergesi sistemin etkin, devre dışı veya arızalı olduğunu gösterebilir.",- etkin olduğunu,- devre dışı olduğunu,- arızalı olduğunu,
2.7.01-153,en,tr,Your motor vehicle is equipped with a lane keep assist system. In what situation can this system help you?,Lane Keeping Assist helps you stay in lane. It warns you if you unintentionally leave the lane.,- I depart from my lane unintentionally,- the maximum permissible speed is exceeded,- the vehicle is driving too quickly over ruts in the road,,Motorlu aracınız şerit takip asistanıyla donatılmış. Bu sistem hangi durumda size yardımcı olabilir?,Sistem istemeden şeritten ayrıldığınızda yardımcı olabilir. Hız sınırını aşma veya yoldaki oluklar ana işlevi değildir.,- istemeden şeridimden ayrılırsam,- izin verilen azami hız aşılırsa,- araç yoldaki oluklardan çok hızlı geçiyorsa,
2.7.01-154,en,tr,You have the lane keep assist system activated in your motor vehicle. It emits a warning signal while you are driving. What could be the cause of this?,"Lane Keeping Assist warns you if you unintentionally leave your lane. If you forget to indicate when changing lanes, Lane Keeping Assist recognizes this as unintentionally leaving your lane and warns you.",I forgot to switch on my indicator when changing lane,I have unintentionally departed from my lane,I undercut the minimum distance between me and the vehicle ahead,,Motorlu aracınızda şerit takip asistanı etkin. Sürüş sırasında uyarı sinyali veriyor. Bunun nedeni ne olabilir?,Şerit değiştirirken sinyal vermemiş olabilirsiniz veya istemeden şeridinizden ayrılmış olabilirsiniz. Öndeki araca mesafenin altına düşmek bu sistemin tipik uyarısı değildir.,Şerit değiştirirken sinyal vermeyi unuttum,İstemeden şeridimden ayrıldım,Öndeki araçla aramdaki asgari mesafenin altına düştüm,
2.7.01-155,en,tr,You are using your motor vehicle’s lane keep assist system while driving. The system does not respond when you depart from the lane. What could be the cause of this?,"Due to missing lane markings, insufficient road illumination and heavy precipitation, the sensors of the lane departure warning system are impaired, which means that the lane is not reliably detected.",Inadequate road illumination,Heavy precipitation,A lack of lane markings,,Sürüş sırasında şerit takip asistanını kullanıyorsunuz. Şeritten ayrıldığınızda sistem tepki vermiyor. Bunun nedeni ne olabilir?,"Yetersiz yol aydınlatması, yoğun yağış veya şerit çizgilerinin olmaması sistemin tepki vermemesine neden olabilir.",Yetersiz yol aydınlatması,Yoğun yağış,Şerit işaretlerinin olmaması,
2.7.01-156,en,tr,"Your motor vehicle is equipped with a lane change assist system without steering intervention. While driving, the warning light flashes on the left-hand exterior rear-view mirror. What is this warning light indicating?","If there is a vehicle in the monitoring area, this is signaled by the warning lamp lighting up on the exterior mirror.",Another vehicle is located within the monitored area,You may not now perform a lane change to the left,You can now perform a lane change to the left without any risk,,Aracınız direksiyon müdahalesi olmayan şerit değiştirme asistanıyla donatılmış. Sürüş sırasında sol dış aynadaki uyarı lambası yanıp sönüyor. Bu neyi gösterir?,"İzlenen alanda başka bir araç vardır ve sola şerit değiştirmemelisiniz. Bu, risksiz şerit değiştirebileceğiniz anlamına gelmez.",İzlenen alanda başka bir araç bulunuyor,Şimdi sola şerit değiştirmemelisiniz,Şimdi hiç risk olmadan sola şerit değiştirebilirsiniz,
2.7.01-157,en,tr,"While driving, you are using your motor vehicle’s active lane keep assist system. How can you manually override this driver assist system in the event that it intervenes?",Countersteering and activating the indicator overrides the intervention of Lane Keeping Assist.,By counter-steering,By activating the indicator,By accelerating,,Sürüş sırasında aktif şerit takip asistanını kullanıyorsunuz. Sistem müdahale ederse bunu manuel olarak nasıl geçersiz kılabilirsiniz?,Karşı direksiyon yaparak veya sinyal vererek sistem müdahalesini geçersiz kılabilirsiniz. Hızlanmak uygun yöntem değildir.,Karşı direksiyon yaparak,Sinyali etkinleştirerek,Hızlanarak,
2.7.01-158,en,tr,In which situation is it purposeful to use an active lane change assist system?,"On motorways or motorway-like roads, the lane markings are clearly visible and the lanes are usually straight. This is where Active Lane Change Assist comes in handy.",- motorways,- motorway-like roads,- roads without markings,,Aktif şerit değiştirme asistanını hangi durumda kullanmak uygundur?,Aktif şerit değiştirme asistanı otoyollarda ve otoyol benzeri yollarda anlamlıdır. İşaretsiz yollarda uygun değildir.,- otoyollar,- otoyol benzeri yollar,- işaretsiz yollar,
2.7.01-159,en,tr,You want to overtake and you have initiated a lane change using the active lane change assist system. What is correct?,"The Active Lane Change Assistant can change lanes automatically after initiation. However, you must always monitor this, as e.g. safety distances are not always maintained automatically.",The systems independently performs the lane change,I have to monitor the lane change,The system always maintains all safety distances independently,,Sollamak istiyorsunuz ve aktif şerit değiştirme asistanıyla şerit değişimini başlattınız. Hangisi doğrudur?,"Sistem şerit değişimini bağımsız yapabilir, ancak siz manevrayı izlemek zorundasınız. Sistem her zaman tüm güvenlik mesafelerini bağımsız korumaz.",Sistem şerit değişimini bağımsız gerçekleştirir,Şerit değişimini izlemek zorundayım,Sistem her zaman tüm güvenlik mesafelerini bağımsız korur,
2.7.01-160,en,tr,Which driver assistance systems do you have to manually activate to assist you in specific situations?,"The active parking assistant and the adaptive cruise control system do not count as safety-relevant assistants. Therefore, you can activate them manually.",The active park assist,The adaptive cruise control (ACC),The emergency brake assist,,Belirli durumlarda sizi desteklemesi için hangi sürücü destek sistemlerini manuel olarak etkinleştirmeniz gerekir?,Aktif park asistanı ve adaptif hız sabitleyici genellikle manuel etkinleştirilir. Acil fren asistanı normalde arka planda hazırdır.,Aktif park asistanı,Adaptif hız sabitleyici (ACC),Acil fren asistanı,
2.7.01-161,en,tr,"You want to transport furniture in the van shown here (up to 3.5 t). Compared to driving a car, what do you have to be aware of?","A van is much higher, longer and wider than a normal car. Therefore, you should always pay attention to the signage of the passage height. You should also make sure that you adjust your speed in curves, as vans could overturn more easily. In addition, the side wind attacks an even larger area, which significantly increases the risk of being pressed out of the lane.",- can roll over more easily when cornering,- requires special attention regarding vertical clearances,- is vulnerable to sidewinds,,"Gösterilen panelvanla (3,5 t’ye kadar) mobilya taşımak istiyorsunuz. Otomobil kullanmaya kıyasla neyi bilmelisiniz?","Panelvan virajlarda daha kolay devrilebilir, yükseklik sınırlamalarına özel dikkat gerekir ve yan rüzgâra duyarlıdır.",- virajlarda daha kolay devrilebilir,- yükseklik geçişleri konusunda özel dikkat gerektirir,- yan rüzgâra hassastır,
2.7.01-162,en,tr,How does the active park assist help you when parking?,"The active park assistant must be activated manually by you. After activating the assistant, the system supports you in finding a suitable parking space.",- detects sufficiently large parking spaces,- detects all obstacles during the parking manoeuvre,- checks if parking is permissible at a particular place,,Aktif park asistanı park ederken size nasıl yardımcı olur?,Aktif park asistanı yeterince büyük park yerlerini algılayabilir. Tüm engelleri veya park etmenin yasallığını güvenilir şekilde belirlemez.,- yeterince büyük park yerlerini algılar,- park manevrası sırasında tüm engelleri algılar,- belirli bir yerde park etmenin izinli olup olmadığını kontrol eder,
2.7.01-163,en,tr,Why might a turn assist system not always detect that a cyclist is present?,"A turning assistant can work incorrectly due to various circumstances. So it is possible that a cyclist or a pedestrian is not recognized by the system if there are obstacles between you and the cyclist. For example, such can be parked vehicles or trees on the side of the road. Likewise, the pollution or damage to the sensor can easily be the reason for an incorrect function.",There is dirt on the sensor,Parking cars conceal the cyclist,The sensor is damaged,,Dönüş asistanı bir bisikletlinin varlığını neden her zaman algılamayabilir?,"Sensör kirliyse, park halindeki araçlar bisikletliyi gizliyorsa veya sensör hasarlıysa sistem bisikletliyi algılamayabilir.",Sensörde kir olması,Park halindeki araçların bisikletliyi gizlemesi,Sensörün hasarlı olması,
2.7.01-164,en,tr,What must you note when using the active park assist?,"After activating the active park assistant, the system supports you in finding and parking a suitable parking space. Nevertheless, you still have to observe the traffic and intervene manually when the dangers arise.",- must be overridden if hazards exist,- means I no longer have to pay attention to other road traffic,- reliably detects all obstacles during the parking manoeuvre,,Aktif park asistanı kullanırken neye dikkat etmelisiniz?,Tehlike varsa sistemi geçersiz kılmalısınız. Sistem diğer trafiğe dikkat etme yükümlülüğünüzü ortadan kaldırmaz ve tüm engelleri güvenilir algılamaz.,- tehlike varsa geçersiz kılınmalıdır,- artık diğer yol trafiğine dikkat etmem gerekmez,- park manevrası sırasında tüm engelleri güvenilir şekilde algılar,
2.7.01-165,en,tr,You are driving an electric vehicle. When can recuperation inhibit the braking action?,"By recuperation, the engine of the electric vehicle works like a generator when braking. The braking therefore generates electricity and automatically loads the car battery. So if the battery of the electric vehicle is already fully charged, the vehicle cannot regain the energy and the braking effect through recuperation may not be available. Instead, the vehicle has to fall back on conventional brakes. The recuperation can also be reduced or deactivated if the battery is too cold. This can reduce the braking effect through recuperation.",- with a fully charged battery,- at less than the battery’s operating temperature,- in eco mode,,Elektrikli araç kullanıyorsunuz. Reküperasyon ne zaman frenleme etkisini sınırlayabilir?,Batarya tamamen doluysa veya çalışma sıcaklığının altındaysa reküperasyon sınırlı olabilir. Eco modu tek başına frenlemeyi engellemez.,- batarya tamamen doluyken,- batarya çalışma sıcaklığının altındayken,- eco modunda,
