questionExternalId,sourceLanguage,targetLanguage,questionTextSource,explanationSource,answerASource,answerBSource,answerCSource,answerDSource,questionTextTarget,explanationTarget,answerATarget,answerBTarget,answerCTarget,answerDTarget
2.1.11-118,en,tr,"After overtaking you, a car pulls back into lane without leaving sufficient space in front of you. What should you do?","The car driver in the overtaking vehicle shows a misconduct that should not disturb you. Stay calm, do not honk and do not turn on the flash light. Decelerate slightly and restore the required safety distance between the vehicles.",I remain calm in order to avoid conflicts,I brake in order to ensure that the safety distance is again established,I flash my headlights in order to call attention to the impediment,,Bir araç sizi solladıktan sonra önünüzde yeterli mesafe bırakmadan tekrar şeride giriyor. Ne yapmalısınız?,Sollayan aracın sürücüsü hatalı davranıyor olsa da sakin kalmalısınız. Korna veya selektör kullanmayın. Hafifçe yavaşlayarak gerekli güvenlik mesafesini yeniden oluşturun.,Çatışmalardan kaçınmak için sakin kalırım,Güvenlik mesafesini yeniden sağlamak için fren yaparım,Engellemeye dikkat çekmek için selektör yaparım,
2.1.11-119,en,tr,The risk of causing an accident when driving a vehicle is significantly higher for drivers aged between 18 and 24. What reasons are frequently relevant here?,"Young car drivers often have too little experience to be able to correctly assess road traffic risks. They often drive carelessly and riskily, overestimate their abilities and rely on the safety of the vehicles they control. By testing their car and their own driving skills, they sometimes get into unmanageable situations.",Too little driving experience,Over-estimation of own capabilities,Higher levels of risk readiness,,18–24 yaş arası sürücülerde kaza yapma riski belirgin şekilde daha yüksektir. Hangi nedenler sıkça önemlidir?,"Genç sürücüler çoğu zaman trafik risklerini doğru değerlendirecek deneyime sahip değildir. Yeteneklerini abartabilir, daha riskli sürebilir ve aracın güvenliğine fazla güvenebilirler.",Çok az sürüş deneyimi,Kendi yeteneklerini abartma,Daha yüksek risk alma eğilimi,
2.1.11-120,en,tr,"While you are in a traffic jam, looking in your rear-view mirror you see a motorcyclist ""snaking"" past the stationary line of vehicles. What should you do?","Under no circumstances should you act illegally just because another road user violates applicable rules. It is forbidden for you as a car driver to honk in this situation, to stop the motorcyclist or to let him pass.",I let him drive past,I sound my horn and note his registration,I take steps to ensure that he too must come to a stop,,Trafik sıkışıklığında dikiz aynanızda duran araç kuyruğunun yanından zikzak yaparak geçen bir motosikletli görüyorsunuz. Ne yapmalısınız?,"Başka bir yol kullanıcısı kural ihlali yapıyor diye siz de hukuka aykırı davranmamalısınız. Bu durumda korna çalmak, motosikletliyi durdurmaya çalışmak veya geçişini engellemek doğru değildir; geçmesine izin verin.",Geçmesine izin veririm,Korna çalar ve plakasını not ederim,Onun da durmak zorunda kalmasını sağlamak için önlem alırım,
2.1.11-121,en,tr,"You are driving on a main road and a car following behind is ""tailgating"" you. How should you react?","When driving on a highway and being harassed by the car behind you, you should keep calm and control your speed at an appropriate pace. You should avoid slow driving so as not to hinder the flow of traffic. However, you should also not be tempted to drive faster. It's best to let the pushy driver pass at the next opportunity.",I maintain my speed and keep to the right to enable the car following behind to overtake,"I increase my speed until the car following behind ceases ""tailgating"" me","I reduce my speed until the car following behind ceases ""tailgating"" me",,Ana yolda gidiyorsunuz ve arkanızdaki araç size çok yakın takip ediyor. Nasıl tepki vermelisiniz?,"Sakin kalmalı, uygun hızda devam etmeli ve mümkün olduğunca sağda kalmalısınız. Daha hızlı gitmeye zorlanmamalı, ancak trafik akışını da gereksiz yavaşlatmamalısınız. En uygun fırsatta arkadaki aracın sollamasına izin verin.",Hızımı korur ve arkamdaki aracın sollayabilmesi için sağda kalırım,Arkamdaki araç yakın takip etmeyi bırakana kadar hızımı artırırım,Arkamdaki araç yakın takip etmeyi bırakana kadar hızımı azaltırım,
2.1.11-122,en,tr,"You overtake on a motorway. Behind you a car approaches at high speed, with headlights and indicators flashing. What should you do?","The only thing you can do is to keep calm! Stay calm and do not try to score off the pushy driver. It is best to let him pass. If you have sufficient overtaking speed, you can still complete the overtaking process. As soon as the next opportunity arises, you should switch to the right lane and let the pushy driver pass.",I continue overtaking swiftly,I pull over into the right-hand lane as soon as possible,I gently decelerate,,"Otoyolda sollama yapıyorsunuz. Arkanızdan yüksek hızla bir araç geliyor, selektör ve sinyal yapıyor. Ne yapmalısınız?",Sakin kalmalısınız. Yeterli hız farkınız varsa sollamayı hızlıca tamamlayın; ilk uygun fırsatta sağ şeride geçerek arkadaki aracın geçmesine izin verin.,Sollamayı hızlıca sürdürürüm,Mümkün olan en kısa sürede sağ şeride geçerim,Hafifçe yavaşlarım,
2.1.11-123,en,tr,Five young friends are driving in a car to a recreational event. The mood is exuberant. To what risks can this give rise?,"For the car driver, there is a risk of getting carried away by the mood. He/She can be distracted by the others and overlook traffic hazards and make driving mistakes. It is recommended to set up rules of conduct for the passengers before starting the journey. So, the car driver is not a spoilsport or tempted in any way.",- be distracted from events on the road,- be induced to drive in a risky manner,- be induced to drive slowly,,Beş genç arkadaş eğlence etkinliğine arabayla gidiyor. Ortam çok neşeli. Bu hangi risklere yol açabilir?,"Sürücü ortamın etkisine kapılabilir, yol olaylarından dikkati dağılabilir ve riskli sürüşe teşvik edilebilir. Yola çıkmadan önce yolcular için davranış kuralları belirlemek faydalıdır.",- yoldaki olaylardan dikkatimin dağılması,- riskli sürüşe teşvik edilmem,- yavaş sürüşe teşvik edilmem,
2.1.11-124,en,tr,While driving on the motorway you overtake several vehicles. A vehicle approaches you from behind with indicators and headlights flashing. What should you do?,"The dense, aggressive tailgating of the following vehicle endangers all road users. For this reason, you should try to change to the right-hand lane in compliance with the safety distance. Any braking maneuver would only worsen this dangerous situation. Switching on the hazard light is prohibited in this case.",I continue driving until I can again pull into the right-hand lane,I turn on my hazard lights briefly to urge the vehicle behind to keep its distance,I brake briefly to prompt the vehicle behind to keep its distance,,Otoyolda birkaç aracı solluyorsunuz. Arkadan sinyal ve selektör yapan bir araç yaklaşıyor. Ne yapmalısınız?,Arkadan gelen aracın agresif şekilde yaklaşması tehlikelidir. Güvenli mesafeyi koruyarak ilk fırsatta sağ şeride geçmelisiniz. Fren yapmak veya dörtlüleri yakmak durumu daha kötüleştirir ve yasaktır.,Tekrar sağ şeride geçebilene kadar sürüşe devam ederim,Arkadaki aracı mesafe bırakmaya uyarmak için kısa süre dörtlüleri yakarım,Arkadaki aracı mesafe bırakmaya zorlamak için kısa fren yaparım,
2.1.11-125,en,tr,You want to overtake. Why should you not do so?,"A car driver may only overtake if he/she can see that the opposite lane is free. In this situation, the oncoming traffic cannot be seen, so you must not overtake.",The oncoming traffic,The bend in the road,The state of the road surface,,Sollamak istiyorsunuz. Neden yapmamalısınız?,Sürücü yalnızca karşı şeridin serbest olduğunu görebiliyorsa sollama yapabilir. Bu durumda karşıdan gelen trafik görülemediği için sollamamalısınız.,Karşı trafik,Yolun virajı,Yol yüzeyinin durumu,
2.1.11-126,en,tr,You were in a bad mood prior to commencing your journey. What consequences should you avoid when driving?,"Anything that could negatively affect your safe driving should be avoided. Besides distractions, this also includes aggressiveness. If you're upset, do not get behind the wheel immediately afterwards.",Distraction,Aggressiveness,Caution,,Yola çıkmadan önce kötü bir ruh halindeydiniz. Sürüşte hangi sonuçlardan kaçınmalısınız?,Güvenli sürüşü olumsuz etkileyen her şeyden kaçınmalısınız. Buna dikkat dağınıklığı ve agresiflik dahildir. Çok üzgün veya öfkeliyseniz hemen direksiyon başına geçmeyin.,Dikkat dağınıklığı,Agresiflik,Dikkatlilik,
2.1.11-127,en,tr,Which is the stamp of a responsible driver?,"A responsible car driver expects mistakes from other road users and does not sit behind the wheel while he/she is very tired or cannot control his/her feelings. Furthermore, he/she does not always insist on his right and cannot be distracted.",He anticipates the mistakes of other road users,He avoids driving when tired,He is assertive towards other road traffic,,Sorumlu bir sürücünün özelliği nedir?,Sorumlu sürücü diğer yol kullanıcılarının hatalarını hesaba katar ve yorgunken araç kullanmaz. Trafikte kendini zorla kabul ettirmeye çalışmaz.,Diğer yol kullanıcılarının hatalarını öngörür,Yorgunken araç kullanmaktan kaçınır,Diğer trafik karşısında kendini dayatır,
2.1.11-128,en,tr,What emotions can influence driving behaviour?,"Strong emotions such as anger, fear and sadness as well as joy and exuberance usually influence the driving behavior. They distract the car driver from the road and often lead to risky, aggressive or over-cautious driving. Only when you're calm and balanced you should participate in traffic.",Happiness and exuberance,Worry and sorrow,Anger and rage,,Hangi duygular sürüş davranışını etkileyebilir?,"Öfke, korku, üzüntü, sevinç ve taşkınlık gibi güçlü duygular sürüş davranışını etkileyebilir. Dikkati dağıtır ve riskli, agresif veya aşırı temkinli sürüşe yol açabilir.",Mutluluk ve taşkınlık,Endişe ve üzüntü,Öfke ve kızgınlık,
2.1.11-129,en,tr,What indications mean you should interrupt your journey?,"Brief microsleep often causes devastating accidents. If you have to yawn frequently, can barely keep your eyes open, or have trouble keeping your lane, you should stop your journey and take a rest.",Yawning frequently,Difficulty keeping your eyes open,Difficulties staying in lane,,Hangi belirtiler yolculuğu kesmeniz gerektiğini gösterir?,"Sık esneme, gözleri açık tutmakta zorlanma ve şeritte kalmakta güçlük mikro uyku tehlikesini gösterir. Bu durumda mola vermelisiniz.",Sık sık esnemek,Gözleri açık tutmakta zorlanmak,Şeritte kalmakta zorlanmak,
2.1.11-130,en,tr,Your passenger wants to discuss something with you during the journey. What should you do?,"You should not be distracted while driving. If your passenger wants to discuss with you, you should stop the journey.",- my driving,- the discussion,,,Yolcunuz yolculuk sırasında sizinle bir konuyu tartışmak istiyor. Ne yapmalısınız?,Sürüş sırasında dikkatinizin dağılmaması gerekir. Yolcunuz ciddi bir konuyu tartışmak istiyorsa yolculuğu durdurmalısınız.,- sürüşüme,- tartışmaya,,
2.1.11-131,en,tr,During the journey your passenger informs you that you are repeatedly tailgating. What should you do?,"You should take the safety advice of passengers seriously. Keep a larger distance. Within built-up areas, the distance to the vehicle in front should be at least three car lengths or approx. 15 m. Outside built-up areas, you should follow the ""two-second rule of thumb"".",I take the passenger’s comments seriously,I maintain a greater distance,I ignore the passenger’s comments,,Yolculuk sırasında yolcunuz size tekrar tekrar çok yakın takip ettiğinizi söylüyor. Ne yapmalısınız?,Yolcuların güvenlikle ilgili uyarılarını ciddiye almalısınız. Daha büyük mesafe bırakın. Yerleşim içinde mesafe en az üç araç boyu veya yaklaşık 15 m; yerleşim dışında ise iki saniye kuralı olmalıdır.,Yolcunun yorumlarını ciddiye alırım,Daha büyük mesafe bırakırım,Yolcunun yorumlarını görmezden gelirim,
2.1.11-132,en,tr,"At a red light in a built-up area, another driver apparently wants to provoke you into a street race. What should you do?","Don't be provoked and stay calm. Since road races are strictly prohibited, you should not pay attention to this behavior.",I totally ignore this behaviour,"I accept the challenge, but without exceeding 50 km/h",I get out and confront the driver,,Yerleşim içinde kırmızı ışıkta başka bir sürücü sizi sokak yarışına kışkırtıyor gibi görünüyor. Ne yapmalısınız?,Provokasyona kapılmayın ve sakin kalın. Yol yarışları kesinlikle yasaktır; bu davranışı tamamen görmezden gelmelisiniz.,Bu davranışı tamamen görmezden gelirim,Meydan okumayı kabul ederim ama 50 km/saat’i aşmam,Araçtan iner ve sürücüyle yüzleşirim,
2.1.11-133,en,tr,What frequently causes young people to have “disco accidents”?,"Young drivers in particular have less experience driving at night with crowded vehicles. In addition, the risk of accidents increases due to distracting passengers.",A lack of experience driving after dark,Little experience with fully occupied vehicles,A distraction caused by passengers,,Gençlerde “diskotek kazalarına” sıkça ne sebep olur?,"Genç sürücülerde gece sürüş deneyiminin ve tamamen dolu araçlarla sürüş deneyiminin az olması, ayrıca yolcuların dikkati dağıtması kaza riskini artırır.",Karanlıkta sürüş deneyiminin eksikliği,Tam dolu araçlarla az deneyim,Yolcuların neden olduğu dikkat dağınıklığı,
2.1.11-201,en,tr,"At a red light in a built-up area, another driver apparently wants to provoke you into a street race. What should you do?",Racing will increase your risk of accidents and put people at risk. You should ignore such behaviors,I totally ignore this behaviour,"I accept the challenge, but without exceeding 50 km/h",I get out and confront the driver,,Yerleşim içinde kırmızı ışıkta başka bir sürücü sizi sokak yarışına kışkırtıyor gibi görünüyor. Ne yapmalısınız?,Yarış yapmak kaza riskinizi artırır ve insanları tehlikeye sokar. Bu tür davranışları görmezden gelmelisiniz.,Bu davranışı tamamen görmezden gelirim,Meydan okumayı kabul ederim ama 50 km/saat’i aşmam,Araçtan iner ve sürücüyle yüzleşirim,
2.2.02-001,en,tr,You are driving on a road with one lane in each direction and want to turn left. Where should you position yourself?,"When turning left in this situation, go towards the center of the road (which is the left side of your lane)",- towards the centre of the roadway,- on the right-hand edge of the roadway,,,Her yönde bir şerit bulunan yolda gidiyor ve sola dönmek istiyorsunuz. Nerede konumlanmalısınız?,"Bu durumda sola dönerken taşıt yolunun ortasına, yani kendi şeridinizin sol tarafına yanaşmalısınız.",- taşıt yolunun ortasına doğru,- taşıt yolunun sağ kenarına doğru,,
2.2.02-002,en,tr,Are you allowed to use your motorized bicycle on the pavement?,"Yes but only if you push it, you cannot ride on the pavement","Yes, if the motorized bicycle is cautiously pushed","Yes, if the motorized bicycle is used as a bicycle","Yes, also using the engine when traffic on the roadway is too dense",,Motorlu bisikletinizi kaldırımda kullanabilir misiniz?,"Evet, ancak sadece dikkatli şekilde iterseniz. Kaldırımda motorla süremezsiniz.","Evet, motorlu bisiklet dikkatlice itilirse","Evet, motorlu bisiklet bisiklet gibi kullanılırsa","Evet, taşıt yolunda trafik çok yoğunsa motorla da",
2.2.02-003,en,tr,"Several cars are waiting in the right-hand lane at a ""red"" traffic light. Are you allowed to pass the cars cautiously on the right?",In this case you can behave similarly to a bicycle and can pass the car on the right if there is enough space,"Yes, provided there is adequate space on the roadway","Yes, provided you use the pavement","No, you must always wait behind the last car",,Sağ şeritte kırmızı ışıkta birkaç araç bekliyor. Araçların sağından dikkatlice geçebilir misiniz?,Yeterli alan varsa bisiklete benzer şekilde araçların sağından dikkatlice geçebilirsiniz. Kaldırımı kullanamazsınız.,"Evet, taşıt yolunda yeterli alan varsa","Evet, kaldırım kullanılırsa","Hayır, her zaman son aracın arkasında beklemelisiniz",
2.2.02-006,en,tr,You are driving on a road outside a built-up area with three lanes marked in each direction. Individual slower vehicles are travelling well spaced out in the right-hand lane. Which lane may you use continuously?,"The left-hand lane may only be used by a car driver for the temporary overtaking of other vehicles. Continuous driving on the middle lane is permitted, however, if the road is located outside built-up areas and provided with a line marking. This also applies if only a few vehicles are on the right lane.",The middle lane,The left-hand lane,,,Yerleşim yeri dışında her yönde üç işaretli şerit bulunan bir yolda gidiyorsunuz. Sağ şeritte aralıklı şekilde daha yavaş araçlar var. Hangi şeridi sürekli kullanabilirsiniz?,"Sol şerit yalnızca geçici sollama için kullanılabilir. Ancak yerleşim dışında, şerit çizgileri olan yollarda sağ şeritte aralıklı yavaş araçlar varsa orta şeritte sürekli gitmek mümkündür.",Orta şerit,Sol şerit,,
2.2.02-007,en,tr,What risks could arise if you drive in the right-hand lane alongside a truck?,A truck will diminish both your visibility and other people on the road seeing you (including the driver of the truck),- be overlooked by the driver of the truck,- be overlooked by other road users,- overlook other road users,,Bir kamyonun sağ şeritte yanında gitmek hangi riskleri doğurabilir?,Kamyon hem sizin görüşünüzü hem de diğer yol kullanıcılarının sizi görmesini kısıtlar; kamyon sürücüsü de sizi göremeyebilir.,- kamyon sürücüsü tarafından görülmemek,- diğer yol kullanıcıları tarafından görülmemek,- diğer yol kullanıcılarını gözden kaçırmak,
2.2.02-008,en,tr,What applies to you at the next junction?,Coming soon...,- turn left,- turn right,- drive straight ahead,,Bir sonraki kavşakta sizin için ne geçerlidir?,"Kavşaktaki yön işaretleri hangi yöne devam edebileceğinizi belirler. İşarete göre sola dönebilir, sağa dönebilir veya düz devam edebilirsiniz.",- sola dönmek,- sağa dönmek,- düz devam etmek,
2.2.02-009-M,en,tr,You would like to turn right. What is the right course of action now?,A motorcycle should behave similarly to a car and wait behind the blue car.,I remain behind the [blue car],I drive up to the stop line,I drive up to the line of sight,,Sağa dönmek istiyorsunuz. Şimdi doğru davranış nedir?,Motosiklet de otomobil gibi davranmalı ve mavi arabanın arkasında beklemelidir.,[mavi arabanın] arkasında kalırım,Dur çizgisine kadar giderim,Görüş çizgisine kadar giderim,
2.2.02-010,en,tr,What cycle paths may you use to drive your moped?,You may ride your moped on cycle paths outside built-up areas and on cycle paths inside built-up areas if an additional sign permits this.,Cycle paths outside of a built-up area,"Cycle paths within a built-up area, if this is permitted by an additional sign","Cycle paths within a built-up area, if there is too much traffic on the road",,Mopedinizle hangi bisiklet yollarını kullanabilirsiniz?,Mopedle yerleşim dışındaki bisiklet yollarını kullanabilirsiniz. Yerleşim içinde ise ancak ek levha izin veriyorsa kullanabilirsiniz.,Yerleşim dışındaki bisiklet yolları,"Yerleşim içindeki bisiklet yolları, ek levha izin veriyorsa","Yerleşim içindeki bisiklet yolları, yolda trafik çok yoğunsa",
2.2.02-101-M,en,tr,What is the correct course of action on this one-way road?,"You only drive on when the work allows it. In a one-way street, you are only allowed to drive in one direction. You are not allowed to turn around or reverse. You are responsible for any accident that may occur.",I wait until the works enable me to drive past,I turn around and drive back,I reverse back up the road,,Bu tek yönlü yolda doğru davranış nedir?,Yol çalışması geçmenize izin verene kadar beklemelisiniz. Tek yönlü yolda geri dönmek veya geri geri gitmek yasaktır ve kaza olursa sorumluluk doğurabilir.,Yol çalışması geçmeme izin verene kadar beklerim,Geri döner ve geri giderim,Yolda geri geri giderim,
2.2.02-201,en,tr,"For which motor vehicles or combination vehicles designated or used for road haulage purposes, is it necessary to pay a user charge on federal highways?",For motor vehicles with a maximum authorized mass of at least 7.5 t and combinations of vehicles with a maximum authorized mass of at least 7.5 tons must be paid a usage fee (toll).,For motor vehicles with a gross vehicle weight rating of at least 7.5 t,For combination vehicles with a gross vehicle weight rating of at least 7.5 t,For combination vehicles with a gross vehicle weight rating less than 7.5 t,,Federal yollarda hangi yük taşımacılığı amaçlı motorlu araçlar veya araç kombinasyonları için kullanım ücreti ödenmelidir?,"İzin verilen toplam ağırlığı en az 7,5 ton olan motorlu araçlar ve araç kombinasyonları için kullanım ücreti, yani geçiş ücreti, ödenmelidir.","İzin verilen toplam ağırlığı en az 7,5 t olan motorlu araçlar için","İzin verilen toplam ağırlığı en az 7,5 t olan araç kombinasyonları için","İzin verilen toplam ağırlığı 7,5 t’den az olan araç kombinasyonları için",
2.2.02-202,en,tr,What motor vehicles and combination vehicles are subject to a toll charge on motorways and federal highways?,"Motor vehicles and vehicle combinations to a maximum authorized mass of at least 7.5 t have, are toll roads. The same applies to vehicles that are used for freight transport.",- are used in road haulage operations,- have a gross vehicle weight rating of at least 7.5 t,- have at least 4 seats,,Otoyol ve federal yollarda hangi motorlu araçlar ve araç kombinasyonları geçiş ücretine tabidir?,"İzin verilen toplam ağırlığı en az 7,5 t olan ve yük taşımacılığında kullanılan motorlu araçlar ve araç kombinasyonları geçiş ücretine tabidir.",- karayolu yük taşımacılığında kullanılanlar,"- izin verilen toplam ağırlığı en az 7,5 t olanlar",- en az 4 koltuğu olanlar,
2.2.02-203,en,tr,You are transporting hazardous goods during winter. What should you do if road conditions deteriorate due to packed snow?,"In icy weather, you must take special care to avoid endangering others. If you reach a point where you can no longer guarantee that others will not be endangered, you should find a good place to park.",- ensure that no-one else is endangered,"- look for the next suitable place to stop and park, if necessary",- always transport hazardous goods to the destination with no intermediate stops,,Kışın tehlikeli madde taşıyorsunuz. Yol durumu sıkışmış kar nedeniyle kötüleşirse ne yapmalısınız?,Buzlu ve karlı koşullarda kimseyi tehlikeye atmamak için özel dikkat gerekir. Güvenli sürüşü artık garanti edemiyorsanız uygun bir yerde durup park etmelisiniz.,- kimsenin tehlikeye girmemesini sağlamak,- gerekirse durup park etmek için en yakın uygun yeri aramak,- tehlikeli maddeyi her zaman ara vermeden hedefe taşımak,
2.2.02-302,en,tr,You are driving an agricultural tractor at 30 km/h on a main road with a paved hard shoulder on the right. What is the right thing to do?,"In order to continue to ensure the flow of traffic, please go possible on the shoulder of your agricultural tractor.",I have to drive on the hard shoulder when possible,I may only use the hard shoulder for stopping,I may only use the hard shoulder briefly to allow vehicles to overtake,,Ana yolda 30 km/saat hızla tarım traktörü kullanıyorsunuz ve sağda sağlam banket var. Doğru davranış nedir?,Trafik akışını kolaylaştırmak için tarım traktörüyle mümkünse banketi kullanmalısınız.,Mümkünse bankette sürmeliyim,Banketi sadece durmak için kullanabilirim,Banketi sadece araçların sollamasına izin vermek için kısa süre kullanabilirim,
2.2.02-303,en,tr,What risks could arise if you drive in the right-hand lane alongside a truck?,A truck will diminish both your visibility and other people on the road seeing you (including the driver of the truck),- be unseen,- overlook other road users,- get burned by the hot exhaust fumes from the truck,,Bir kamyonun sağ şeritte yanında gitmek hangi riskleri doğurabilir?,Kamyon hem sizin görülmenizi hem de sizin diğer yol kullanıcılarını görmenizi kısıtlar. Kamyon sürücüsü de sizi görmeyebilir.,- görülmemek,- diğer yol kullanıcılarını gözden kaçırmak,- kamyonun sıcak egzoz gazıyla yanmak,
