questionExternalId,sourceLanguage,targetLanguage,questionTextSource,explanationSource,answerASource,answerBSource,answerCSource,answerDSource,questionTextTarget,explanationTarget,answerATarget,answerBTarget,answerCTarget,answerDTarget
2.7.01-257,en,tr,You are driving a motor vehicle with a manual gearbox. How do you conserve the service brake when driving down a long downward slope?,Shift down to increase the engine braking effect.,I drop down the gears in plenty of time,I use the permanent brake,I use the parking brake,,Manuel şanzımanlı motorlu araç kullanıyorsunuz. Uzun yokuş aşağı inişte servis frenini nasıl korursunuz?,Zamanında vites küçültür ve sürekli freni/retarderi kullanırsınız. Park freni sürüş sırasında bu amaçla kullanılmaz.,Zamanında vites küçültürüm,Sürekli freni kullanırım,Park frenini kullanırım,
2.7.01-258,en,tr,Why might your turn assist system emit a warning?,A turn assistant checks the area to the right of the truck for bikers and walkers when turning right and warns the driver.,A cyclist is located next to the right-side of my vehicle,I have crossed over a traffic lane boundary line,I am driving too fast while performing a turn,,Dönüş asistanınız neden uyarı verebilir?,Aracınızın sağ yanında bir bisikletli bulunduğunda dönüş asistanı uyarı verebilir. Şerit çizgisini aşma veya çok hızlı dönme bu sistemin tipik uyarı sebebi değildir.,Aracımın sağ tarafında bir bisikletli bulunuyor,Trafik şerit sınır çizgisini aştım,Dönüş yaparken çok hızlı gidiyorum,
2.7.01-259,en,tr,Your motor vehicle is equipped with a turn assist system. What function does this perform during a turning manoeuvre?,A turn assistant checks the area to the right of the truck for bikers and walkers when turning right and warns the driver.,- warns the driver of weaker road users on the passenger side,- warns the driver of obstructions on the passenger side,- can perform the complete turning manoeuvre,,Motorlu aracınız dönüş asistanıyla donatılmış. Dönüş manevrası sırasında bu sistemin işlevi nedir?,Sistem yolcu tarafındaki zayıf yol kullanıcıları ve engeller konusunda sürücüyü uyarabilir. Tüm dönüş manevrasını yapamaz.,- yolcu tarafındaki zayıf yol kullanıcıları konusunda sürücüyü uyarır,- yolcu tarafındaki engeller konusunda sürücüyü uyarır,- tüm dönüş manevrasını yapabilir,
2.7.01-260,en,tr,What can you expect if you take a truck with a heavy load and drive it around a tight bend?,"A heavily loaded truck can tip over when negotiating a tight curve, or inadequately secured cargo can slip because of centrifugal forces that are proportional to the mass of the vehicle and the cargo. These forces can destabilize the vehicle and cause it to tip over, especially if the center of gravity is high. Inadequately secured loads can slip due to these forces, further affecting the vehicle's balance and increasing the risk of accidents. Correct load securing is therefore essential to ensure the stability of the vehicle and increase road safety.",The lorry can tip over if driven too fast,Insufficiently secured cargo can slip,The lorry handles better on bends,,Ağır yüklü bir kamyonla dar virajdan geçerseniz ne bekleyebilirsiniz?,Çok hızlı sürülürse kamyon devrilebilir ve yeterince güvenceye alınmamış yük kayabilir. Kamyon virajlarda daha iyi yol tutmaz.,Çok hızlı sürülürse kamyon devrilebilir,Yeterince güvenceye alınmamış yük kayabilir,Kamyon virajlarda daha iyi yol tutar,
2.7.01-301,en,tr,Which facilities on a trailer are not operational when the electrical connections to the towing vehicle are interrupted or the cables are not connected?,"If the cables from the trailer are not operational because the electronic connection has been lost to the towing vehicle, the ABS is not working and lighting equipment will not work.",The automatic anti-locking device (ABS),All lighting facilities,The anti-slip device (ASR),,Çekici araçla elektrik bağlantısı kesilmişse veya kablolar bağlı değilse römorktaki hangi sistemler çalışmaz?,Elektrik bağlantısı yoksa römorkun ABS sistemi ve tüm aydınlatma tertibatları çalışmaz. ASR bu cevapta ilgili değildir.,Otomatik kilitlenme önleyici sistem (ABS),Tüm aydınlatma tertibatları,Patinaj önleyici sistem (ASR),
2.7.01-305,en,tr,What should you regularly check with a spare tyre carried in the vehicle?,When carried spare you should pay attention to the secure attachment and check the air pressure. Profile name is incorrect.,That it is securely in place,The tyre pressure,The profile designation,,Araçta taşınan yedek lastikte neyi düzenli kontrol etmelisiniz?,Yedek lastiğin güvenli şekilde sabitlendiğini ve lastik basıncını düzenli kontrol etmelisiniz. Profil adı belirleyici değildir.,Güvenli şekilde yerinde olup olmadığını,Lastik basıncı,Profil tanımı,
2.7.01-306,en,tr,"You are driving a loaded truck on a road with gradients. Despite engaging the permanent brake, the speed increases markedly. What is the right course of action?",You should try to increase the engine braking effect of your truck for a downgrade by looking brakes on with the service brake to be able to switch back.,Continue braking using the service brake to allow you to change down gears,Disengage the permanent brake and maintain speed using the service brake only,Continue braking using the service brake to allow you to change up gears,,Yüklü kamyonla eğimli yolda gidiyorsunuz. Sürekli fren devrede olmasına rağmen hız belirgin artıyor. Doğru davranış nedir?,Vites küçültebilmek için servis freniyle frenlemeye devam etmelisiniz. Sürekli freni bırakıp yalnızca servis freniyle gitmek veya vites büyütmek doğru değildir.,Vites küçültebilmek için servis freniyle frenlemeye devam etmek,Sürekli freni devreden çıkarıp hızı yalnızca servis freniyle korumak,Vites büyütebilmek için servis freniyle frenlemeye devam etmek,
2.7.01-307,en,tr,What should be noted with a motorbike with a conventional anti-lock braking system (ABS) when braking in a bend?,"Even if your motorcycle has ABS, you should still use controlled braking as ABS is mostly made for strong braking in straight lines. In a bend, the stronger you break, the more torque you will feel which will tend to put your motorcycle from a tilted to a straight position.",You should nevertheless perform controlled braking when in a declined position,The self-righting torque is dependent on the braking force,The transmissible braking forces increase in the declined position,,Klasik ABS’li motosikletle virajda fren yaparken neye dikkat edilmelidir?,Yatık pozisyonda bile kontrollü frenleme yapmalısınız. Doğrulma momenti fren kuvvetine bağlıdır. Yatık pozisyonda aktarılabilir fren kuvvetleri artmaz.,Yatık pozisyonda yine de kontrollü frenleme yapılmalıdır,Doğrulma momenti fren kuvvetine bağlıdır,Yatık pozisyonda aktarılabilir fren kuvvetleri artar,
2.7.01-308,en,tr,What can help the wobbling of a motorbike?,Wobbling increases at higher speed and if the weight is not well distributed such as more weight on the right or left side,Driving at a higher speed,One-sided weight loading,Driving at a slower speed,,Motosikletin yalpalamasına ne yardımcı olabilir?,Daha düşük hızda sürmek yalpalamayı azaltabilir. Daha yüksek hız veya tek taraflı yükleme yalpalamayı artırabilir.,Daha yüksek hızda sürmek,Tek taraflı ağırlık yüklemesi,Daha düşük hızda sürmek,
2.7.01-309,en,tr,What can cause a motorbike to start wobbling?,Wobbling can be due to unbalanced weights (more weight to the right or left side) or wrongly fitted fairings that cause more drag to one or the other side,Wrongly fitted fairings,Unbalanced loading of side panniers,Poor fuel quality,,Motosikletin yalpalamaya başlamasına ne neden olabilir?,Yanlış takılmış kaplamalar ve yan çantaların dengesiz yüklenmesi yalpalamaya neden olabilir. Yakıt kalitesi tipik neden değildir.,Yanlış takılmış kaplamalar,Yan çantaların dengesiz yüklenmesi,Kötü yakıt kalitesi,
2.7.01-310,en,tr,What is the effect of the cornering characteristics of a combination vehicle (motor vehicle towing a trailer) when taking a turn?,The cornering characteristics of a vehicle combination can swing when turning and you can cut the corner.,- can jut out,- can cut the corner,- generally follows the track of the towing vehicle,,Römork çeken motorlu araç kombinasyonunun dönüş davranışı dönüş sırasında nasıl etkiler?,Kombinasyon dışarı taşabilir ve virajı içten kesebilir. Genel olarak çekici aracın izini tam takip etmez.,- dışarı taşabilir,- virajı içten kesebilir,- genellikle çekici aracın izini takip eder,
2.7.02-001,en,tr,You notice there is play on the handlebar bearing. What must you do?,"Having a loose handlebar with some play is dangerous and make your motorcycle more difficult to control, make sure to not have any play to guarantee your safety",Have the play eliminated,Leave the play because it is easier to move the handlebar,,,Gidon yatağında boşluk fark ettiniz. Ne yapmalısınız?,Gidon yatağındaki boşluk giderilmelidir. Boşluk bırakılırsa sürüş davranışı bozulabilir.,Boşluğu giderdirmek,Gidonu daha kolay hareket ettirdiği için boşluğu bırakmak,,
2.7.02-002,en,tr,"When you move the handlebar, you notice that the handlebar bearing is catching in one place. What must you do?","Having catching in your handelbar bearing makes your motorcycle more difficult to control, make sure to not have any to garantee your safety",Have the catching eliminated,Increase the play of the handlebar bearing to improve track-holding,,,Gidonu hareket ettirdiğinizde gidon yatağının bir noktada takıldığını fark ediyorsunuz. Ne yapmalısınız?,Takılma giderilmelidir. İz tutuşu iyileştirmek için boşluk artırılmaz.,Takılmayı giderdirmek,İz tutuşunu iyileştirmek için gidon yatağı boşluğunu artırmak,,
2.7.02-003,en,tr,What can play in the handlebar bearing cause?,"Having a loose handlebar with some play is dangerous and make your motorcycle more difficult to control, make sure to not have any play to garantee your safety",It can have a negative influence on road behaviour,Road behaviour is improved,Track-holding is improved,,Gidon yatağındaki boşluk neye neden olabilir?,Gidon yatağındaki boşluk sürüş davranışını olumsuz etkileyebilir. Sürüş davranışını veya iz tutuşunu iyileştirmez.,Sürüş davranışını olumsuz etkileyebilir,Sürüş davranışı iyileşir,İz tutuşu iyileşir,
2.7.02-004,en,tr,What effect can a defective steering shock absorber have on road behaviour?,A defective steering shock absorber can cause the steering wheel to vibrate/shimmy and decrease the stability and roadworthiness of your motorcycle,A defective steering shock absorber can cause the steering wheel to shimmy,Roadworthiness can deteriorate,Roadworthiness only deteriorates at low speed,,Arızalı direksiyon amortisörü sürüş davranışını nasıl etkileyebilir?,Arızalı direksiyon amortisörü direksiyonun titremesine neden olabilir ve yol güvenliğini kötüleştirebilir. Etki sadece düşük hızlarda olmaz.,Arızalı direksiyon amortisörü direksiyonun titremesine neden olabilir,Yol güvenliği kötüleşebilir,Yol güvenliği sadece düşük hızda kötüleşir,
2.7.02-005,en,tr,What can decisively impair road behaviour?,All three will worsen the steering of your motorcycle making it more difficult to control and drive safely,Deflected handlebar bearing,Defective steering shock absorber,Play in the handlebar bearing,,Sürüş davranışını belirgin şekilde ne bozabilir?,"Eğilmiş gidon yatağı, arızalı direksiyon amortisörü ve gidon yatağındaki boşluk sürüş davranışını belirgin şekilde bozabilir.",Eğilmiş gidon yatağı,Arızalı direksiyon amortisörü,Gidon yatağındaki boşluk,
2.7.02-006,en,tr,You notice your motorcycle has poor track-holding. What can be the cause?,Both play in the wheel bearings and deflected back fork can cause your motorcycle to not keep its course and make handling more difficult and less safe,Too much play in the wheel bearings,Deflected backfork,,,Motosikletinizin iz tutuşunun kötü olduğunu fark ediyorsunuz. Bunun nedeni ne olabilir?,Tekerlek yataklarında fazla boşluk veya eğilmiş arka maşa kötü iz tutuşuna neden olabilir.,Tekerlek yataklarında çok fazla boşluk,Eğilmiş arka maşa,,
2.7.02-007,en,tr,Your motorcycle no longer keeps the track. What can be defective?,A bent fork or frame can make your motorcycle not aligned which will result in difficulty to keep your course,Bent fork,Bent frame,Defective rear wheel brake,,Motosikletiniz artık izini korumuyor. Ne arızalı olabilir?,Eğilmiş çatal veya eğilmiş şasi motosikletin iz tutuşunu bozabilir. Arızalı arka fren tipik neden değildir.,Eğilmiş çatal,Eğilmiş şasi,Arızalı arka tekerlek freni,
2.7.02-008,en,tr,"When you throttle down without disengaging the clutch, your motorcycle no longer keeps to the track. What can be the cause of this?",Both play in the rear wheel bearing and fork bearing can cause your motorcycle to not keep its course and make handling more difficult and less safe,Too much play of the fork bearing,Too much play of the rear-wheel bearing,Idle speed too high,,Debriyajı ayırmadan gazı kestiğinizde motosikletiniz artık izini korumuyor. Bunun nedeni ne olabilir?,Çatal yatağında veya arka tekerlek yatağında çok fazla boşluk buna neden olabilir. Rölanti devrinin yüksek olması tipik neden değildir.,Çatal yatağında çok fazla boşluk,Arka tekerlek yatağında çok fazla boşluk,Rölanti devrinin çok yüksek olması,
2.7.02-010,en,tr,You notice that the lever travel of the hydraulic front wheel brake on your motorcycle has become considerably longer. What must you do?,It is a sign of a defective front wheel brake which needs to be repaired or replaced,Have the front wheel brake repaired,Only use the rear wheel brake until the next service,Fill up the brake fluid immediately,,Motosikletinizin hidrolik ön freninde kol hareketinin belirgin şekilde uzadığını fark ediyorsunuz. Ne yapmalısınız?,Ön fren derhal tamir ettirilmelidir. Sadece arka freni kullanarak devam etmek veya hemen fren hidroliği eklemek güvenli çözüm değildir.,Ön tekerlek frenini tamir ettirmek,Bir sonraki servise kadar sadece arka freni kullanmak,Hemen fren hidroliği doldurmak,
2.7.02-012,en,tr,The mirror holder on your motorcycle is loose. What do you do?,You should never remove your mirror and need to fix them as they are required at all time to see the traffic behind you,Fix the mirror holder,Remove the mirror,,,Motosikletinizin ayna tutucusu gevşek. Ne yaparsınız?,Ayna tutucusunu sabitlemelisiniz. Aynayı sökmek doğru değildir.,Ayna tutucusunu sabitlemek,Aynayı sökmek,,
2.7.02-015,en,tr,What can you check on your tyre?,"The driver can check on the tire whether the prescribed tread depth is present and whether the tread has a consistent wear. In addition, the age of the tire can be read off the so-called DOT number.",Uniform wear of the profile,Profile,The age of the tyre,,Lastiğinizde neyi kontrol edebilirsiniz?,"Lastik profilinin eşit aşınmasını, profil derinliğini ve lastiğin yaşını kontrol edebilirsiniz.",Profilin eşit aşınması,Profil,Lastiğin yaşı,
2.7.02-016,en,tr,When do you need to renew the brake pads?,The car driver must replace the brake pads on the vehicle if they are heavily contaminated by oil. Replacement is also necessary and mandatory when reaching the wear limit.,If they have become oiled,If they have reached the wear limit,If they have got wet,,Fren balatalarını ne zaman yenilemeniz gerekir?,Fren balataları yağlanmışsa veya aşınma sınırına ulaşmışsa yenilenmelidir. Islanmaları tek başına yenileme sebebi değildir.,Yağlanmışlarsa,Aşınma sınırına ulaşmışlarsa,Islanmışlarsa,
2.7.02-017,en,tr,"Just after driving off, you test the brakes. Why?","Immediately after the start of the journey you should check the effectiveness of the service brake with a brake test for your own safety. Unlike bleeding the brake system, you can do this yourself by pressing the brake comfortably.",To check the effectiveness of the brakes,To bleed the brake system quickly,,,Hareket ettikten hemen sonra frenleri test ediyorsunuz. Neden?,Frenlerin etkinliğini kontrol etmek için. Fren sisteminin havasını hızlıca almak için yapılmaz.,Frenlerin etkinliğini kontrol etmek için,Fren sisteminin havasını hızlıca almak için,,
2.7.02-019,en,tr,Why does the brake fluid have to be exchanged according to the instructions of the vehicle manufacturer?,"The brake fluid also draws water from the air, so the proportion of water in the brake fluid increases over time. Too much water will cause bubbles in the brake fluid. If air bubbles get into the brake line, the braking action can completely fail.",To ensure the brake system continues to function even under higher stress,To ensure the percentage of water in the brake fluid does not reach a level which is unacceptable,To ensure the brake system does not leak,,Fren hidroliği neden araç üreticisinin talimatlarına göre değiştirilmelidir?,Fren sisteminin yüksek yük altında da çalışmasını sağlamak ve fren hidroliğindeki su oranının kabul edilemez seviyeye çıkmasını önlemek için değiştirilir.,Fren sisteminin daha yüksek yük altında da çalışmaya devam etmesini sağlamak için,Fren hidroliğindeki su oranının kabul edilemez seviyeye ulaşmamasını sağlamak için,Fren sisteminin sızdırmaz olmasını sağlamak için,
2.7.02-020,en,tr,In which cases is it imperative to test the brakes?,"A brake test is always essential if a vehicle has not been moved for a long period of time or if you are taking over a vehicle from someone else. If an oil change has been made on a vehicle, this has no effect on the brake system.",When you drive a different vehicle,If a vehicle has not been used for a longer period,Each time the engine oil is changed,,Hangi durumlarda frenleri mutlaka test etmelisiniz?,Başka bir araç kullanırken veya araç uzun süre kullanılmamışsa frenler test edilmelidir. Her motor yağı değişiminde şart değildir.,Başka bir araç kullandığınızda,Araç uzun süre kullanılmamışsa,Motor yağı her değiştirildiğinde,
2.7.02-021,en,tr,What do you have to check the tyres on your vehicle at regular intervals for?,"At regular intervals you should check the air pressure and tread depth of your vehicle tires. In addition, you should regularly check the tires on your vehicle for external damage.",For correct air pressure,For sufficient profile,For external damage,,Aracınızın lastiklerini düzenli olarak ne açısından kontrol etmelisiniz?,"Doğru hava basıncı, yeterli profil ve dış hasarlar düzenli kontrol edilmelidir.",Doğru hava basıncı,Yeterli profil,Dış hasarlar,
2.7.02-022,en,tr,"If tyre pressure is too high or too low, what can this cause?","If the internal tire pressure is too high or too low, the driving behavior will deteriorate. In addition, the tire wear increases. If the tire pressure is too low, the tire heats up by flexing, while the ""soft"" tire is excessively compressed and relieved at the footprint. The consequences are an increased fuel consumption and a high rolling resistance, in addition, the driving stability decreases. If the tire pressure is too high, the tire may burst. It is important to check the tire pressure regularly and to take the information recommended by the manufacturer into account. The tire pressure has no influence on the thinking distance.",Road behaviour can deteriorate,Tyre wear can increase,Reaction distance can be longer,,Lastik basıncı çok yüksek veya çok düşükse neye neden olabilir?,Sürüş davranışı kötüleşebilir ve lastik aşınması artabilir. Tepki mesafesi lastik basıncından doğrudan uzamaz.,Sürüş davranışı kötüleşebilir,Lastik aşınması artabilir,Tepki mesafesi uzayabilir,
2.7.02-023,en,tr,You hit a tyre against a hard obstacle with force. What must you do?,"Tire and wheel rim must be thoroughly checked before proceeding. Damage to the tire flanks is particularly critical. A deformed wheel rim can cause the tire to slip off the rim. A torn alloy wheel can also have dire consequences. The wheel bolts are not subjected to extraordinary strain, so they do not need to be tightened.",Have the tyres and rim checked immediately,Retighten the wheel bolts,,,Lastiği sert bir engele kuvvetli şekilde çarptınız. Ne yapmalısınız?,Lastikleri ve jantı hemen kontrol ettirmelisiniz. Sadece bijonları sıkmak yeterli değildir.,Lastikleri ve jantı hemen kontrol ettirmek,Bijonları tekrar sıkmak,,
2.7.02-024,en,tr,What happens when you drive with a tyre pressure which is far too low?,"If you drive with significantly too low tire pressure, the tire may overheat. The low air pressure decreases the driving stability, the vehicle ""floats"" on the road. A reduction in tire footprint due to concavity in the tread center increases tire wear. Too little tire pressure also increases fuel consumption.",Tyres heat up excessively,Driving stability decreases,Tyre wear decreases,,Çok düşük lastik basıncıyla sürerseniz ne olur?,"Lastikler aşırı ısınır ve sürüş dengesi azalır. Lastik aşınması azalmaz, artar.",Lastikler aşırı ısınır,Sürüş dengesi azalır,Lastik aşınması azalır,
2.7.02-025,en,tr,What can be the cause of a rear light not to work?,"If the taillight fails, you should first check the bulb. Even a defective fuse can cause a failure. The starter, however, does not matter because it is not related to the lighting system.",Bulb is defective,Fuse has blown,Starter is defective,,Arka lambanın çalışmamasının nedeni ne olabilir?,Ampul arızalı olabilir veya sigorta atmış olabilir. Marş motoru arızası arka lambayı tipik olarak etkilemez.,Ampul arızalıdır,Sigorta atmıştır,Marş motoru arızalıdır,
2.7.02-026,en,tr,The control light of your indicator is blinking considerably faster than usual. What can be the cause of this?,The flashing interval of the control lamp is shortened significantly if a bulb of the turn signal is defective. A fault with the flashing light switch cannot be the cause of the faster flashing.,A bulb is defective,The direction indicator switch is defective,,,Sinyal kontrol lambası normalden belirgin şekilde hızlı yanıp sönüyor. Bunun nedeni ne olabilir?,"Bir ampul arızalı olabilir. Sinyal kolunun arızalı olması da mümkün olabilir, ancak hızlı yanıp sönmenin tipik sebebi ampul arızasıdır.",Bir ampul arızalıdır,Sinyal şalteri arızalıdır,,
2.7.02-027,en,tr,Why are you required to have a defective exhaust system repaired immediately?,"You must repair a rusted exhaust system immediately, otherwise parts of the exhaust may fall onto the road. This poses a danger to the other road users. In addition, rusty exhaust parts create unnecessary noise. A rusted exhaust system has no effect on the temperature of the engine.",Because of the noise pollution,Because parts of the exhaust system can drop on the roadway,Because the engine would overheat,,Arızalı egzoz sistemini neden hemen tamir ettirmeniz gerekir?,Gürültü kirliliği nedeniyle ve egzoz parçaları yola düşebileceği için tamir ettirilmelidir. Motorun aşırı ısınması asıl sebep değildir.,Gürültü kirliliği nedeniyle,Egzoz sistemi parçaları yola düşebileceği için,Motor aşırı ısınacağı için,
