questionExternalId,sourceLanguage,targetLanguage,questionTextSource,explanationSource,answerASource,answerBSource,answerCSource,answerDSource,questionTextTarget,explanationTarget,answerATarget,answerBTarget,answerCTarget,answerDTarget
2.2.02-101-M,en,uz,What is the correct course of action on this one-way road?,"You only drive on when the work allows it. In a one-way street, you are only allowed to drive in one direction. You are not allowed to turn around or reverse. You are responsible for any accident that may occur.",I wait until the works enable me to drive past,I turn around and drive back,I reverse back up the road,,Bu bir tomonlama ko‘chada to‘g‘ri harakat qanday?,Ishlar o‘tishga imkon bergandagina harakatlaning. Bir tomonlama ko‘chada faqat bitta yo‘nalishda yurishga ruxsat beriladi. Qayrilib burilish yoki orqaga yurish mumkin emas. Yuz berishi mumkin bo‘lgan avariya uchun siz javobgar bo‘lasiz.,Ishlar menga o‘tishga imkon berguncha kutaman,"Qayrilib, orqaga qaytaman",Yo‘l bo‘ylab orqaga yuraman,
2.2.02-201,en,uz,"For which motor vehicles or combination vehicles designated or used for road haulage purposes, is it necessary to pay a user charge on federal highways?",For motor vehicles with a maximum authorized mass of at least 7.5 t and combinations of vehicles with a maximum authorized mass of at least 7.5 tons must be paid a usage fee (toll).,For motor vehicles with a gross vehicle weight rating of at least 7.5 t,For combination vehicles with a gross vehicle weight rating of at least 7.5 t,For combination vehicles with a gross vehicle weight rating less than 7.5 t,,Federal avtomagistrallarda yuk tashish uchun mo‘ljallangan yoki foydalaniladigan qaysi motorli transport vositalari yoki transport birikmalari uchun foydalanish to‘lovi to‘lanishi kerak?,"Eng kamida 7,5 t ruxsat etilgan maksimal massaga ega motorli transport vositalari va eng kamida 7,5 t ruxsat etilgan maksimal massaga ega transport birikmalari uchun foydalanish to‘lovi, ya’ni toll to‘lanishi kerak.","Kamida 7,5 t ruxsat etilgan umumiy og‘irlikka ega motorli transport vositalari uchun","Kamida 7,5 t ruxsat etilgan umumiy og‘irlikka ega transport birikmalari uchun","7,5 t dan kam ruxsat etilgan umumiy og‘irlikka ega transport birikmalari uchun",
2.2.02-202,en,uz,What motor vehicles and combination vehicles are subject to a toll charge on motorways and federal highways?,"Motor vehicles and vehicle combinations to a maximum authorized mass of at least 7.5 t have, are toll roads. The same applies to vehicles that are used for freight transport.",- are used in road haulage operations,- have a gross vehicle weight rating of at least 7.5 t,- have at least 4 seats,,Avtomagistrallar va federal yo‘llarda qaysi motorli transport vositalari va transport birikmalari toll to‘loviga tortiladi?,"Kamida 7,5 t ruxsat etilgan maksimal massaga ega motorli transport vositalari va transport birikmalari toll yo‘llarida to‘lovga tortiladi. Yuk tashish uchun ishlatiladigan transport vositalariga ham xuddi shu qoida amal qiladi.",- yo‘l yuk tashish ishlarida foydalaniladigan,"- kamida 7,5 t ruxsat etilgan umumiy og‘irlikka ega",- kamida 4 o‘rindiqqa ega,
2.2.02-203,en,uz,You are transporting hazardous goods during winter. What should you do if road conditions deteriorate due to packed snow?,"In icy weather, you must take special care to avoid endangering others. If you reach a point where you can no longer guarantee that others will not be endangered, you should find a good place to park.",- ensure that no-one else is endangered,"- look for the next suitable place to stop and park, if necessary",- always transport hazardous goods to the destination with no intermediate stops,,"Qishda xavfli yuk tashiyapsiz. Qattiq qor sabab yo‘l sharoiti yomonlashsa, nima qilishingiz kerak?","Muzli ob-havoda boshqalarga xavf tug‘dirmaslik uchun alohida ehtiyotkor bo‘lishingiz kerak. Agar boshqalarga xavf tug‘dirmaslikni endi kafolatlay olmasangiz, mos to‘xtash va parkovka joyini topishingiz kerak.",- hech kim xavf ostiga qo‘yilmasligini ta’minlash,"- zarur bo‘lsa, keyingi mos to‘xtash va parkovka joyini qidirish",- xavfli yukni doimo oraliq to‘xtashlarsiz manzilga yetkazish,
2.2.02-302,en,uz,You are driving an agricultural tractor at 30 km/h on a main road with a paved hard shoulder on the right. What is the right thing to do?,"In order to continue to ensure the flow of traffic, please go possible on the shoulder of your agricultural tractor.",I have to drive on the hard shoulder when possible,I may only use the hard shoulder for stopping,I may only use the hard shoulder briefly to allow vehicles to overtake,,Siz asosiy yo‘lda o‘ng tomonda qoplangan yo‘l cheti yo‘lagi bo‘lgan joyda qishloq xo‘jaligi traktorini 30 km/soat tezlikda boshqaryapsiz. To‘g‘ri harakat nima?,Harakat oqimi davom etishi uchun qishloq xo‘jaligi traktori bilan imkon qadar yo‘l cheti yo‘lagidan foydalaning.,Imkon bo‘lsa yo‘l cheti yo‘lagida yurishim kerak,Yo‘l cheti yo‘lagidan faqat to‘xtash uchun foydalanishim mumkin,Transport vositalari quvib o‘tishi uchun yo‘l cheti yo‘lagidan faqat qisqa muddat foydalanishim mumkin,
2.2.02-303,en,uz,What risks could arise if you drive in the right-hand lane alongside a truck?,A truck will diminish both your visibility and other people on the road seeing you (including the driver of the truck),- be unseen,- overlook other road users,- get burned by the hot exhaust fumes from the truck,,"Yuk mashinasi yonida o‘ng yo‘lakda harakatlansangiz, qanday xavflar yuzaga kelishi mumkin?","Yuk mashinasi sizning ko‘rinishingizni ham, boshqalar sizni ko‘rishini ham kamaytiradi, shu jumladan yuk mashinasi haydovchisi ham sizni ko‘rmay qolishi mumkin.",- ko‘rinmay qolish,- boshqa yo‘l ishtirokchilarini ko‘rmay qolish,- yuk mashinasining issiq chiqindi gazlaridan kuyish,
2.2.03-001,en,uz,A large pool of water has formed on the roadway. What do you do?,You should drive slowly on large pools of water as there is a risk of aquaplaning.,"Drive slowly, keeping your feet on the footrests","Do not brake, drive through the pool with your legs raised",Drive along the pavement,,Qatnov qismida katta suv to‘plami hosil bo‘lgan. Nima qilasiz?,"Katta suv to‘plamlarida sekin haydash kerak, chunki akvaplaning xavfi bor.","Sekin haydayman, oyoqlarimni oyoq tayanchlarida ushlab turaman","Tormoz bermayman, oyoqlarimni ko‘tarib suvdan o‘taman",Piyodalar yo‘lagidan yuraman,
2.2.03-005,en,uz,You are driving in fog on the autobahn and have 50 m visibility. What is the maximum speed you may drive?,"If the visibility in fog is less than 50 meters, the driver must not drive faster than 50 km/h. This also applies when there's snowfall or heavy rain.",50 km/h,70 km/h,90 km/h,,Siz avtomagistralda tumanda ketyapsiz va ko‘rinish 50 m. Eng yuqori qanday tezlikda yurishingiz mumkin?,"Tumanda ko‘rinish 50 metrdan kam bo‘lsa, haydovchi 50 km/soatdan tez yurmasligi kerak. Bu qor yog‘ishi yoki kuchli yomg‘irda ham amal qiladi.",50 km/soat,70 km/soat,90 km/soat,
2.2.03-015,en,uz,"What is the rule of thumb when calculating the braking distance for evasive braking on a dry, even and asphalted roadway?","The rule of thumb for determining the stopping distance is: thinking distance (speed divided by 10 times 3) plus braking distance (speed divided by 10 times speed divided by 10). At 50 km/h, this is 50 divided by 10 times 3 equals 15 m thinking distance plus 50 divided by 10 times 50 divided by 10 equals 25 m braking distance. The stopping distance is 40 m. In case of emergency braking, this value is halved. That would be 20 m in this example.",({Speed in km/h}/{10} x {Speed in km/h}/{10}) : 2,({Speed in km/h}/{10} x 5) : 2,({Speed in km/h}/{10} x 3) : 2,,"Quruq, tekis va asfaltlangan yo‘lda favqulodda tormozlashdagi tormoz yo‘lini hisoblash uchun oddiy qoida qanday?","To‘xtash masofasi: fikrlash masofasi (tezlik/10 x 3) plus tormoz yo‘li (tezlik/10 x tezlik/10). 50 km/soatda bu 15 m fikrlash masofasi va 25 m tormoz yo‘li, jami 40 m. Favqulodda tormozlashda bu qiymat ikki baravar kamayadi, ya’ni misolda 20 m.",({Tezlik km/soat}/{10} x {Tezlik km/soat}/{10}) : 2,({Tezlik km/soat}/{10} x 5) : 2,({Tezlik km/soat}/{10} x 3) : 2,
2.2.03-016,en,uz,You are travelling at 40 km/h. The braking distance for evasive braking is approximately 8 metres. How long is the braking distance at 50 km/h given otherwise the same conditions?,"The normal braking distance of your car is determined by this rule of thumb: Speed ​​divided by 10 times speed divided by 10. To calculate the braking distance during emergency braking, the determined value is halved again (divided by 2). Here there means: 50/10 * 50/10 = 25, divided by 2 = 12.5 meters.",12.5 m,11.0 m,9.5 m,,"Siz 40 km/soat tezlikda ketyapsiz. Favqulodda tormozlashdagi tormoz yo‘li taxminan 8 metr. Boshqa sharoitlar bir xil bo‘lsa, 50 km/soatda tormoz yo‘li qancha bo‘ladi?","Oddiy tormoz yo‘li qoida bo‘yicha hisoblanadi: tezlikni 10 ga bo‘lish va natijani o‘ziga ko‘paytirish. Favqulodda tormozlashda topilgan qiymat yana ikkiga bo‘linadi. Bu yerda: 50/10 * 50/10 = 25, 2 ga bo‘linsa = 12,5 metr.","12,5 m","11,0 m","9,5 m",
2.2.03-023,en,uz,You are driving on a good quality road in good visibility conditions. Within what distance must you be able to stop?,"With good visibility on a developed road, you must be able to stop within the assessable distance. At night, the range of the low beam is considered assessable.",- the stretch of road visible to me,- half of the stretch of road visible to me,- twice the stretch of road visible to me,,Yaxshi ko‘rinish sharoitida sifatli yo‘lda ketyapsiz. Qaysi masofada to‘xtay olishingiz kerak?,Yaxshi ko‘rinish va yaxshi qurilgan yo‘lda siz baholay oladigan masofa ichida to‘xtay olishingiz kerak. Tunda qisqa faralar yoritadigan masofa baholay olinadigan masofa hisoblanadi.,- menga ko‘rinadigan yo‘l qismi,- menga ko‘rinadigan yo‘l qismining yarmi,- menga ko‘rinadigan yo‘l qismining ikki baravari,
2.2.03-024,en,uz,"You are driving in darkness on a well-constructed main road, using your dipped headlights. Within what distance must you be able to stop?","You must be able to stop within the range of the low beam, as the parking light is so weak that it has no illumination visible to you. If you need the range of the high beam to stop, you risk a collision.",- dipped headlights,- main beam lights,- side lights,,Qorong‘ida yaxshi qurilgan asosiy yo‘lda qisqa faralar bilan ketyapsiz. Qaysi masofada to‘xtay olishingiz kerak?,"Qisqa faralar yoritadigan masofa ichida to‘xtay olishingiz kerak. Gabarit chiroqlari juda zaif va sizga yetarli yoritish bermaydi. Agar to‘xtash uchun uzoq faralar masofasiga muhtoj bo‘lsangiz, to‘qnashuv xavfi tug‘iladi.",- qisqa faralar,- uzoqni yorituvchi faralar,- gabarit chiroqlari,
2.2.03-107,en,uz,What must you remember particularly when driving with winter tyres (M + S)?,The car driver must comply with the maximum speed limit when driving with winter tires. The speed depends on the type of winter tires and may exceed 80 km/h.,The maximum permissible speed for these tyres may not be exceeded,You may not drive faster than 80 km/h,The maximum permissible speed for cars fitted with snow chains applies,,Qishki shinalar (M + S) bilan haydashda ayniqsa nimani yodda tutishingiz kerak?,Qishki shinalar bilan haydashda haydovchi maksimal ruxsat etilgan tezlikka rioya qilishi kerak. Tezlik qishki shina turiga bog‘liq va 80 km/soatdan yuqori bo‘lishi mumkin.,Bu shinalar uchun ruxsat etilgan maksimal tezlikdan oshmaslik kerak,80 km/soatdan tez yurish mumkin emas,Qor zanjiri o‘rnatilgan avtomobillar uchun maksimal tezlik amal qiladi,
2.2.03-303,en,uz,You are driving with dipped headlights on a main road. Within what distance must you be able to stop?,"You are only allowed to drive so fast that you can stop within the assessable track. In this situation, this corresponds to the range of your low beam.",- dipped headlights,- main beam lights,- side lights,,Qisqa faralar bilan asosiy yo‘lda ketyapsiz. Qaysi masofada to‘xtay olishingiz kerak?,Siz faqat ko‘ra va baholay oladigan yo‘l qismi ichida to‘xtay oladigan tezlikda haydashingiz mumkin. Bu vaziyatda bu qisqa faralaringiz yoritadigan masofaga teng.,- qisqa faralar,- uzoqni yorituvchi faralar,- gabarit chiroqlari,
2.2.03-304,en,uz,What vehicles are subject to the recommended speed on motorways?,"On motorways, all cars and vehicles up to a maximum gross vehicle weight of 3.5 t have to observe the freeway speed limit. Exceeding this speed limit is not recommended even in favorable traffic conditions.",- cars,- motorbikes,- Trucks with a gross vehicle weight rating in excess of 3.5 t,,Avtomagistrallardagi tavsiya etilgan tezlik qaysi transport vositalariga taalluqli?,"Avtomagistrallarda barcha yengil avtomobillar va maksimal umumiy og‘irligi 3,5 t gacha bo‘lgan transport vositalari tavsiya etilgan tezlikka rioya qilishi kerak. Qulay sharoitda ham bu tezlikdan oshish tavsiya etilmaydi.",- yengil avtomobillar,- mototsikllar,"- umumiy og‘irligi 3,5 t dan ortiq yuk mashinalari",
2.2.03-305,en,uz,On what roads does the recommended speed of 130 km/h apply?,"On freeway and roads outside the city, whose lanes are structurally separated, an advisory speed limit of 130 km/h applies. However, you must keep enough distance to be able to stop any time.",Motorways,"On vehicle roadways not inside a built-up area, with separate carriageways for each direction","On vehicle roadways not inside a built-up area, with at least two marked lanes for each direction",,130 km/soat tavsiya etilgan tezlik qaysi yo‘llarda amal qiladi?,"Avtomagistrallarda va aholi yashash hududidan tashqaridagi yo‘llarda, agar yo‘nalishlar konstruktiv ravishda ajratilgan bo‘lsa, 130 km/soat tavsiya etilgan tezlik amal qiladi. Biroq har doim to‘xtay oladigan darajada yetarli masofa saqlashingiz kerak.",Avtomagistrallarda,"Aholi yashash hududidan tashqarida, har bir yo‘nalish uchun alohida qatnov qismlari bo‘lgan yo‘llarda","Aholi yashash hududidan tashqarida, har bir yo‘nalishda kamida ikki belgilangan yo‘lak bo‘lgan yo‘llarda",
2.2.04-001,en,uz,You are driving at 80 km/h behind a motor vehicle. What is the minimum safe distance you must observe?,"When driving behind another vehicle, you need to maintain the so-called ""two-second distance"" to be able to stop in time. At a speed of 80 km/h, this corresponds to about 40 meters.","A ""distance of 2 seconds""","A ""distance of 1 second""",A distance of 15 metres,,Siz motorli transport vositasi ortidan 80 km/soat tezlikda ketyapsiz. Minimal xavfsiz masofa qancha bo‘lishi kerak?,Boshqa transport vositasi ortidan yurganda vaqtida to‘xtash uchun “ikki soniya masofasi”ni saqlashingiz kerak. 80 km/soat tezlikda bu taxminan 40 metrga teng.,“2 soniyalik masofa”,“1 soniyalik masofa”,15 metr masofa,
