questionExternalId,sourceLanguage,targetLanguage,questionTextSource,explanationSource,answerASource,answerBSource,answerCSource,answerDSource,questionTextTarget,explanationTarget,answerATarget,answerBTarget,answerCTarget,answerDTarget
2.1.10-002,en,uz,How can fatigue be prevented on a long journey?,"Timely breaks prevent overfatigue. Gymnastic exercises during the break pep up the circulation and are good for the joints. Coffee has only a short-term mobilizing effect, which can then quickly turn into the opposite. That means you could fall asleep without warning.",By well-timed and sufficient stops for rests,Gymnastic exercises during stops,Drink coffee and make no stops,,Uzoq safarda charchoqni qanday oldini olish mumkin?,O‘z vaqtida qilingan tanaffuslar haddan tashqari charchashni oldini oladi. Tanaffus paytidagi yengil mashqlar qon aylanishini faollashtiradi. Qahva faqat qisqa muddat hushyorlik beradi va keyin ta’siri teskarisiga aylanishi mumkin.,O‘z vaqtida va yetarli dam olish tanaffuslari orqali,Tanaffuslarda gimnastika mashqlari orqali,"Qahva ichib, tanaffus qilmaslik orqali",
2.1.10-003,en,uz,What is the potential risk when using driver assistance systems?,"The car driver may have too high expectations of the advanced driver-assistance system. This may result in the car driver neglecting his or her own responsibility and paying too little attention to the traffic. Even when using advanced driver-assistance systems, the responsibility for safe driving remains with the driver.",- have false expectations of the systems,- pay too little attention to the traffic around him,- neglect his own personal responsibility,,Haydovchiga yordamchi tizimlardan foydalanishda qanday xavf bor?,Haydovchi yordamchi tizimlardan juda ko‘p narsa kutishi mumkin. Natijada shaxsiy javobgarligini e’tiborsiz qoldirishi va yo‘l harakatiga kamroq e’tibor berishi mumkin. Xavfsiz haydash uchun javobgarlik baribir haydovchida qoladi.,- tizimlardan noto‘g‘ri kutilmalar bo‘lishi,- atrofdagi harakatga juda kam e’tibor berish,- shaxsiy javobgarligini e’tiborsiz qoldirish,
2.1.10-004,en,uz,What is the risk if you become distracted while using electronic devices when driving?,Using electronic devices while driving can cause you to miss traffic signs and wander off your lane (concentration distracted).,I may deviate from my lane,I may fail to notice road traffic signs,My stopping distance may be reduced,,"Haydash vaqtida elektron qurilmalardan foydalanib chalg‘isangiz, qanday xavf yuzaga keladi?","Haydash paytida elektron qurilmalardan foydalanish yo‘l belgilarini payqamay qolishga va yo‘lakdan chiqib ketishga olib kelishi mumkin, chunki diqqat chalg‘iydi.",Yo‘lagimdan chiqib ketishim mumkin,Yo‘l belgilarini payqamay qolishim mumkin,To‘xtash masofam kamayishi mumkin,
2.1.10-005,en,uz,What frequently causes younger drivers to have “disco accidents”?,"All three are correct. The so-called disco accidents are caused by overtiredness, by physical exhaustion and by being unfit to drive.",- are over-tired,- are physically exhausted,- are not fit to drive,,Yosh haydovchilarda “diskoteka avariyalari”ga ko‘pincha nima sabab bo‘ladi?,"Uchala javob ham to‘g‘ri. Bunday avariyalar haddan tashqari charchoq, jismoniy holdan toyish va haydashga yaroqsiz holat sabab yuzaga keladi.",- haddan tashqari charchagan bo‘lish,- jismoniy holdan toygan bo‘lish,- haydashga yaroqsiz bo‘lish,
2.1.10-006,en,uz,What is the right thing to do if you sense signs of fatigue during a night-time journey?,"As soon as you feel tired, you should take a break immediately. The risk of falling asleep increases with every second. If possible, you can let your passenger drive if they have the driving licence.",I interrupt the journey to take an adequate break,"I allow a co-driver to drive, if possible","I decide against taking a break, and fight the tiredness",,"Tungi safarda charchoq belgilarini sezsangiz, to‘g‘ri harakat nima?","Charchoqni sezishingiz bilan darhol tanaffus qilishingiz kerak. Uxlab qolish xavfi har soniyada ortadi. Imkon bo‘lsa, haydovchilik guvohnomasi bor yo‘lovchiga haydashni topshiring.",Yetarli tanaffus qilish uchun safarni to‘xtataman,"Imkon bo‘lsa, boshqa haydovchiga haydataman","Tanaffus qilmay, charchoq bilan kurashaman",
2.1.10-101,en,uz,What can diminish alertness in road traffic?,"All external stimuli such as joy, anger, interesting things on the radio and lively conversations can negatively affect the attention while driving, as they can be distracting.","Strong emotions (e.g. delight, annoyance, impatience)",Animated conversation,Engrossing programs on the car radio,,Yo‘l harakatida hushyorlikni nima kamaytirishi mumkin?,"Quvonch, g‘azab, radiodagi qiziqarli dastur va jonli suhbat kabi tashqi ta’sirlar haydash vaqtida diqqatni kamaytirishi mumkin, chunki ular chalg‘itadi.","Kuchli hissiyotlar, masalan xursandchilik, jahllanish, sabrsizlik",Jonli suhbat,Avtoradiodagi qiziqarli dasturlar,
2.1.10-102,en,uz,What strongly distracts you while you are driving?,"Telephoning while driving is only allowed via a hands-free system. Even then it is still a distraction. The lighting of a cigarette is considered a strong distraction, as it directs the view from the roadway to the cigarette. Whining children and passengers can be very distracting, if necessary, take a pause.",Telephoning,Lighting a cigarette,Nagging children on the backseats,,Haydash vaqtida sizni nima kuchli chalg‘itadi?,"Haydashda telefondan faqat hands-free tizimi orqali foydalanish mumkin, lekin bu ham chalg‘itadi. Sigaret yoqish ham kuchli chalg‘itadi, chunki nigoh yo‘ldan olinadi. Orqa o‘rindiqdagi bolalar va yo‘lovchilar ham chalg‘itishi mumkin; zarur bo‘lsa tanaffus qiling.",Telefonlashish,Sigaret yoqish,Orqa o‘rindiqdagi bolalarning bezovta qilishi,
2.1.10-103,en,uz,When should you interrupt your journey?,"Especially on longer trips, it can always happen that concentration subsides. If you notice that your concentration wanes noticeably, you should definitely take a break.
You should also stop if you want to cancel an object that has fallen into the vehicle. By searching and lifting an object, you can distract yourself very much. Therefore, you can endanger yourself and other road users.",- want to pick an item that has fallen down in my vehicle,- notice that the concentration is decreasing,- want to activate the cruise control system,,Qachon safarni to‘xtatishingiz kerak?,"Uzoq safarlarda diqqat pasayishi mumkin. Agar diqqat sezilarli kamayganini sezsangiz, albatta tanaffus qiling. Transport vositasi ichida tushib ketgan narsani olish uchun ham to‘xtash kerak, chunki qidirish va olish kuchli chalg‘itadi.",- transport vositam ichida tushib ketgan narsani olishni xohlasam,- diqqatim kamayib borayotganini sezsam,- kruiz-kontrol tizimini yoqmoqchi bo‘lsam,
2.1.11-003,en,uz,A slow driver prevents you from proceeding quickly. What is right?,Never start a risky overtaking maneuver or force your frontman to speed up with your flash light. Keep the necessary safety distance and wait for a convenient opportunity for safe overtaking.,You follow him until there is a possibility to overtake,You flash your headlights to make him drive faster,You close up to him in order to shorten the overtaking distance,,Sekin haydovchi sizning tezroq yurishingizga xalaqit bermoqda. Qaysi javob to‘g‘ri?,Xavfli quvib o‘tishga urinmang va oldingizdagi haydovchini tezroq yurishga majburlamang. Zarur xavfsiz masofani saqlang va xavfsiz quvib o‘tish uchun qulay imkoniyatni kuting.,Quvib o‘tish imkoniyati paydo bo‘lguncha uning ortidan yuraman,Uni tezroq yurishga majburlash uchun faralarni chaqnataraman,Quvib o‘tish masofasini qisqartirish uchun unga juda yaqinlashaman,
2.1.11-007,en,uz,What makes a good driver?,A good driver adheres to the traffic regulations and is characterized by a cooperative behavior in dealing with other road users. He/she refrains from risky driving styles and careless overtaking maneuvers. A good driver does not have to prove his/her skills to others.,"He treats others like partners, drives calmly and cooly and refrains from showing that he is superior","He uses every possibility to overtake, give the slip to others and show his superiority even if his manner of driving involves risks",He drives fast in order to show his abilities,,Yaxshi haydovchini nima belgilaydi?,Yaxshi haydovchi qoidalarga rioya qiladi va boshqa yo‘l ishtirokchilari bilan hamkorlikda harakat qiladi. U xavfli haydash va ehtiyotsiz quvib o‘tishdan voz kechadi. Yaxshi haydovchi o‘z mahoratini boshqalarga isbotlashi shart emas.,"U boshqalarga sherik sifatida munosabatda bo‘ladi, xotirjam haydaydi va ustunligini ko‘rsatishdan tiyiladi",U har qanday imkoniyatda quvib o‘tadi va xavf bo‘lsa ham ustunligini ko‘rsatadi,U o‘z qobiliyatini ko‘rsatish uchun tez haydaydi,
2.1.11-008,en,uz,"Travelling on a main road after a lengthy period of time of following behind, you are finally able to overtake a very slow-moving car. What should you do?",You should stay calm in this situation and overtake with a sufficient safety distance without endangering other road users. Harassing others by tightly cutting them should be avoided. Otherwise an accident could occur.,- I pull back in after an adequate distance in order not to impede the other driver,- I brake briefly in order to call the attention of the other driver to his slow speed,- I drive especially slowly in order to emphasise to the other driver the effects of his driving style,,Asosiy yo‘lda uzoq vaqt juda sekin ketayotgan avtomobil ortidan yurganingizdan keyin nihoyat uni quvib o‘tishingiz mumkin. Nima qilishingiz kerak?,"Bu vaziyatda xotirjam bo‘ling va yetarli xavfsiz masofa bilan quvib o‘ting. Boshqalarni jazolash uchun keskin oldiga kirib olishdan saqlaning, aks holda avariya yuz berishi mumkin.",- boshqa haydovchiga xalaqit bermaslik uchun yetarli masofadan keyin qayta yo‘lakka kiraman,- uning sekin yurganiga e’tiborini qaratish uchun qisqa tormoz beraman,- uning haydash uslubi ta’sirini ko‘rsatish uchun juda sekin yuraman,
2.1.11-009-M,en,uz,The vehicle ahead has prevented you from overtaking for some time now. What is the right course of action?,"The car driver has to wait until overtaking is possible without danger and always maintain the necessary safety distance to the vehicle in front. Stay calm, because tailgating, turning the headlights on full beam for a long time or honking is considered coercion and will be punished with fines or even a withdrawal of your driving license.",I wait until I am able to overtake,I close the gap,I sound my horn and flash my headlights persistently,,Oldingizdagi transport vositasi anchadan beri quvib o‘tishingizga xalaqit bermoqda. To‘g‘ri harakat qanday?,"Haydovchi xavfsiz quvib o‘tish mumkin bo‘lguncha kutishi va oldidagi transport vositasigacha zarur xavfsiz masofani saqlashi kerak. Xotirjam bo‘ling: juda yaqin yurish, uzoq vaqt uzoq faralarni yoqish yoki signal chalish majburlash hisoblanadi va jarima yoki guvohnomadan mahrum bo‘lishga olib kelishi mumkin.",Quvib o‘ta olgunimcha kutaman,Masofani qisqartiraman,"Tinimsiz signal chalib, faralarni chaqnataraman",
2.1.11-010,en,uz,"Right before you want to drive off, you got annoyed about something and have become very angry. What should you do?","Getting into the car angrily can negatively affect your driving style. If you are angry, your driving style is also aggressive and limited. Therefore, only get into your vehicle when you're abreacted.","I only drive off, once I have calmed down again","I drive off, in order to distract myself from my anger","I try to reach my destination quickly, so that I can calm down there",,Yo‘lga chiqishdan oldin bir narsadan qattiq jahlingiz chiqdi. Nima qilishingiz kerak?,"Jahlingiz chiqqan holda avtomobilga o‘tirish haydash uslubingizga salbiy ta’sir qiladi. Jahlingiz chiqqan bo‘lsa, haydashingiz agressiv va cheklangan bo‘ladi. Shuning uchun faqat tinchlangandan keyin yo‘lga chiqing.",Faqat yana tinchlanganimdan keyin yo‘lga chiqaman,Jahlimni unutish uchun yo‘lga chiqaman,"Manzilga tez yetib borib, u yerda tinchlanishga harakat qilaman",
2.1.11-011,en,uz,You have just avoided a road traffic accident by performing an emergency braking manoeuvre. Your hands and knees are shaking. You are still far from your destination. What should you do?,You should calm down first. Because your restlessness can have a negative effect on your driving style. Find a place to stop and relax. Afterwards you may continue the journey.,"- to the next stopping place, in order to calm myself down","- to my destination, so that I can recover my composure",,,Favqulodda tormoz berib yo‘l-transport hodisasidan endigina qutuldingiz. Qo‘llaringiz va tizzalaringiz titrayapti. Manzilingiz hali uzoq. Nima qilishingiz kerak?,Avvalo tinchlanishingiz kerak. Bezovtalik haydash uslubingizga salbiy ta’sir qilishi mumkin. To‘xtash uchun joy toping va tinchlaning. Shundan keyin safarni davom ettirishingiz mumkin.,- tinchlanish uchun keyingi to‘xtash joyiga boraman,- o‘zimga kelish uchun manzilimgacha davom etaman,,
2.1.11-012,en,uz,What should you be aware of when driving a car after a long day's work?,"After a long day at work, you are usually not fully productive and get tired faster. That's why mistakes while driving can increase and your concentration decreases.",I drive with a lower level of concentration,I will become tired more quickly,I make fewer driving errors,,Uzoq ish kunidan keyin avtomobil haydaganda nimani hisobga olishingiz kerak?,Uzoq ish kunidan keyin odatda ish qobiliyatingiz to‘liq bo‘lmaydi va tezroq charchaysiz. Shu sabab haydashdagi xatolar ko‘payishi va diqqat kamayishi mumkin.,Diqqatim pastroq bo‘ladi,Tezroq charchayman,Kamroq haydash xatosi qilaman,
2.1.11-013,en,uz,How can you recognise a good driver?,A good driver always takes care to act in partnership and also knows that people can make mistakes.,- exhibits a calm and relaxed driving style,- refrains from responding to provocations on the road,- always informs other traffic participants of their driving errors,,Yaxshi haydovchini qanday taniysiz?,Yaxshi haydovchi har doim hamkorlik ruhida harakat qiladi va odamlar xato qilishi mumkinligini biladi.,- xotirjam va bo‘shashgan haydash uslubini ko‘rsatadi,- yo‘ldagi provokatsiyalarga javob berishdan tiyiladi,- boshqa harakat ishtirokchilariga ularning haydash xatolarini doim bildiradi,
2.1.11-014-M,en,uz,The [red] car in front of you has been driving slowly for some time now. What is the correct course of action in this situation?,"You maintain your speed so as not to tailgate and keep the required safe distance. It is forbidden to tailgate, tailgate too closely or honk your horn in traffic.
The road is clear, but you can only see as far as the next bend. The visible distance is too short for an overtaking manoeuvre.",I maintain my speed,"I overtake, because the road is clear",I close the distance and sound my horn,,Oldingizdagi [qizil] avtomobil anchadan beri sekin ketyapti. Bu vaziyatda to‘g‘ri harakat qanday?,"Juda yaqinlashmaslik va zarur xavfsiz masofani saqlash uchun tezligingizni saqlang. Yo‘l harakatida juda yaqin yurish yoki signal chalish taqiqlanadi. Yo‘l ochiq ko‘rinsa ham, siz faqat keyingi burilishgacha ko‘ra olasiz; ko‘rinadigan masofa quvib o‘tish uchun juda qisqa.",Tezligimni saqlayman,Yo‘l ochiq bo‘lgani uchun quvib o‘taman,"Masofani qisqartirib, signal chalaman",
2.1.11-015,en,uz,What frequently causes young people to have “disco accidents”?,"Young drivers in particular have less driving experience and a higher willingness to take risks through showing off. Dangerous situations are assessed more poorly and accidents occur more frequently.
A defensive driving style can prevent accidents.",A lack of awareness of the road traffic,A high readiness to take risks,A defensive driving style,,Yoshlarning “diskoteka avariyalari”ga ko‘pincha nima sabab bo‘ladi?,Yosh haydovchilarda tajriba kamroq va o‘zini ko‘rsatish sabab tavakkal qilishga moyillik yuqoriroq bo‘ladi. Xavfli vaziyatlar yomonroq baholanadi va avariyalar tez-tez yuz beradi. Himoyaviy haydash uslubi avariyalarni oldini oladi.,Yo‘l harakatini yetarlicha anglamaslik,Tavakkal qilishga yuqori tayyorlik,Himoyaviy haydash uslubi,
2.1.11-016,en,uz,Why can driving under pressure of time be dangerous?,"When you are under time pressure, you may underestimate dangers because your willingness to take risks increases and people often drive too fast. You should still drive defensively and stick to the speed limits to avoid endangering yourself and others.",- risks are frequently underestimated,- the driver frequently goes too fast,- a defensive driving style is frequently adopted,,Vaqt bosimi ostida haydash nega xavfli bo‘lishi mumkin?,"Vaqt bosimi ostida xavflar ko‘pincha kam baholanadi, chunki tavakkal qilishga tayyorlik ortadi va odamlar tez-tez juda tez haydashadi. O‘zingiz va boshqalarga xavf tug‘dirmaslik uchun baribir himoyaviy haydang va tezlik cheklovlariga rioya qiling.",- xavflar ko‘pincha kam baholanadi,- haydovchi ko‘pincha juda tez yuradi,- himoyaviy haydash uslubi ko‘pincha tanlanadi,
2.1.11-017,en,uz,"You are on a road outside of a built-up area, and a car in front of you is driving much slower than is permitted to and has the capacity to. What is the right course of action?","Even if you don't like it, you must adapt your speed to that of the car and not get too close to it. Only overtake at a suitable place and not in front of it. Do not endanger yourself or others.",I adjust my speed to that of the car,I overtake at a suitable place,"I flash my headlights, until the car begins to drive faster",,"Siz aholi yashash hududidan tashqaridagi yo‘ldasiz va oldingizdagi avtomobil ruxsat etilgandan ham, imkoniyatidan ham ancha sekin yurmoqda. To‘g‘ri harakat qanday?","Bu sizga yoqmasa ham, tezligingizni oldingizdagi avtomobil tezligiga moslashtiring va unga juda yaqinlashmang. Faqat mos joyda quvib o‘ting. O‘zingizga ham, boshqalarga ham xavf tug‘dirmang.",Tezligimni avtomobil tezligiga moslashtiraman,Mos joyda quvib o‘taman,Avtomobil tezroq yurishi uchun faralarni chaqnataraman,
2.1.11-018,en,uz,Why is it not advisable to change lanes frequently?,"Every lane change requires certain activities: observing traffic, flashing, changing the lane yourself. In this case, other road users can be overlooked and endangered. Changing lanes often doesn't save you much time, but the more often you change lanes, the more likely you are to make mistakes.",Because this can increase the risk of driving errors,Because the time gained by this is generally very small,Because this can endanger other road users,,Nega yo‘lakni tez-tez almashtirish tavsiya etilmaydi?,"Har bir yo‘lak almashtirish kuzatish, signal berish va yo‘lakni almashtirishni talab qiladi. Bunda boshqa yo‘l ishtirokchilari ko‘zdan qochishi va xavf ostiga tushishi mumkin. Tez-tez yo‘lak almashtirish odatda ko‘p vaqt tejamaydi, lekin xato qilish ehtimolini oshiradi.",Chunki bu haydash xatolari xavfini oshirishi mumkin,Chunki vaqt yutug‘i odatda juda kichik bo‘ladi,Chunki bu boshqa yo‘l ishtirokchilariga xavf tug‘dirishi mumkin,
2.1.11-019,en,uz,You have narrowly avoided a road traffic accident through emergency braking. Your hands and knees are shaking. What is the right course of action?,"Stop at the next opportunity and take a break until you have calmed down. Maybe you can get out, walk a few metres and take a deep breath. 
You should also go through the situation again in your head later, as you may realise what didn't go perfectly. That way you can adjust your driving behaviour in the future.","I take a break at the soonest possible opportunity, in order to calm myself","Later, I ponder if I could have avoided the situation",I continue driving in order to calm myself,,Favqulodda tormoz berib yo‘l-transport hodisasidan zo‘rg‘a qutuldingiz. Qo‘llaringiz va tizzalaringiz titrayapti. To‘g‘ri harakat qanday?,"Eng yaqin imkoniyatda to‘xtab, tinchlanguncha tanaffus qiling. Ehtimol, tashqariga chiqib bir necha metr yuring va chuqur nafas oling. Keyinroq vaziyatni yana o‘ylab ko‘ring, shunda kelajakda haydash xatti-harakatingizni moslashtirishingiz mumkin.",Tinchlanish uchun eng yaqin imkoniyatda tanaffus qilaman,Keyinroq vaziyatni oldini olish mumkin bo‘lgan-bo‘lmaganini o‘ylab ko‘raman,Tinchlanish uchun haydashda davom etaman,
2.1.11-020,en,uz,"While driving, you become very annoyed at the behaviour of another road user. What is the right course of action now?","It is important that you are not distracted by the traffic if you are annoyed by the behaviour of other drivers, because road safety is paramount. Concentrate on the traffic and continue driving calmly; if you are emotionally agitated while driving, you could overlook dangers. If necessary, take a break and only continue driving when you have calmed down.",I continue to concentrate on the road traffic,I continue driving in such a way that my anger does not negatively affect road safety,"If necessary, I take a break to calm myself down",,Haydash vaqtida boshqa yo‘l ishtirokchisining xatti-harakatidan juda jahlingiz chiqdi. Hozir to‘g‘ri harakat qanday?,"Agar boshqa haydovchining xatti-harakatidan jahlingiz chiqqan bo‘lsa ham, yo‘l harakati xavfsizligi eng muhim. Harakatga diqqat qiling va xotirjam haydashda davom eting. Hissiy qo‘zg‘alish xavflarni ko‘zdan qochirishga olib kelishi mumkin. Zarur bo‘lsa, tanaffus qiling va faqat tinchlangandan keyin davom eting.",Yo‘l harakatiga diqqatni qaratishda davom etaman,Jahlim yo‘l xavfsizligiga salbiy ta’sir qilmaydigan tarzda haydashda davom etaman,"Zarur bo‘lsa, tinchlanish uchun tanaffus qilaman",
2.1.11-111,en,uz,Why does environment friendly driving in general have a beneficial effect on traffic safety?,Avoid high speeds and drive anticipatory. This not only has a positive effect on the environment. It also contributes to greater road safety.,"Because drivers think ahead when travelling, so that possible dangers can be recognized in time and well avoided",Because environment friendly driving avoids high speeds so that dangerous situations occur less frequently,Because you can only drive slowly using alternative fuels,,Nega ekologik haydash odatda yo‘l xavfsizligiga ham ijobiy ta’sir qiladi?,"Yuqori tezliklardan saqlaning va oldindan ko‘ra bilib haydang. Bu nafaqat atrof-muhitga, balki yo‘l xavfsizligiga ham ijobiy ta’sir qiladi.","Chunki haydovchilar oldindan o‘ylab haydashadi, mumkin bo‘lgan xavflar vaqtida tanilib, oldini olish mumkin",Chunki ekologik haydash yuqori tezliklardan saqlaydi va xavfli vaziyatlar kamroq yuz beradi,Chunki muqobil yoqilg‘ida faqat sekin haydash mumkin,
2.1.11-112,en,uz,"The queue you are driving in is overtaken in an inconsiderate manner by a car. Because of oncoming traffic the driver wants to join the queue in front of the car driving in front of you. This driver is annoyed and ""closes the gap"". What do you do?","In such a situation, by deliberately giving in, you should reduce the speed and giving the other road user space to go back into lane in order to reduce the risk of an accident. Remember that everyone can misjudge.",You give in and let the jostling driver join the queue,"You also ""close the gap"" in order to teach the jostling driver a lesson","Nothing, since you are not concerned",,Siz ketayotgan qatordagi transportni bir avtomobil e’tiborsiz quvib o‘tmoqda. Qarshidan kelayotgan transport sabab u sizning oldingizdagi avtomobil oldiga kirib olmoqchi. Oldingizdagi haydovchi jahllanib “bo‘shliqni yopmoqda”. Siz nima qilasiz?,"Bunday vaziyatda ongli ravishda yo‘l berib, tezlikni kamaytiring va boshqa yo‘l ishtirokchisiga qayta yo‘lakka kirish uchun joy bering. Bu avariya xavfini kamaytiradi. Har kim vaziyatni noto‘g‘ri baholashi mumkinligini unutmang.","Yo‘l berib, siqib kelayotgan haydovchini qatorga kiritaman",Uni tarbiyalash uchun men ham bo‘shliqni yopaman,"Hech narsa qilmayman, chunki bu menga tegishli emas",
2.1.11-113,en,uz,A truck indicating to the right is driving in front of you. An impatient car driver is jostling you. What can you do?,"In this situation it is better to cut back and keep a safe distance. Maybe the truck driver would like to signal that the road is clear. However, it may also be that he/she intends to stop or turn right. Only overtake if there is no danger. Increase the distance to the truck so that the pushy driver can overtake.",I only overtake when I am completely certain that the traffic situation allows overtaking without danger,I open up the distance to the truck to make overtaking easier for the jostling driver,I overtake because I assume that the truck driver wishes to signal to me that overtaking is possible,,Oldingizda o‘ngga signal berayotgan yuk mashinasi ketmoqda. Sabrsiz avtomobil haydovchisi sizni siqmoqda. Nima qila olasiz?,"Bu vaziyatda ortda qolib, xavfsiz masofa saqlash yaxshiroq. Balki yuk mashinasi haydovchisi yo‘l bo‘shligini bildirmoqchidir, lekin u to‘xtamoqchi yoki o‘ngga burilmoqchi ham bo‘lishi mumkin. Faqat xavf bo‘lmasa quvib o‘ting. Siqayotgan haydovchi quvib o‘tishi uchun yuk mashinasigacha masofani oshiring.",Faqat harakat vaziyati xavfsiz quvib o‘tishga imkon berishiga to‘liq ishonchim komil bo‘lsa quvib o‘taman,Siqayotgan haydovchiga quvib o‘tishni osonlashtirish uchun yuk mashinasigacha masofani oshiraman,Yuk mashinasi haydovchisi quvib o‘tish mumkinligini bildirmoqda deb o‘ylab quvib o‘taman,
