questionExternalId,sourceLanguage,targetLanguage,questionTextSource,explanationSource,answerASource,answerBSource,answerCSource,answerDSource,questionTextTarget,explanationTarget,answerATarget,answerBTarget,answerCTarget,answerDTarget
2.1.11-114,en,uz,"On a road not within a built-up area, a car is driving in front of you at a speed somewhat slower than that permitted. You are annoyed at the slower-moving car. What should you do?","You should definitely wait for a safe situation to overtake. Harassing someone by tailgating or flash light, however, represents a threat or even coercion. You should refrain from doing so.",I adjust my speed to that of the vehicle ahead,I overtake at a suitable place,"I flash my headlights, until the car in front begins to drive faster",,Aholi yashash hududidan tashqaridagi yo‘lda oldingizdagi avtomobil ruxsat etilgan tezlikdan biroz sekinroq yurmoqda. Siz sekin avtomobildan jahllandingiz. Nima qilishingiz kerak?,Quvib o‘tish uchun albatta xavfsiz vaziyatni kutishingiz kerak. Juda yaqin yurish yoki faralarni chaqnatib bezovta qilish esa tahdid yoki majburlash hisoblanadi. Bunday xatti-harakatdan tiyiling.,Tezligimni oldindagi transport vositasi tezligiga moslashtiraman,Mos joyda quvib o‘taman,Oldindagi avtomobil tezroq yurishni boshlaguncha faralarni chaqnataraman,
2.1.11-115,en,uz,What can frequently lead to road traffic accidents during night-time recreational drives at the weekend?,Too little driving experience during the dark and a lack of knowledge about driving behavior in fully occupied vehicles often leads to accidents during nocturnal recreational rides on the weekend.,- little experience driving after dark,- little experience with fully occupied vehicles,- little knowledge of road traffic regulations,,Dam olish kunlari tunda ko‘ngilochar safarlarda yo‘l-transport hodisalariga ko‘pincha nima olib keladi?,Tunda haydash tajribasining kamligi va to‘liq yo‘lovchi bilan to‘lgan avtomobilda haydash xatti-harakati haqida yetarli bilim yo‘qligi dam olish kunlari tunda avariyalarga tez-tez olib keladi.,- qorong‘ida haydash tajribasining kamligi,- to‘liq yo‘lovchi bilan to‘lgan transport vositalari bilan tajribaning kamligi,- yo‘l harakati qoidalarini kam bilish,
2.1.11-116,en,uz,You are under time pressure. What must you ensure?,"Even if you are under time pressure, you must follow the traffic rules. This also means that you comply with the speed limits. After all, excessive speed is THE main cause of accidents.",- to exceed the speed,- to drive through the traffic lights even when red,- to reduce the safety,,Siz vaqt bosimi ostidasiz. Nimani ta’minlashingiz kerak?,"Vaqt bosimi ostida bo‘lsangiz ham, yo‘l harakati qoidalariga rioya qilishingiz shart. Bu tezlik cheklovlariga ham rioya qilishni anglatadi. Axir haddan tashqari tezlik avariyalarning asosiy sababidir.",- tezlikdan oshmaslikka,- qizil chiroqda svetofordan o‘tmaslikka,- xavfsizlikni kamaytirmaslikka,
2.1.11-117,en,uz,Serious accidents frequently occur when young people drive cars during night-time recreational drives at weekends. What causes can be particularly relevant here?,Unreasonable speed and willingness to take risks often lead to serious accidents among young people during weekend rides at night.,Inappropriate speed,High risk readiness,Hesitant driving style,,Dam olish kunlari tunda yoshlar avtomobil haydaganda jiddiy avariyalar tez-tez yuz beradi. Bunda qaysi sabablar ayniqsa muhim bo‘lishi mumkin?,Tunda dam olish safarlarida yoshlar orasida mos bo‘lmagan tezlik va tavakkal qilishga tayyorlik ko‘pincha jiddiy avariyalarga olib keladi.,Nomaqbul tezlik,Yuqori tavakkal qilishga tayyorlik,Ikkilanuvchi haydash uslubi,
2.1.11-118,en,uz,"After overtaking you, a car pulls back into lane without leaving sufficient space in front of you. What should you do?","The car driver in the overtaking vehicle shows a misconduct that should not disturb you. Stay calm, do not honk and do not turn on the flash light. Decelerate slightly and restore the required safety distance between the vehicles.",I remain calm in order to avoid conflicts,I brake in order to ensure that the safety distance is again established,I flash my headlights in order to call attention to the impediment,,Sizni quvib o‘tgandan keyin avtomobil oldingizda yetarli masofa qoldirmasdan qayta yo‘lakka kirdi. Nima qilishingiz kerak?,"Quvib o‘tgan avtomobil haydovchisi noto‘g‘ri harakat qildi, ammo bu sizni chalg‘itmasligi kerak. Xotirjam bo‘ling, signal chalmang va faralarni chaqnatmang. Biroz sekinlashib, transport vositalari orasidagi zarur xavfsiz masofani tiklang.",Mojarodan qochish uchun xotirjam qolaman,Xavfsiz masofa yana tiklanishi uchun tormoz beraman,Xalaqitga e’tibor qaratish uchun faralarni chaqnataraman,
2.1.11-119,en,uz,The risk of causing an accident when driving a vehicle is significantly higher for drivers aged between 18 and 24. What reasons are frequently relevant here?,"Young car drivers often have too little experience to be able to correctly assess road traffic risks. They often drive carelessly and riskily, overestimate their abilities and rely on the safety of the vehicles they control. By testing their car and their own driving skills, they sometimes get into unmanageable situations.",Too little driving experience,Over-estimation of own capabilities,Higher levels of risk readiness,,18 yoshdan 24 yoshgacha bo‘lgan haydovchilarda avariya sodir etish xavfi ancha yuqori. Bunga ko‘pincha qaysi sabablar tegishli?,"Yosh haydovchilarda yo‘l harakati xavflarini to‘g‘ri baholash uchun ko‘pincha tajriba kam bo‘ladi. Ular ko‘pincha ehtiyotsiz va tavakkalchi haydaydi, o‘z qobiliyatlarini ortiqcha baholaydi va avtomobil xavfsizligiga haddan tashqari ishonadi.",Haydash tajribasining kamligi,O‘z qobiliyatini ortiqcha baholash,Tavakkal qilishga tayyorlikning yuqoriligi,
2.1.11-120,en,uz,"While you are in a traffic jam, looking in your rear-view mirror you see a motorcyclist ""snaking"" past the stationary line of vehicles. What should you do?","Under no circumstances should you act illegally just because another road user violates applicable rules. It is forbidden for you as a car driver to honk in this situation, to stop the motorcyclist or to let him pass.",I let him drive past,I sound my horn and note his registration,I take steps to ensure that he too must come to a stop,,Tirbandlikda turganingizda orqa ko‘zguda mototsiklchi to‘xtab turgan transport qatori yonidan “ilon kabi” o‘tib ketayotganini ko‘rdingiz. Nima qilishingiz kerak?,"Boshqa yo‘l ishtirokchisi qoidani buzayotgani uchun siz ham noqonuniy harakat qilmasligingiz kerak. Bu vaziyatda avtomobil haydovchisi sifatida signal chalish, mototsiklchini to‘xtatish yoki uni o‘tkazib yuborish uchun maxsus harakat qilish taqiqlanadi.",Uni o‘tib ketishiga qo‘yib beraman,"Signal chalib, davlat raqamini yozib olaman",U ham to‘xtashi uchun choralar ko‘raman,
2.1.11-121,en,uz,"You are driving on a main road and a car following behind is ""tailgating"" you. How should you react?","When driving on a highway and being harassed by the car behind you, you should keep calm and control your speed at an appropriate pace. You should avoid slow driving so as not to hinder the flow of traffic. However, you should also not be tempted to drive faster. It's best to let the pushy driver pass at the next opportunity.",I maintain my speed and keep to the right to enable the car following behind to overtake,"I increase my speed until the car following behind ceases ""tailgating"" me","I reduce my speed until the car following behind ceases ""tailgating"" me",,Siz asosiy yo‘lda ketyapsiz va ortingizdagi avtomobil juda yaqin yurib sizni siqmoqda. Qanday javob berishingiz kerak?,"Ortingizdagi avtomobil sizni siqsa, xotirjam bo‘ling va tezligingizni mos darajada nazorat qiling. Harakat oqimiga xalaqit bermaslik uchun juda sekin yurishdan saqlaning, lekin tezroq haydashga ham undalmang. Eng yaxshisi, keyingi imkoniyatda siqayotgan haydovchini o‘tkazib yuboring.",Tezligimni saqlayman va ortimdagi avtomobil quvib o‘tishi uchun o‘ng tomonda yuraman,Ortimdagi avtomobil juda yaqin yurishni to‘xtatguncha tezligimni oshiraman,Ortimdagi avtomobil juda yaqin yurishni to‘xtatguncha tezligimni kamaytiraman,
2.1.11-122,en,uz,"You overtake on a motorway. Behind you a car approaches at high speed, with headlights and indicators flashing. What should you do?","The only thing you can do is to keep calm! Stay calm and do not try to score off the pushy driver. It is best to let him pass. If you have sufficient overtaking speed, you can still complete the overtaking process. As soon as the next opportunity arises, you should switch to the right lane and let the pushy driver pass.",I continue overtaking swiftly,I pull over into the right-hand lane as soon as possible,I gently decelerate,,"Siz avtomagistralda quvib o‘tyapsiz. Ortingizdan bir avtomobil yuqori tezlikda, faralari va burilish ko‘rsatkichlarini chaqnatib yaqinlashmoqda. Nima qilishingiz kerak?","Qila oladigan eng muhim ish — xotirjam qolish. Siqayotgan haydovchidan o‘ch olishga urinmang. Eng yaxshisi uni o‘tkazib yuboring. Agar yetarli quvib o‘tish tezligingiz bo‘lsa, manevrni yakunlashingiz mumkin. Birinchi imkoniyatda o‘ng yo‘lakka o‘tib, siqayotgan haydovchini o‘tkazib yuboring.",Quvib o‘tishni tez yakunlayman,Imkon qadar tezroq o‘ng yo‘lakka o‘taman,Yengil sekinlashaman,
2.1.11-123,en,uz,Five young friends are driving in a car to a recreational event. The mood is exuberant. To what risks can this give rise?,"For the car driver, there is a risk of getting carried away by the mood. He/She can be distracted by the others and overlook traffic hazards and make driving mistakes. It is recommended to set up rules of conduct for the passengers before starting the journey. So, the car driver is not a spoilsport or tempted in any way.",- be distracted from events on the road,- be induced to drive in a risky manner,- be induced to drive slowly,,Besh nafar yosh do‘st ko‘ngilochar tadbirga avtomobilda ketmoqda. Kayfiyat juda ko‘tarinki. Bu qanday xavflarga olib kelishi mumkin?,"Haydovchi kayfiyat ta’siriga berilib ketishi mumkin. U boshqalar tomonidan chalg‘itilib, yo‘l xavflarini ko‘zdan qochirishi va haydash xatolari qilishi mumkin. Safar boshlanishidan oldin yo‘lovchilar uchun xulq-atvor qoidalarini belgilash tavsiya etiladi.",- yo‘ldagi hodisalardan chalg‘ish,- xavfli tarzda haydashga undalish,- sekin haydashga undalish,
2.1.11-124,en,uz,While driving on the motorway you overtake several vehicles. A vehicle approaches you from behind with indicators and headlights flashing. What should you do?,"The dense, aggressive tailgating of the following vehicle endangers all road users. For this reason, you should try to change to the right-hand lane in compliance with the safety distance. Any braking maneuver would only worsen this dangerous situation. Switching on the hazard light is prohibited in this case.",I continue driving until I can again pull into the right-hand lane,I turn on my hazard lights briefly to urge the vehicle behind to keep its distance,I brake briefly to prompt the vehicle behind to keep its distance,,Avtomagistralda bir nechta transport vositasini quvib o‘tayapsiz. Ortingizdan burilish ko‘rsatkichlari va faralarini chaqnatib bir transport vositasi yaqinlashmoqda. Nima qilishingiz kerak?,Ortga juda yaqin kelib agressiv siqish barcha yo‘l ishtirokchilariga xavf tug‘diradi. Shuning uchun xavfsiz masofaga rioya qilgan holda o‘ng yo‘lakka o‘tishga harakat qiling. Har qanday tormozlash manevri bu xavfli vaziyatni yanada yomonlashtiradi. Bu holatda avariya chiroqlarini yoqish taqiqlanadi.,Yana o‘ng yo‘lakka kira olgunimcha haydashda davom etaman,Ortimdagi transport masofa saqlasin deb qisqa avariya chiroqlarini yoqaman,Ortimdagi transport masofa saqlasin deb qisqa tormoz beraman,
2.1.11-125,en,uz,You want to overtake. Why should you not do so?,"A car driver may only overtake if he/she can see that the opposite lane is free. In this situation, the oncoming traffic cannot be seen, so you must not overtake.",The oncoming traffic,The bend in the road,The state of the road surface,,Siz quvib o‘tmoqchisiz. Nega buni qilmasligingiz kerak?,"Haydovchi faqat qarama-qarshi yo‘lak bo‘shligini ko‘ra olsa quvib o‘tishi mumkin. Bu vaziyatda qarama-qarshi transport ko‘rinmayapti, shuning uchun quvib o‘tishingiz mumkin emas.",Qarama-qarshi transport,Yo‘l burilishi,Yo‘l qoplamasi holati,
2.1.11-126,en,uz,You were in a bad mood prior to commencing your journey. What consequences should you avoid when driving?,"Anything that could negatively affect your safe driving should be avoided. Besides distractions, this also includes aggressiveness. If you're upset, do not get behind the wheel immediately afterwards.",Distraction,Aggressiveness,Caution,,Safarni boshlashdan oldin kayfiyatingiz yomon edi. Haydashda qanday oqibatlardan saqlanishingiz kerak?,"Xavfsiz haydashga salbiy ta’sir qilishi mumkin bo‘lgan hamma narsadan saqlanish kerak. Chalg‘ishdan tashqari, agressivlik ham bunga kiradi. Jahlingiz chiqqan bo‘lsa, darhol rulga o‘tirmang.",Chalg‘ish,Agressivlik,Ehtiyotkorlik,
2.1.11-127,en,uz,Which is the stamp of a responsible driver?,"A responsible car driver expects mistakes from other road users and does not sit behind the wheel while he/she is very tired or cannot control his/her feelings. Furthermore, he/she does not always insist on his right and cannot be distracted.",He anticipates the mistakes of other road users,He avoids driving when tired,He is assertive towards other road traffic,,Mas’uliyatli haydovchini nima belgilaydi?,"Mas’uliyatli haydovchi boshqa yo‘l ishtirokchilarining xatolarini kutadi, juda charchaganida yoki hissiyotlarini nazorat qila olmaganda rulga o‘tirmaydi. Shuningdek, u har doim o‘z haqini talab qilmaydi va chalg‘imaydi.",U boshqa yo‘l ishtirokchilarining xatolarini oldindan hisobga oladi,U charchaganda haydashdan saqlanadi,U boshqa yo‘l harakatiga nisbatan qat’iylik ko‘rsatadi,
2.1.11-128,en,uz,What emotions can influence driving behaviour?,"Strong emotions such as anger, fear and sadness as well as joy and exuberance usually influence the driving behavior. They distract the car driver from the road and often lead to risky, aggressive or over-cautious driving. Only when you're calm and balanced you should participate in traffic.",Happiness and exuberance,Worry and sorrow,Anger and rage,,Qaysi hissiyotlar haydash xatti-harakatiga ta’sir qilishi mumkin?,"G‘azab, qo‘rquv, qayg‘u, shuningdek quvonch va haddan tashqari ko‘tarinkilik kabi kuchli hissiyotlar odatda haydashga ta’sir qiladi. Ular haydovchini yo‘ldan chalg‘itadi va ko‘pincha xavfli, agressiv yoki haddan tashqari ehtiyotkor haydashga olib keladi. Faqat tinch va muvozanatli bo‘lganingizda yo‘l harakatida qatnashing.",Xursandchilik va ko‘tarinkilik,Xavotir va qayg‘u,Jahl va g‘azab,
2.1.11-129,en,uz,What indications mean you should interrupt your journey?,"Brief microsleep often causes devastating accidents. If you have to yawn frequently, can barely keep your eyes open, or have trouble keeping your lane, you should stop your journey and take a rest.",Yawning frequently,Difficulty keeping your eyes open,Difficulties staying in lane,,Qaysi belgilar safarni to‘xtatishingiz kerakligini bildiradi?,"Qisqa mikrouyqu ko‘pincha og‘ir avariyalarga sabab bo‘ladi. Agar tez-tez esnasangiz, ko‘zlaringizni zo‘rg‘a ochiq tutsangiz yoki yo‘lakda qolishda qiynalsangiz, safarni to‘xtatib dam olishingiz kerak.",Tez-tez esnash,Ko‘zlarni ochiq tutishda qiynalish,Yo‘lakda qolishda qiynalish,
2.1.11-130,en,uz,Your passenger wants to discuss something with you during the journey. What should you do?,"You should not be distracted while driving. If your passenger wants to discuss with you, you should stop the journey.",- my driving,- the discussion,,,Yo‘lovchingiz safar davomida siz bilan biror narsani muhokama qilmoqchi. Nima qilishingiz kerak?,"Haydash vaqtida chalg‘imasligingiz kerak. Agar yo‘lovchi siz bilan jiddiy muhokama qilmoqchi bo‘lsa, safarni to‘xtatganingiz ma’qul.",- haydashimga,- muhokamaga,,
2.1.11-131,en,uz,During the journey your passenger informs you that you are repeatedly tailgating. What should you do?,"You should take the safety advice of passengers seriously. Keep a larger distance. Within built-up areas, the distance to the vehicle in front should be at least three car lengths or approx. 15 m. Outside built-up areas, you should follow the ""two-second rule of thumb"".",I take the passenger’s comments seriously,I maintain a greater distance,I ignore the passenger’s comments,,Safar davomida yo‘lovchingiz siz juda yaqin yurayotganingizni bir necha bor aytdi. Nima qilishingiz kerak?,Yo‘lovchilarning xavfsizlik bo‘yicha maslahatlarini jiddiy qabul qiling. Kattaroq masofa saqlang. Aholi yashash hududida oldingi transport vositasigacha masofa kamida uch avtomobil uzunligi yoki taxminan 15 m bo‘lishi kerak. Tashqarida esa “ikki soniya qoidasi”ga amal qiling.,Yo‘lovchining fikrlarini jiddiy qabul qilaman,Kattaroq masofa saqlayman,Yo‘lovchining fikrlarini e’tiborsiz qoldiraman,
2.1.11-132,en,uz,"At a red light in a built-up area, another driver apparently wants to provoke you into a street race. What should you do?","Don't be provoked and stay calm. Since road races are strictly prohibited, you should not pay attention to this behavior.",I totally ignore this behaviour,"I accept the challenge, but without exceeding 50 km/h",I get out and confront the driver,,Aholi yashash hududida qizil chiroqda boshqa haydovchi sizni ko‘cha poygasiga undayotgandek. Nima qilishingiz kerak?,"Provokatsiyaga berilmang va xotirjam qoling. Yo‘l poygalari qat’iyan taqiqlangan, shuning uchun bunday xatti-harakatga e’tibor bermang.",Bu xatti-harakatni butunlay e’tiborsiz qoldiraman,50 km/soatdan oshmasdan chaqiriqni qabul qilaman,"Tushib, haydovchi bilan gaplashaman",
2.1.11-133,en,uz,What frequently causes young people to have “disco accidents”?,"Young drivers in particular have less experience driving at night with crowded vehicles. In addition, the risk of accidents increases due to distracting passengers.",A lack of experience driving after dark,Little experience with fully occupied vehicles,A distraction caused by passengers,,Yoshlarning “diskoteka avariyalari”ga ko‘pincha nima sabab bo‘ladi?,"Ayniqsa yosh haydovchilarda tunda va yo‘lovchilar bilan to‘la avtomobilda haydash tajribasi kam bo‘ladi. Bundan tashqari, yo‘lovchilar chalg‘itgani sabab avariya xavfi ortadi.",Qorong‘ida haydash tajribasining yetishmasligi,To‘liq yo‘lovchi bilan to‘lgan transport vositalarida tajribaning kamligi,Yo‘lovchilar sabab chalg‘ish,
2.1.11-201,en,uz,"At a red light in a built-up area, another driver apparently wants to provoke you into a street race. What should you do?",Racing will increase your risk of accidents and put people at risk. You should ignore such behaviors,I totally ignore this behaviour,"I accept the challenge, but without exceeding 50 km/h",I get out and confront the driver,,Aholi yashash hududida qizil chiroqda boshqa haydovchi sizni ko‘cha poygasiga undayotgandek. Nima qilishingiz kerak?,Poyga avariya xavfini oshiradi va odamlarni xavf ostiga qo‘yadi. Bunday xatti-harakatlarni e’tiborsiz qoldirishingiz kerak.,Bu xatti-harakatni butunlay e’tiborsiz qoldiraman,50 km/soatdan oshmasdan chaqiriqni qabul qilaman,"Tushib, haydovchi bilan gaplashaman",
2.2.02-001,en,uz,You are driving on a road with one lane in each direction and want to turn left. Where should you position yourself?,"When turning left in this situation, go towards the center of the road (which is the left side of your lane)",- towards the centre of the roadway,- on the right-hand edge of the roadway,,,Siz har bir yo‘nalishda bitta yo‘lakli yo‘lda ketyapsiz va chapga burilmoqchisiz. Qayerda joylashishingiz kerak?,"Bunday vaziyatda chapga burilishda yo‘lning markaziga, ya’ni o‘z yo‘lagizning chap tomoniga yaqinlashing.",- qatnov qismining markazi tomon,- qatnov qismining o‘ng chetida,,
2.2.02-002,en,uz,Are you allowed to use your motorized bicycle on the pavement?,"Yes but only if you push it, you cannot ride on the pavement","Yes, if the motorized bicycle is cautiously pushed","Yes, if the motorized bicycle is used as a bicycle","Yes, also using the engine when traffic on the roadway is too dense",,Motorli velosipedingizdan piyodalar yo‘lagida foydalanishingiz mumkinmi?,"Ha, lekin faqat uni itarib yursangiz. Piyodalar yo‘lagida minib yurish mumkin emas.","Ha, agar motorli velosiped ehtiyotkorlik bilan itarilsa","Ha, agar motorli velosiped oddiy velosiped sifatida ishlatilsa","Ha, yo‘ldagi harakat juda zich bo‘lsa, dvigatel bilan ham",
2.2.02-003,en,uz,"Several cars are waiting in the right-hand lane at a ""red"" traffic light. Are you allowed to pass the cars cautiously on the right?",In this case you can behave similarly to a bicycle and can pass the car on the right if there is enough space,"Yes, provided there is adequate space on the roadway","Yes, provided you use the pavement","No, you must always wait behind the last car",,Bir nechta avtomobil o‘ng yo‘lakda qizil svetoforda kutmoqda. Siz avtomobillar yonidan o‘ng tomondan ehtiyotkorlik bilan o‘tishingiz mumkinmi?,"Bu holatda velosipedga o‘xshash harakat qilishingiz mumkin va yetarli joy bo‘lsa, avtomobillar yonidan o‘ng tomondan o‘tishingiz mumkin.","Ha, qatnov qismida yetarli joy bo‘lsa","Ha, piyodalar yo‘lagidan foydalansangiz","Yo‘q, har doim oxirgi avtomobil ortida kutishingiz kerak",
2.2.02-006,en,uz,You are driving on a road outside a built-up area with three lanes marked in each direction. Individual slower vehicles are travelling well spaced out in the right-hand lane. Which lane may you use continuously?,"The left-hand lane may only be used by a car driver for the temporary overtaking of other vehicles. Continuous driving on the middle lane is permitted, however, if the road is located outside built-up areas and provided with a line marking. This also applies if only a few vehicles are on the right lane.",The middle lane,The left-hand lane,,,"Siz aholi yashash hududidan tashqaridagi, har bir yo‘nalishda uchta belgilangan yo‘lakli yo‘lda ketyapsiz. O‘ng yo‘lakda ayrim sekin transport vositalari katta masofa bilan ketmoqda. Qaysi yo‘lakdan doimiy foydalanishingiz mumkin?","Chap yo‘lakdan avtomobil haydovchisi faqat vaqtincha quvib o‘tish uchun foydalanishi mumkin. Biroq aholi yashash hududidan tashqarida va chiziqlar bilan belgilangan yo‘lda o‘rta yo‘lakda doimiy yurishga ruxsat beriladi, hatto o‘ng yo‘lakda faqat oz sonli transport bo‘lsa ham.",O‘rta yo‘lak,Chap yo‘lak,,
2.2.02-007,en,uz,What risks could arise if you drive in the right-hand lane alongside a truck?,A truck will diminish both your visibility and other people on the road seeing you (including the driver of the truck),- be overlooked by the driver of the truck,- be overlooked by other road users,- overlook other road users,,"Yuk mashinasi yonida o‘ng yo‘lakda harakatlansangiz, qanday xavflar yuzaga kelishi mumkin?","Yuk mashinasi sizning ko‘rinishingizni ham, boshqa yo‘l ishtirokchilari sizni ko‘rishini ham kamaytiradi, jumladan yuk mashinasi haydovchisi ham sizni ko‘rmay qolishi mumkin.",- yuk mashinasi haydovchisi meni ko‘rmay qolishi,- boshqa yo‘l ishtirokchilari meni ko‘rmay qolishi,- boshqa yo‘l ishtirokchilarini ko‘rmay qolishim,
2.2.02-008,en,uz,What applies to you at the next junction?,Coming soon...,- turn left,- turn right,- drive straight ahead,,Keyingi chorrahada sizga nima amal qiladi?,Tez orada...,- chapga burilish,- o‘ngga burilish,- to‘g‘ri yurish,
2.2.02-009-M,en,uz,You would like to turn right. What is the right course of action now?,A motorcycle should behave similarly to a car and wait behind the blue car.,I remain behind the [blue car],I drive up to the stop line,I drive up to the line of sight,,Siz o‘ngga burilmoqchisiz. Hozir to‘g‘ri harakat qanday?,Mototsikl avtomobilga o‘xshash harakat qilishi va ko‘k avtomobil ortida kutishi kerak.,[Ko‘k avtomobil] ortida qolaman,To‘xtash chizig‘igacha boraman,Ko‘rish chizig‘igacha boraman,
2.2.02-010,en,uz,What cycle paths may you use to drive your moped?,You may ride your moped on cycle paths outside built-up areas and on cycle paths inside built-up areas if an additional sign permits this.,Cycle paths outside of a built-up area,"Cycle paths within a built-up area, if this is permitted by an additional sign","Cycle paths within a built-up area, if there is too much traffic on the road",,Mopedingiz bilan qaysi veloyo‘laklardan foydalanishingiz mumkin?,"Moped bilan aholi yashash hududidan tashqaridagi veloyo‘laklarda va qo‘shimcha belgi ruxsat bersa, aholi yashash hududidagi veloyo‘laklarda yurishingiz mumkin.",Aholi yashash hududidan tashqaridagi veloyo‘laklar,"Qo‘shimcha belgi ruxsat bersa, aholi yashash hududidagi veloyo‘laklar","Yo‘lda harakat juda ko‘p bo‘lsa, aholi yashash hududidagi veloyo‘laklar",
